title,description,publishedAt,url,category,cleaned_text
Scary Survey Results: Teen Drivers Are Often Looking at Their Phones,"New troubling research found that entertainment is the most common reason teens use their phones behind the wheel, followed by texting and navigation.",2025-07-03T04:01:03Z,https://www.cnet.com/tech/mobile/scary-survey-results-teen-drivers-are-always-looking-at-their-phones/,entertainment,scary survey result teen driver often looking phone new troubling research found entertainment common reason teen use phone behind wheel followed texting navigation
A Group of Young Cybercriminals Poses the ‘Most Imminent Threat’ of Cyberattacks Right Now,"The Scattered Spider hacking group has caused chaos among retailers, insurers, and airlines in recent months. Researchers warn that its flexible structure poses challenges for defense.",2025-07-02T17:56:04Z,https://www.wired.com/story/scattered-spider-most-imminent-threat/,entertainment,group young cybercriminals pose ‘most imminent threat’ cyberattacks right scattered spider hacking group caused chaos among retailer insurer airline recent month researcher warn flexible structure pose challenge defense
"LG Gram 17 Touchscreen Laptop Copilot+ PC Is $3,000 Off, This 5-Star 2025 Model at 60% Off Is Going Fast",Save 60% on the LG Gram 17 touchscreen laptop for a limited time at Amazon.,2025-07-02T15:10:45Z,https://gizmodo.com/lg-gram-17-touchscreen-laptop-copilot-pc-is-3000-off-this-5-star-2025-model-at-60-off-is-going-fast-2000622898,entertainment,lg gram 17 touchscreen laptop copilot pc 3000 5star 2025 model 60 going fast save 60 lg gram 17 touchscreen laptop limited time amazon
'I have his word' - Fury coming back in 2026 says Saudi supremo,"Former world heavyweight champion Tyson Fury will come out of retirement in 2026, Saudi boxing power broker Turki Alalshikh hints.",2025-07-02T22:04:08Z,https://www.bbc.com/sport/boxing/articles/c79qlxee70jo,entertainment,word fury coming back 2026 say saudi supremo former world heavyweight champion tyson fury come retirement 2026 saudi boxing power broker turki alalshikh hint
Dominique Thorne Breaks Down That Shocking ‘Ironheart’ Cliffhanger,Marvel Studios' latest series just dropped its final three episodes on Disney+.,2025-07-02T20:30:22Z,https://gizmodo.com/dominique-thorne-breaks-down-that-shocking-ironheart-cliffhanger-2000623456,entertainment,dominique thorne break shocking ‘ironheart’ cliffhanger marvel studio latest series dropped final three episode disney
Eyes of Wakanda's Sneak Peek Doesn't Clarify If Black Panther Will Show Up,"Once again, Marvel Animation is showcasing the fact that it’s been saving the MCU’s ass for years. A little over 2 ½ years after the Black Panther prequel show was announced, we finally get a sneak peek at how beautiful Eyes of Wakanda will be when the four-e…",2025-07-01T21:15:14Z,https://kotaku.com/black-panther-eyes-of-wakanda-marvel-animation-mcu-1851785467,entertainment,eye wakandas sneak peek doesnt clarify black panther show marvel animation showcasing fact it’s saving mcu’s as year little 2 ½ year black panther prequel show announced finally get sneak peek beautiful eye wakanda foure…
Scooter Braun to Step Down as CEO of HYBE America,Scooter Braun will step away from his role as CEO of HYBE America after four years heading the U.S. wing of the Korean entertainment giant.,2025-07-01T16:36:35Z,http://www.rollingstone.com/music/music-news/scooter-braun-leave-ceo-hybe-america-1235375913/,entertainment,scooter braun step ceo hybe america scooter braun step away role ceo hybe america four year heading u wing korean entertainment giant
Dead Take is an FMV horror with Midsomer Murders' Ben Starr and Casualty's Neil Newbon,"We all have things we liked that we didn't realise were considered a bit naff at the time, and for me that thing was FMV games. Well, I win. FMV games are back and cool again. Which, by extension, basically means Dragon's Lair was good. I don't make the rules…",2025-07-02T08:25:14Z,https://www.rockpapershotgun.com/dead-take-is-an-fmv-horror-with-midsomer-murders-ben-starr-and-casualtys-neil-newbon,entertainment,dead take fmv horror midsomer murder ben starr casualty neil newbon thing liked didnt realise considered bit naff time thing fmv game well win fmv game back cool extension basically mean dragon lair good dont make rules…
The NO FAKES Act Has Changed – And It’s So Much Worse,"A bill purporting to target the issue of misinformation and defamation caused by generative AI has mutated into something that could change the internet forever, harming speech and innovation from here on out. The Nurture Originals, Foster Art and Keep Entert…",2025-07-02T22:43:00Z,https://www.techdirt.com/2025/07/02/the-no-fakes-act-has-changed-and-its-so-much-worse/,entertainment,fake act changed – it’s much worse bill purporting target issue misinformation defamation caused generative ai mutated something could change internet forever harming speech innovation nurture original foster art keep entert…
"Timothée Chalamet, Shaquille O'Neal, Miley Cyrus and More to Receive Stars on Hollywood Walk of Fame","SummaryThe Hollywood Walk of Fame Class of 2026 includes a diverse group of major talents such as Miley Cyrus, Timothée Chalamet, Demi Moore and Shaquille O’NealHonorees span Motion Pictures (e.g., Emily Blunt, Rami Malek), Recordings (e.g., Angélique Kidjo),…",2025-07-03T04:27:44Z,https://hypebeast.com/2025/7/timothee-chalamet-shaquille-oneal-miley-cyrus-stars-hollywood-walk-of-fame-announcement,entertainment,timothée chalamet shaquille oneal miley cyrus receive star hollywood walk fame summarythe hollywood walk fame class 2026 includes diverse group major talent miley cyrus timothée chalamet demi moore shaquille o’nealhonorees span motion picture eg emily blunt ramus malek recording eg angélique kidjo…
"Sean 'Diddy' Combs found not guilty of sex trafficking and racketeering, but guilty on lesser charges","Sean ""Diddy"" Combs' trial finally ended with a mixed verdict. The Manhattan jury heard more than six weeks of testimony from 34 government witnesses.",2025-07-02T14:32:34Z,https://www.businessinsider.com/diddy-guilty-sean-combs-trial-verdict-2025-7,entertainment,sean diddy comb found guilty sex trafficking racketeering guilty lesser charge sean diddy comb trial finally ended mixed verdict manhattan jury heard six week testimony 34 government witness
AMC Entertainment Raises Fresh Cash To Shore Up Balance Sheet Amid Resurgent Box Office,"As part of a long push to dig itself out of a financial hole triggered by the Covid pandemic, AMC Entertainment announced a multi-pronged agreement with creditors and lenders to reduce its leverage and take out near-term maturities. First, lenders will provid…",2025-07-01T15:42:21Z,http://deadline.com/2025/07/amc-entertainment-raises-fresh-cash-to-strengthen-balance-sheet-1236446713/,entertainment,amc entertainment raise fresh cash shore balance sheet amid resurgent box office part long push dig financial hole triggered covid pandemic amc entertainment announced multipronged agreement creditor lender reduce leverage take nearterm maturity first lender provid…
"Oaktree Capital Buys FilmRise, Merges It With Shout! Studios In New Radial Entertainment","EXCLUSIVE: Los Angeles-based private equity group Oaktree Capital Management is following its 2023 acquisition of Shout! Studios with a deal for FilmRise, a leading indie distributor of digital streaming content. Shout! recently acquired Gravitas Ventures. Oa…",2025-07-01T16:00:00Z,http://deadline.com/2025/07/oaktree-capital-buys-filmrise-merges-it-with-shout-studios-1236446579/,entertainment,oaktree capital buy filmrise merges shout studio new radial entertainment exclusive los angelesbased private equity group oaktree capital management following 2023 acquisition shout studio deal filmrise leading indie distributor digital streaming content shout recently acquired gravitas venture oa…
"‘Weird History’ Is An Account That Shares Interesting, Odd, And Funny Things That Happened Throughout History (43 Pics)","They say truth is stranger than fiction, and they’re not wrong. We often look for entertainment on the big screen or media only to forget the biggest amusement park of wonder, exploration and ingenuity called human history.",2025-07-01T22:40:34Z,https://www.boredpanda.com/weird-history-photos-msn/,entertainment,‘weird history’ account share interesting odd funny thing happened throughout history 43 pic say truth stranger fiction they’re wrong often look entertainment big screen medium forget biggest amusement park wonder exploration ingenuity called human history
Scooter Braun To Step Down as CEO of HYBE America,"SummaryScooter Braun has officially resigned as CEO of HYBE America to pursue new ventures, transitioning into an executive advisory roleDespite stepping down as CEO, Braun will remain a director on HYBE's Board of Directors and serve as a Senior Advisor to H…",2025-07-01T23:06:26Z,https://hypebeast.com/2025/7/scooter-braun-step-down-as-ceo-of-hybe-america-announcement,entertainment,scooter braun step ceo hybe america summaryscooter braun officially resigned ceo hybe america pursue new venture transitioning executive advisory roledespite stepping ceo braun remain director hybes board director serve senior advisor h…
"Tomorrowland Brings Its Majesty To China With ""The Magic of Tomorrowland""","SummaryTomorrowland is bringing ""The Magic of Tomorrowland"" to Shanghai on November 22This marks the festival's first indoor showcase and inaugural event in ChinaThe show at HERO DOME promises an immersive experience with exclusive DJ setsTomorrowland, in col…",2025-07-03T05:59:14Z,https://hypebeast.com/2025/7/the-magic-of-tomorrowland-music-festival-shanghai-china-2025-announcement-info,entertainment,tomorrowland brings majesty china magic tomorrowland summarytomorrowland bringing magic tomorrowland shanghai november 22this mark festival first indoor showcase inaugural event chinathe show hero dome promise immersive experience exclusive dj setstomorrowland col…
What the Diddy verdict could mean for the rap mogul — and the entertainment industry at large,"On Wednesday, Sean (Diddy) Combs was convicted of two counts of transportation to engage in prostitution. But looking to both expert opinion and reaction among fellow members of the entertainment industry, it would hardly seem to be a doomsday scenario for th…",2025-07-02T02:20:52Z,https://www.cbc.ca/news/entertainment/diddy-verdict-1.7575676,entertainment,diddy verdict could mean rap mogul — entertainment industry large wednesday sean diddy comb convicted two count transportation engage prostitution looking expert opinion reaction among fellow member entertainment industry would hardly seem doomsday scenario th…
Cassie Ventura's lawyer gives statement on 'Diddy' split verdict: 'She paved the way',"Cassie Ventura's lawyer has released a statement after the Sean ""Diddy"" Combs split verdict.",2025-07-02T16:19:08Z,https://abcnews.go.com/GMA/Culture/cassie-venturas-lawyer-releases-statement-diddy-split-verdict/story?id=123351258,entertainment,cassie venturas lawyer give statement diddy split verdict paved way cassie venturas lawyer released statement sean diddy comb split verdict
"Diddy verdict shows feds overreached when they called him a mob boss, ex-prosecutors say",Former federal prosecutors say Sean Combs' verdict shows the jury didn't believe the hip-hop mogul was a mob boss.,2025-07-02T18:25:46Z,https://www.businessinsider.com/diddy-verdict-feds-overreached-racketeering-charge-mob-boss-2025-7,entertainment,diddy verdict show fed overreached called mob bos exprosecutors say former federal prosecutor say sean comb verdict show jury didnt believe hiphop mogul mob bos
How Gen Alpha Will Travel: New Report Says AI And Entertainment Can Reshape Trip Planning,"Artificial intelligence, social media and TV shows will play a role in how the next generation travels. This report has insight on what it might be like.",2025-07-01T12:15:00Z,https://www.forbes.com/sites/ramseyqubein/2025/07/01/how-gen-alpha-will-travel-new-report-says-ai-and-entertainment-can-reshape-trip-planning/,entertainment,gen alpha travel new report say ai entertainment reshape trip planning artificial intelligence social medium tv show play role next generation travel report insight might like
Accel Entertainment Makes Amendments To Its Bylaws to Improve Corporate Governance,"Accel Entertainment, Inc. (NYSE:ACEL) is one of the 12 Small Cap Stocks with High Upside Potential. Accel Entertainment, Inc. (NYSE:ACEL) made amendments to ...",2025-07-01T06:42:17Z,https://finance.yahoo.com/news/accel-entertainment-makes-amendments-bylaws-064217692.html,entertainment,accel entertainment make amendment bylaw improve corporate governance accel entertainment inc nyseacel one 12 small cap stock high upside potential accel entertainment inc nyseacel made amendment
Marvel Unveils New Animated Series 'Eyes of Wakanda',"SummaryEyes of Wakanda premieres August 27 as a four-episode animated series exploring Wakanda’s history through the Hatut ZerazeThe series is set within the official MCU timeline, offering a deeper look into the Black Panther legacy and Wakandan valuesMarvel…",2025-07-02T08:35:48Z,https://hypebeast.com/2025/7/marvel-animation-eyes-of-wakanda-sneak-peek-release-info,entertainment,marvel unveils new animated series eye wakanda summaryeyes wakanda premiere august 27 fourepisode animated series exploring wakanda’s history hatut zerazethe series set within official mcu timeline offering deeper look black panther legacy wakandan valuesmarvel…
Sukeban's Female Wrestling League Is Coming To Anime Expo In Los Angeles,SummarySukeban World Champion Sareee Bomb will defend her title in the ring.The event will be held in Los Angeles for the first time.Tickets for the four-day event are available now.Live sports and entertainment titan Sukeban is bringing its popular Anime-foc…,2025-07-01T19:02:14Z,https://hypebeast.com/2025/7/sukeban-wrestling-anime-expo-los-angeles-info,entertainment,sukebans female wrestling league coming anime expo los angeles summarysukeban world champion sareee bomb defend title ringthe event held los angeles first timetickets fourday event available nowlive sport entertainment titan sukeban bringing popular animefoc…
The Most Recommended VPN Is Giving Away Amazon Gift Cards (Limited Time),"With inflation on the rise, the only thing getting cheaper is VPN protection. Take advantage of this NodVPN + Amazon Gift Card deal.",2025-07-02T23:30:21Z,https://gizmodo.com/the-most-recommended-vpn-is-giving-away-amazon-gift-cards-limited-time-2000620635,entertainment,recommended vpn giving away amazon gift card limited time inflation rise thing getting cheaper vpn protection take advantage nodvpn amazon gift card deal
Samsung delays Ballie robot launch as pricing raise concerns,"Samsung’s Ballie robot won’t launch this summer. The Ballie delay comes as Samsung refines the product and struggles to set a price.
The post Samsung delays Ballie robot launch as pricing raise concerns appeared first on Phandroid.",2025-07-02T06:02:30Z,https://phandroid.com/2025/07/02/samsung-delays-ballie-robot-launch-as-pricing-raise-concerns/,entertainment,samsung delay ballie robot launch pricing raise concern samsung’s ballie robot won’t launch summer ballie delay come samsung refines product struggle set price post samsung delay ballie robot launch pricing raise concern appeared first phandroid
Visual Effects Pioneer And Moonvalley Exec Ed Ulbrich On Industry’s Embrace Of AI: “The Stigma Is Going To Be Gone”,"Ed Ulbrich is fairly self-effacing about his calling as a builder of bridges between entertainment and technology. “I’m trying to help save the world from boredom,” he explains. That semi-facetious description sells him short, of course. Prior to landing last…",2025-07-02T15:30:56Z,http://deadline.com/2025/07/visual-effects-pioneer-ed-ulbrich-moonvalley-exec-post-ai-revolution-1236438695/,entertainment,visual effect pioneer moonvalley exec ed ulbrich industry’s embrace ai “the stigma going gone” ed ulbrich fairly selfeffacing calling builder bridge entertainment technology “i’m trying help save world boredom” explains semifacetious description sell short course prior landing last…
"Kevin Smith Joins As EP On Matt Walsh Movie ‘The Unexpecteds’, Sets October Release","EXCLUSIVE: Clerks filmmaker Kevin Smith has boarded the Matt Smith indie comedy action movie, The Unexpecteds as an EP with the title receiving a Oct. 14 digital release via MVD Entertainment Group. The Unexpecteds follows Gary (2x Emmy nominee Matt Walsh) an…",2025-07-02T19:04:16Z,http://deadline.com/2025/07/kevin-smith-matt-walsh-the-unexpecteds-release-date-1236448178/,entertainment,kevin smith join ep matt walsh movie ‘the unexpecteds’ set october release exclusive clerk filmmaker kevin smith boarded matt smith indie comedy action movie unexpecteds ep title receiving oct 14 digital release via mvd entertainment group unexpecteds follows gary 2x emmy nominee matt walsh an…
The Oslo Company & Sputnik Media Join European Indie Producer Collective Thirtyfour Media,"EXCLUSIVE: Producers from Belgium and Norway have joined European indie producer collective Thirtyfour Media. The Oslo Company out of Norway and Belgian prodco Sputnik Media have joined Thirtyfour Media, which was set up by former Banijay exec Joris Gijsberts…",2025-07-01T08:19:05Z,http://deadline.com/2025/07/thirtyfour-media-expands-with-belgium-norway-producers-1236446110/,entertainment,oslo company sputnik medium join european indie producer collective thirtyfour medium exclusive producer belgium norway joined european indie producer collective thirtyfour medium oslo company norway belgian prodco sputnik medium joined thirtyfour medium set former banijay exec joris gijsberts…
Iconic sound of modern music goes full circle,Legendary British amp maker Orange has been at the heart and soul of music since the late 1960s. Your favorite artists have likely tapped into the iconic sound at some point. Now we can all get in a sonic spin with the O Turntable.Continue ReadingCategory: Ho…,2025-07-02T11:40:40Z,https://newatlas.com/home-entertainment/orange-o-turntable/,entertainment,iconic sound modern music go full circle legendary british amp maker orange heart soul music since late 1960s favorite artist likely tapped iconic sound point get sonic spin turntablecontinue readingcategory ho…
"Tri-laser projector throws big, bright, cinematic visuals from inches away","If you're looking for a big-screen TV alternative that doesn't dominate the room when not in use, ultra-short-throw projectors are a good shout. The PT1 from Hisense brings Dolby Vision and IMAX to 4K viewing at up to 150 inches.Continue ReadingCategory: Home…",2025-07-01T13:58:21Z,https://newatlas.com/home-entertainment/hisense-pt1-trichroma-laser-projector/,entertainment,trilaser projector throw big bright cinematic visuals inch away youre looking bigscreen tv alternative doesnt dominate room use ultrashortthrow projector good shout pt1 hisense brings dolby vision imax 4k viewing 150 inchescontinue readingcategory home…
"‘F1’ Is Pretty Good, Better Than Most Hollywood Motorsports Movies","For entertainment and an intro to Formula 1 racing, the new ‘F1’ film is worth the price of a ticket. With Brad Pitt and Lewis Hamilton involved, it’s hard to go wrong.",2025-07-01T18:15:42Z,https://www.forbes.com/sites/jimclash/2025/07/01/f1-is-pretty-good-better-than-most-hollywood-motorsports-movies/,entertainment,‘f1’ pretty good better hollywood motorsports movie entertainment intro formula 1 racing new ‘f1’ film worth price ticket brad pitt lewis hamilton involved it’s hard go wrong
‘It’s Always Sunny in Philadelphia’ Fan Mocks ‘Rob Mac’ News With Fake Article About Charlie Day’s Rebrand,Bush Bill pokes fun at the other most confusing name in the ‘Always Sunny’ credits,2025-07-01T16:45:00Z,https://www.cracked.com/article_47189_its-always-sunny-in-philadelphia-fan-mocks-rob-mac-news-with-fake-article-about-charlie-days-rebrand.html,entertainment,‘it’s always sunny philadelphia’ fan mock ‘rob mac’ news fake article charlie day’s rebrand bush bill poke fun confusing name ‘always sunny’ credit
What could happen to Sean 'Diddy' Combs' wealth? Experts weigh in.,The jury in the Sean “Diddy” Combs trial began deliberations on Monday,2025-07-01T21:39:43Z,https://abcnews.go.com/Business/happen-sean-diddy-combs-wealth-experts-weigh/story?id=122985500,entertainment,could happen sean diddy comb wealth expert weigh jury sean “diddy” comb trial began deliberation monday
Sean 'Diddy' Combs verdict: What's next for the rap mogul?,"After Sean ""Diddy"" Combs was found guilty of two of the five charges he faced in his racketeering conspiracy and sex trafficking trial, what's next for the rap mogul?",2025-07-02T20:00:42Z,https://abcnews.go.com/US/sean-diddy-combs-guilty-whats-next/story?id=123412310,entertainment,sean diddy comb verdict whats next rap mogul sean diddy comb found guilty two five charge faced racketeering conspiracy sex trafficking trial whats next rap mogul
"15 Best Brad Pitt Movies, Ranked","Brad Pitt's career now spans several decades. So, let's try and rank the Oscar winner's 15 greatest roles and movies (a not so simple task).",2025-07-01T15:10:00Z,https://www.slashfilm.com/1899405/brad-pitt-best-movies-ranked/,entertainment,15 best brad pitt movie ranked brad pitt career span several decade let try rank oscar winner 15 greatest role movie simple task
Charlie Day Says He Wants to Make More of This Type of ‘It’s Always Sunny in Philadelphia’ Episode,"By
 Carly Tennes
 Published: July 02nd, 2025",2025-07-02T20:30:00Z,https://www.cracked.com/article_47217_charlie-day-says-he-wants-to-make-more-of-this-type-of-its-always-sunny-in-philadelphia-episode.html,entertainment,charlie day say want make type ‘it’s always sunny philadelphia’ episode carly tennes published july 02nd 2025
Adult-Film Star Kylie Page Dead at 28 From Suspected Overdose,"Adult-film star Kylie Page has died in Los Angeles from a suspected overdose, TMZ can confirm. Kylie died on June 25 ... she was found in her Hollywood residence after a concerned friend called law enforcement to check in on her, police sources…",2025-07-02T16:34:27Z,https://www.tmz.com/2025/07/02/adult-film-star-kylie-page-dead-suspected-overdose/,entertainment,adultfilm star kylie page dead 28 suspected overdose adultfilm star kylie page died los angeles suspected overdose tmz confirm kylie died june 25 found hollywood residence concerned friend called law enforcement check police sources…
Xbox VR might be my handheld of choice,"“Personally, I think Xbox hardware is dead,” decried Laura Fryer, one of Microsoft Game Studios’ founding employees, in a recent YouTube video.  Sparking Fryer’s fear for the hardware legacy of Xbox was Microsoft’s reveal of the ROG Xbox Ally, a collaboration…",2025-07-01T21:24:08Z,https://www.polygon.com/gaming/610167/xbox-vr-handheld-quest-3s-game-pass,entertainment,xbox vr might handheld choice “personally think xbox hardware dead” decried laura fryer one microsoft game studios’ founding employee recent youtube video sparking fryer’s fear hardware legacy xbox microsoft’s reveal rog xbox ally collaboration…
Prime Day Echo Dot Deal Makes Spider-Man Your Friendly Virtual Assistant,"Limited Edition Echo Dot Spider-Man Stand 
 $30 (was $40) / Bundle it with a new Echo Dot for $32 (was $50) 
See at Amazon 
While Prime Day 2025 doesn’t officially begin until July 8, there are already some great early deals on Amazon devices. The fifth ge…",2025-07-02T19:17:00Z,https://www.gamespot.com/articles/prime-day-echo-dot-deal-makes-spider-man-your-friendly-virtual-assistant/1100-6532911/,entertainment,prime day echo dot deal make spiderman friendly virtual assistant limited edition echo dot spiderman stand 30 40 bundle new echo dot 32 50 see amazon prime day 2025 doesn’t officially begin july 8 already great early deal amazon device fifth ge…
Incredible Sonic The Hedgehog Rubber Duck Plushies Hit New Low Prices,"Sonic the Hedgehog Tubbz Duck Plush (9 Inches) 
 $18.60 (was $25) 
See at Amazon 
Doctor Eggman Tubbz Duck Plush (9 Inches) 
 $21.10 (was $25) 
See at Amazon 
Sonic the Hedgehog fans can save on two of the cutest and silliest collectibles featuring Sega…",2025-07-01T03:29:00Z,https://www.gamespot.com/articles/tubbz-rubber-duck-plush-sonic-the-hedgehog-amazon-deals/1100-6532858/,entertainment,incredible sonic hedgehog rubber duck plushies hit new low price sonic hedgehog tubbz duck plush 9 inch 1860 25 see amazon doctor eggman tubbz duck plush 9 inch 2110 25 see amazon sonic hedgehog fan save two cutest silliest collectible featuring sega…
Save 50% On Amazon Prime With New Young Adults Subscription,"We're less than a week away from Amazon Prime Day 2025. While some deals will be available to everyone during the four-day sales event (July 8-11), many of the best offers will be exclusive to Prime members. If you don't have a membership and are between the …",2025-07-02T15:05:00Z,https://www.gamespot.com/articles/save-50-on-amazon-prime-with-new-young-adults-subscription/1100-6532770/,entertainment,save 50 amazon prime new young adult subscription less week away amazon prime day 2025 deal available everyone fourday sale event july 811 many best offer exclusive prime member dont membership …
