title,description,publishedAt,url,category,cleaned_text
"Move over Twitch plays Pokemon - Gemini is now playing, and it's panicking","People may be tuning over to a new Pokémon playthrough, one that is being done by an A.I. that is new on the scene. But it's been panicking lately.",2025-07-02T17:01:12Z,https://www.xda-developers.com/gemini-playing-pokemon-and-panicking/,entertainment,move twitch play pokemon gemini playing panicking people may tuning new pokémon playthrough one done ai new scene panicking lately
Eat to the Beat 2025 Lineup: Get the Full Concert Schedule,"Welcome back to the EPCOT Eat to the Beat Concert Series presented by Florida Blue, returning in 2025. One of the headlining events of the EPCOT International Food & Wine Festival, the Eat to the Beat Concert Series is returning with help from the team at Dis…",2025-07-02T14:05:41Z,https://disneyparksblog.com/wdw/eat-to-the-beat-2025-lineup-full-concert-schedule/,entertainment,eat beat 2025 lineup get full concert schedule welcome back epcot eat beat concert series presented florida blue returning 2025 one headlining event epcot international food wine festival eat beat concert series returning help team dis…
"PARCO GRAND BAZAR Features Screenwriter Koki Mitani's Traditional Art, Bunraku: ""Ningyo Girai""","Since Ikebukuro PARCO opened in 1969, the brand has been a purveyor of culture throughout the Showa, Heisei and Reiwa eras. Continuing to share its colorful outlook with wide audiences, PARCO announced this year’s ""GRAND BAZAR,"" a major biannual event that wi…",2025-07-02T17:05:05Z,https://hypebeast.com/2025/7/parco-grand-bazar-features-screenwriter-koki-mitani-traditional-performing-arts-piece,entertainment,parco grand bazar feature screenwriter koki mitanis traditional art bunraku ningyo girai since ikebukuro parco opened 1969 brand purveyor culture throughout showa heisei reiwa era continuing share colorful outlook wide audience parco announced year’s grand bazar major biannual event wi…
FilmRise and Shout! Studios Merge to Launch Radial Entertainment,"The move comes as the former is being acquired by funds managed by Oaktree Capital Management
The post FilmRise and Shout! Studios Merge to Launch Radial Entertainment appeared first on TheWrap.",2025-07-01T17:28:26Z,https://www.thewrap.com/filmrise-shout-studios-merger-radial-entertainment/,entertainment,filmrise shout studio merge launch radial entertainment move come former acquired fund managed oaktree capital management post filmrise shout studio merge launch radial entertainment appeared first thewrap
Taufik Batisah hints at possible 20th anniversary concert in October in social media teasers,"In recent days, Singapore Idol winner Taufik Batisah uploaded teasers, seemingly hinting that he will stage a concert on Oct 25 this year.",2025-07-01T04:16:09Z,https://cnalifestyle.channelnewsasia.com/entertainment/taufik-batisah-hints-concert-october-2025-467251,entertainment,taufik batisah hint possible 20th anniversary concert october social medium teaser recent day singapore idol winner taufik batisah uploaded teaser seemingly hinting stage concert oct 25 year
"AU Deals: The Next Wave of Steam Sale Must-owns Drop, Console Game Prices Follow Suit, and More!","Whether you're chasing cosy comfort, bold experimentation or big-ticket RPGs at slashed prices, there’s gold to be found here.",2025-07-01T01:36:49Z,https://www.ign.com/articles/au-deals-the-next-wave-of-steam-sale-must-owns-drop-console-game-prices-follow-suit-and-more,entertainment,au deal next wave steam sale mustowns drop console game price follow suit whether youre chasing cosy comfort bold experimentation bigticket rpgs slashed price there’s gold found
Flamingo Las Vegas Is Ready For Summer With New Restaurants And Go Pool,"The makeover of Flamingo Las Vegas includes the Go Pool, Pinky's By Vanderpump, Gordon Ramsay Burger and Havana 1957",2025-07-02T19:38:54Z,https://www.forbes.com/sites/andywang/2025/07/02/flamingo-las-vegas-is-ready-for-summer-with-new-restaurants-and-go-pool/,entertainment,flamingo la vega ready summer new restaurant go pool makeover flamingo la vega includes go pool pinky vanderpump gordon ramsay burger havana 1957
Airbnb Study Shows US Travel Stays Strong With Travel Hacking Growing,Travel behavior stays strong as consumer demand for domestic travel fuels growth.  July 4th is heavy travel period. Airbnb and Priceline released studies.,2025-07-02T22:07:35Z,https://www.forbes.com/sites/jefffromm/2025/07/02/airbnb-study-shows-us-travel-stays-strong-with-travel-hacking-growing/,entertainment,airbnb study show u travel stay strong travel hacking growing travel behavior stay strong consumer demand domestic travel fuel growth july 4th heavy travel period airbnb priceline released study
"Russell and Gibson-Park, the dream that is about to become a reality","Finn Russell and Jamison Gibson-Park could be a devastating Lions partnership against the Queensland Reds and beyond, writes Tom English.",2025-07-01T17:20:03Z,https://www.bbc.com/sport/rugby-union/articles/c8e44n06j9yo,entertainment,russell gibsonpark dream become reality finn russell jamison gibsonpark could devastating lion partnership queensland red beyond writes tom english
"AMC Entertainment reaches an agreement with creditors to reduce debt, including raising ~$223.3M and converting $143M of debt into equity; AMC falls ~6% (Connor Hart/Wall Street Journal)","Connor Hart / Wall Street Journal:
AMC Entertainment reaches an agreement with creditors to reduce debt, including raising ~$223.3M and converting $143M of debt into equity; AMC falls ~6%  —  Agreement comes after AMC posted a wider loss and lower sales in th…",2025-07-01T14:30:00Z,https://mediagazer.com/250701/p7,entertainment,amc entertainment reach agreement creditor reduce debt including raising 2233m converting 143m debt equity amc fall 6 connor hartwall street journal connor hart wall street journal amc entertainment reach agreement creditor reduce debt including raising 2233m converting 143m debt equity amc fall 6 — agreement come amc posted wider loss lower sale th…
Welcome to Chatsubo - 'Neuromancer' Sci-Fi Series Announcement,"""Welcome to the Chatsubo, cowboy."" Apple TV has debuted a short promo to announce the Neuromancer series is now officially in production - filming on location in Tokyo. This has been a long time in the making! William Gibson's seminal sci-fi masterpiece was p…",2025-07-02T00:52:28Z,https://www.firstshowing.net/2025/chatsubo-neuromancer-scifi-series-announcement/,entertainment,welcome chatsubo neuromancer scifi series announcement welcome chatsubo cowboy apple tv debuted short promo announce neuromancer series officially production filming location tokyo long time making william gibson seminal scifi masterpiece p…
Elizabeth Goodspeed on the rise of the designer as influencer,"As social platforms reward visibility, creatives are increasingly expected to make their practice public. Designers are no longer just making work; they are the work. But what started as promotion now risks swallowing design itself.",2025-07-02T13:00:00Z,https://www.itsnicethat.com/articles/elizabeth-goodspeed-the-rise-of-designer-as-influencer-creative-industry-020725,entertainment,elizabeth goodspeed rise designer influencer social platform reward visibility creatives increasingly expected make practice public designer longer making work work started promotion risk swallowing design
Coffee Break: Armed Madhouse – Are You Not Entertained?,"We have entered an era in which warfare has departed from the conventional (Clausewitzian) concept of attaining clear objectives. Instead, modern armed conflict is characterized by limited and generally inconclusive military clashes motivated by factors disco…",2025-07-01T18:00:36Z,https://www.nakedcapitalism.com/2025/07/coffee-break-armed-madhouse-are-you-not-entertained.html,entertainment,coffee break armed madhouse – entertained entered era warfare departed conventional clausewitzian concept attaining clear objective instead modern armed conflict characterized limited generally inconclusive military clash motivated factor disco…
Jacob Scipio To Star Opposite Edgar Ramírez In Onyx/Hulu Pilot; Leslie Grace Among Series Regulars,"EXCLUSIVE: Jacob Scipio (Bad Boys for Life, Bad Boys: Ride or Die) is set to co-lead the as-yet-untitled real estate drama pilot ordered by the Onyx Collective for Hulu, opposite Edgar Ramirez. The series regular cast includes Leslie Grace (In The Heights), M…",2025-07-02T16:30:36Z,http://deadline.com/2025/07/jacob-scipio-leslie-grace-cast-onyx-hulu-drama-pilot-1236447893/,entertainment,jacob scipio star opposite edgar ramírez onyxhulu pilot leslie grace among series regular exclusive jacob scipio bad boy life bad boy ride die set colead asyetuntitled real estate drama pilot ordered onyx collective hulu opposite edgar ramirez series regular cast includes leslie grace height m…
Glenn Howerton Almost Quit ‘It’s Always Sunny’ Over Fears The Show “Peaked”,"After 20 years of running Paddy’s Pub with the gang, Glenn Howerton has had his share of anxiety about being part of the longest-running live-action comedy series in the US. The actor, who plays toxic narcissist Dennis Reynolds, admitted he was worried It’s A…",2025-07-03T03:37:49Z,http://deadline.com/2025/07/glenn-howerton-almost-quit-its-always-sunny-1236448665/,entertainment,glenn howerton almost quit ‘it’s always sunny’ fear show “peaked” 20 year running paddy’s pub gang glenn howerton share anxiety part longestrunning liveaction comedy series u actor play toxic narcissist dennis reynolds admitted worried it’s a…
Ashton Fontana Joins The Initiative Group As EVP,"EXCLUSIVE: Effective immediately, Ashton Fontana has joined The Initiative Group as an Executive Vice President. The clients following her to Initiative include both established and emerging talent, including 3x Oscar winner Meryl Streep, with whom she has wo…",2025-07-01T19:03:32Z,http://deadline.com/2025/07/the-initiative-group-ashton-fontana-1236447022/,entertainment,ashton fontana join initiative group evp exclusive effective immediately ashton fontana joined initiative group executive vice president client following initiative include established emerging talent including 3x oscar winner meryl streep wo…
"Everything we know about the Sean ""Diddy"" Combs verdict","One of the most powerful men in the entertainment industry was facing the possibility of spending the rest of his life in prison, but a federal jury in New York acquitted Sean ""Diddy"" Combs of the most serious charges against him. Jericka Duncan has details.",2025-07-02T23:14:00Z,https://www.cbsnews.com/video/everything-we-know-about-the-sean-diddy-combs-verdict/,entertainment,everything know sean diddy comb verdict one powerful men entertainment industry facing possibility spending rest life prison federal jury new york acquitted sean diddy comb serious charge jericka duncan detail
What to Do in New York City in July,"Celebrate the Fourth of July with an address on the state of the hot dog, a chance to make ice cream the old-fashioned way and a film that offers up a peculiar slice of Americana.",2025-07-03T09:02:02Z,https://www.nytimes.com/2025/07/03/arts/things-to-do-nyc-july-2025.html,entertainment,new york city july celebrate fourth july address state hot dog chance make ice cream oldfashioned way film offer peculiar slice americana
"Finding the Key to Cézanne, the First Painter I Ever Loved","In the artist's breathtaking quarry pictures, his singular vision runs into the hard facts of deep time.",2025-07-01T01:41:22Z,https://www.nytimes.com/interactive/2025/06/30/arts/cezanne-bibemus-quarry.html,entertainment,finding key cézanne first painter ever loved artist breathtaking quarry picture singular vision run hard fact deep time
5 Minutes That Will Make You Love Art Blakey,"Dig into 13 tracks from this influential drummer and bandleader, chosen by writers and musicians including several former members of his band, the Jazz Messengers.",2025-07-02T09:02:34Z,https://www.nytimes.com/2025/07/02/arts/music/art-blakey-jazz-music.html,entertainment,5 minute make love art blakey dig 13 track influential drummer bandleader chosen writer musician including several former member band jazz messenger
"In ‘A Natural History of the Studio,’ Many William Kentridges Add Up to One","For his latest exhibition, the artist used doppelgängers to investigate how art, and people, are made.",2025-07-03T09:00:30Z,https://www.nytimes.com/2025/07/03/arts/design/in-william-kentridge-hauser-wirth-art.html,entertainment,‘a natural history studio’ many william kentridges add one latest exhibition artist used doppelgängers investigate art people made
The Beauty of Her Animal Heads Is in the Eye of the Beholder,"A sought-after textile artist applies a can-do spirit from her artsy childhood in a Swedish commune to creating animal costume heads for performers. They cost from $2,500 to $3,500.",2025-07-01T04:00:09Z,https://www.nytimes.com/2025/07/01/arts/animal-costume-head-artist-lisa-lauren.html,entertainment,beauty animal head eye beholder soughtafter textile artist applies cando spirit artsy childhood swedish commune creating animal costume head performer cost 2500 3500
The Chefs Transforming Celery Into Dessert,"Plus: necklaces that store perfume, hotels in rural Minorca and more recommendations from T Magazine.",2025-07-03T12:16:01Z,https://www.nytimes.com/2025/07/03/t-magazine/vegetables-dessert-cooking.html,entertainment,chef transforming celery dessert plus necklace store perfume hotel rural minorca recommendation magazine
Wednesday Briefing,President Trump’s signature policy bill.,2025-07-02T04:06:07Z,https://www.nytimes.com/2025/07/02/briefing/trump-gaza-heat.html,entertainment,wednesday briefing president trump’s signature policy bill
Wednesday Briefing: Senate Passes Trump’s Signature Bill,"Plus, a new way to see Cézanne.",2025-07-01T21:02:41Z,https://www.nytimes.com/2025/07/01/briefing/trump-senate-india-heat-thailand-prime-minister.html,entertainment,wednesday briefing senate pass trump’s signature bill plus new way see cézanne
Thursday Briefing,Talks between Israel and Hamas.,2025-07-03T04:44:55Z,https://www.nytimes.com/2025/07/03/briefing/hamas-israel-sean-combs.html,entertainment,thursday briefing talk israel hamas
The Senate and the Supreme Court,"President Trump’s agenda passed in the Senate. It now goes to the House. Plus, we take a close look at this Supreme Court term.",2025-07-02T10:58:09Z,https://www.nytimes.com/2025/07/02/briefing/the-senate-and-the-supreme-court.html,entertainment,senate supreme court president trump’s agenda passed senate go house plus take close look supreme court term
Kae Tempest: Self Titled review – the rhythms in his lyrics are still so distinct,"Despair runs through the Londoner’s fifth album but, in what is essentially a love letter to the trans community, his home town and partner, a strange beauty breaks through",2025-07-04T07:31:11Z,https://www.theguardian.com/culture/2025/jul/04/kae-tempest-self-titled-review,entertainment,kae tempest self titled review – rhythm lyric still distinct despair run londoner’s fifth album essentially love letter trans community home town partner strange beauty break
Mark Gatiss: ‘What does Benedict Cumberbatch smell like? Strawberries’,"As the writer and actor unveils his new detective show Bookish, he sits down for a chat about famous sleuths, the odds of a return to Royston Vasey and what it’s like working with Tom Cruise",2025-07-03T07:00:23Z,https://www.theguardian.com/culture/2025/jul/03/mark-gatiss-interview-bookish-sherlock-league-gentlemen-doctor-who,entertainment,mark gatiss ‘what benedict cumberbatch smell like strawberries’ writer actor unveils new detective show bookish sits chat famous sleuth odds return royston vasey it’s like working tom cruise
To Kill a Mockingbird: a call to compassion that’s more urgent than ever,The 1962 adaptation of Harper Lee’s enduring courtroom drama is a manifesto for tolerance. It’s lost none of its power today,2025-07-01T15:00:53Z,https://www.theguardian.com/culture/2025/jul/02/to-kill-a-mockingbird-a-call-to-compassion-thats-more-urgent-than-ever,entertainment,kill mockingbird call compassion that’s urgent ever 1962 adaptation harper lee’s enduring courtroom drama manifesto tolerance it’s lost none power today
"My night at the museum … for an ‘adult sleepover’, with lots of dinosaurs and no kids allowed",Museums around the world are opening up for grownups wanting to explore by torchlight and sleep among exhibits. <strong>Clem Bastow</strong> heads to Melbourne Museum to try one out,2025-07-01T15:00:50Z,https://www.theguardian.com/culture/2025/jul/02/adult-sleepover-museums-melbourne-museum,entertainment,night museum … ‘adult sleepover’ lot dinosaur kid allowed museum around world opening grownup wanting explore torchlight sleep among exhibit strongclem bastowstrong head melbourne museum try one
