title,description,publishedAt,url,category,cleaned_text
Death Stranding's 600-Page Novelization Is Free On Audible,"Death Stranding: The Official Novelization Part 1 
 $16.39 (was $17) 
See at Amazon 
Death Stranding: The Official Novelization Part 2 
 $15.34 
See at Amazon 
Death Stranding is a fascinating game about connection, post-apocalyptic society, and finding…",2025-07-01T00:02:00Z,https://www.gamespot.com/articles/death-strandings-600-page-novelization-is-free-on-audible/1100-6532805/,entertainment,death strandings 600page novelization free audible death stranding official novelization part 1 1639 17 see amazon death stranding official novelization part 2 1534 see amazon death stranding fascinating game connection postapocalyptic society finding…
"LA CorpGov Forum Sept 4: Featuring Sports, Entertainment, IPOs, VCs, Activism & Asia",,2025-07-02T18:31:16Z,https://consent.yahoo.com/v2/collectConsent?sessionId=1_cc-session_2e3a00a0-1ca1-4784-ace6-6880d5aa69e7,entertainment,la corpgov forum sept 4 featuring sport entertainment ipo vcs activism asia nan
Hot Wheels’ ‘Back to the Future’ and ‘Jaws’ sets celebrate the magic of big screen,Hot Wheels’ ‘Back to the Future’ and ‘Jaws’ sets celebrate the magic of big screenThe two iconic movies of all time – Back to the Future and Jaws – are celebrating their 40th and 50th anniversary this year. To...,2025-07-01T20:35:54Z,https://www.yankodesign.com/2025/07/01/hot-wheels-back-to-the-future-and-jaws-sets-celebrate-the-magic-of-big-screen/,entertainment,hot wheels’ ‘back future’ ‘jaws’ set celebrate magic big screen hot wheels’ ‘back future’ ‘jaws’ set celebrate magic big screenthe two iconic movie time – back future jaw – celebrating 40th 50th anniversary year
This Netflix Monster Movie With 90% On Rotten Tomatoes Is A Must-Watch For Godzilla Fans,Netflix's well-reviewed Norwegian spin on the giant monster movie genre is worth seeking out whether you're a Godzilla fan or kaiju enthusiast in general.,2025-07-01T20:00:00Z,https://www.slashfilm.com/1901158/netflix-monster-movie-troll-must-watch-godzilla-fans/,entertainment,netflix monster movie 90 rotten tomato mustwatch godzilla fan netflixs wellreviewed norwegian spin giant monster movie genre worth seeking whether youre godzilla fan kaiju enthusiast general
Jennifer Aniston To Star In Apple Series Inspired By Jennette McCurdy’s ‘I’m Glad My Mom Died’ Memoir,"Apple TV+ has greenlighted I’m Glad My Mom Died, a dramedy inspired by Jennette McCurdy’s bestselling memoir of the same name with Jennifer Aniston set to star and executive produce. The casting inevitably brings up questions about the future of Aniston’s pop…",2025-07-01T16:00:00Z,http://deadline.com/2025/07/jennifer-aniston-jennette-mccurdy-im-glad-my-mom-died-morning-show-1236446418/,entertainment,jennifer aniston star apple series inspired jennette mccurdy’s ‘i’m glad mom died’ memoir apple tv greenlighted i’m glad mom died dramedy inspired jennette mccurdy’s bestselling memoir name jennifer aniston set star executive produce casting inevitably brings question future aniston’s pop…
Why Diddy Is Celebrating His Guilty Verdict,The music mogul was acquitted of his most serious charges. What comes next?,2025-07-02T21:16:19Z,https://www.theatlantic.com/culture/archive/2025/07/diddy-trial-verdict/683403/,entertainment,diddy celebrating guilty verdict music mogul acquitted serious charge come next
"41 Interesting, Weird, And Disturbing Finds Shared On This Online Museum","“Being normal is vastly overrated,” declared grandma Aggie Cromwell in Halloweentown (1998). Certainly, life has so much to offer: things curious, magical, mysterious and strange. Weird antiques and vintage objects especially are so interesting to us because …",2025-07-02T19:00:44Z,https://www.boredpanda.com/museum-of-curiosities-pics-msn/,entertainment,41 interesting weird disturbing find shared online museum “being normal vastly overrated” declared grandma aggie cromwell halloweentown 1998 certainly life much offer thing curious magical mysterious strange weird antique vintage object especially interesting u …
67 Totally Random Memes That Shouldn’t Be This Relatable (New Pics),"Relating to others has never been this easy, thanks to the rise of memes. It may not seem like a big deal, but being able to relate to those around us is important for us human beings, as it forges a connection with others that impacts our well-being and happ…",2025-07-02T04:24:58Z,https://www.boredpanda.com/funny-relatable-memes-ibelike/,entertainment,67 totally random meme shouldn’t relatable new pic relating others never easy thanks rise meme may seem like big deal able relate around u important u human being forge connection others impact wellbeing happ…
"Kesha, Evan Rachel Wood, and Others React to the Diddy Verdict","On Wednesday, disgraced music mogul Sean ‘Diddy’ Combs got a mixed verdict that acquitted him of sex trafficking. Here’s how people in the entertainment industry are responding.",2025-07-02T21:25:14Z,http://www.thecut.com/article/celebrities-react-to-diddy-verdict.html,entertainment,kesha evan rachel wood others react diddy verdict wednesday disgraced music mogul sean ‘diddy’ comb got mixed verdict acquitted sex trafficking here’s people entertainment industry responding
This Is Ed Begley Jr.’s All-Time Favorite ‘Arrested Development’ Joke,Stan Sitwell recalls the iconic gag that split his pasted-on sideburns,2025-07-02T20:00:00Z,https://www.cracked.com/article_47215_this-is-ed-begley-jrs-all-time-favorite-arrested-development-joke.html,entertainment,ed begley jr’s alltime favorite ‘arrested development’ joke stan sitwell recall iconic gag split pastedon sideburn
Michael Imperioli Joins Patrick Dempsey In Fox Hitman Thriller Series ‘Memory Of A Killer’,"EXCLUSIVE: Emmy winner Michael Imperioli (The Sopranos, The White Lotus) is set to star opposite Patrick Dempsey in the new Fox straight-to-series thriller drama, Memory of a Killer, from Warner Bros. Television. It’s Imperioli’s first series regular role sin…",2025-07-01T21:23:15Z,http://deadline.com/2025/07/michael-imperioli-memory-of-a-killer-fox-patrick-dempsey-1236447144/,entertainment,michael imperioli join patrick dempsey fox hitman thriller series ‘memory killer’ exclusive emmy winner michael imperioli soprano white lotus set star opposite patrick dempsey new fox straighttoseries thriller drama memory killer warner bros television it’s imperioli’s first series regular role sin…
Movistar Plus+ Pledges To Remain “Driving Force” For Spanish Industry Amid Concerns Over Originals Future,"Movistar Plus+ has again moved to calm fears over its future in original films and TV shows, with senior leaders saying the company remains a “magnet for creative talent” in Spain. Movistar Plus+ CEO Daniel Domenjó last week addressed an audience of more than…",2025-07-01T12:58:24Z,http://deadline.com/2025/07/movistar-plus-bosses-address-industry-concerns-1236446518/,entertainment,movistar plus pledge remain “driving force” spanish industry amid concern original future movistar plus moved calm fear future original film tv show senior leader saying company remains “magnet creative talent” spain movistar plus ceo daniel domenjó last week addressed audience than…
"The new Bose SoundLink Plus portable Bluetooth speaker lets you thump hard, travel light","If you’re looking to establish a personal party perimeter, the Bose SoundLink Plus has few minuses—beyond the premium price.
The post The new Bose SoundLink Plus portable Bluetooth speaker lets you thump hard, travel light appeared first on Popular Science.",2025-07-01T16:45:00Z,https://www.popsci.com/gear/bose-soundlink-plus-portable-bluetooth-party-speaker-review/,entertainment,new bose soundlink plus portable bluetooth speaker let thump hard travel light you’re looking establish personal party perimeter bose soundlink plus minuses—beyond premium price post new bose soundlink plus portable bluetooth speaker let thump hard travel light appeared first popular science
"More free updates are coming to Space Marine 2 following the release of its massive, bloody siege mode","Warhammer 40,000: Space Marine 2 is getting another year of free updates, following the recent release of its massive PvE siege mode. Read more",2025-07-01T11:17:18Z,https://www.eurogamer.net/space-marine-2-is-getting-another-year-of-free-updates-following-the-release-of-its-massive-siege-mode,entertainment,free update coming space marine 2 following release massive bloody siege mode warhammer 40000 space marine 2 getting another year free update following recent release massive pve siege mode read
"In Relooted, gamers plan the perfect heist to reclaim Africa’s stolen artifacts","South African game developer Nyamakop has crafted an unusual title with Relooted, a side-scrolling heist game that transforms cultural repatriation into compelling gameplay. Players assemble diverse crews from across Africa to liberate 70 real artifacts curre…",2025-07-03T05:09:18Z,https://www.trendwatching.com/innovations/in-relooted-gamers-plan-the-perfect-heist-to-reclaim-africas-stolen-artifacts,entertainment,relooted gamers plan perfect heist reclaim africa’s stolen artifact south african game developer nyamakop crafted unusual title relooted sidescrolling heist game transforms cultural repatriation compelling gameplay player assemble diverse crew across africa liberate 70 real artifact curre…
The Batman Fans Need To Watch The Director's Horror Masterpiece While They Wait For The Sequel,"While you're waiting for The Batman Part II to come out, you should watch director Matt Reeves' excellent 2010 remake of a Swedish horror film.",2025-07-01T10:45:00Z,https://www.slashfilm.com/1889132/the-batman-director-matt-reeves-horror-movie-let-me-in/,entertainment,batman fan need watch director horror masterpiece wait sequel youre waiting batman part ii come watch director matt reef excellent 2010 remake swedish horror film
Khloé Kardashian Posts Plastic Surgery Haul,"Apparently, using Instagram comments to list (some of) the work you’ve had done is the new celebrity trend.",2025-07-01T11:16:23Z,https://www.jezebel.com/khloe-kardashian-posts-plastic-surgery-haul,entertainment,khloé kardashian post plastic surgery haul apparently using instagram comment list work you’ve done new celebrity trend
‘Tires’ Renewed For Third Season By Netflix,"Netflix is rolling back Tires for a third season. The scripted comedy that first debuted in 2024 revolves around Will (Steven Gerben), the nervous and unqualified heir to an auto repair chain, who attempts to turn his father’s business around despite constant…",2025-07-01T17:30:00Z,http://deadline.com/2025/07/tires-renewed-third-season-netflix-shane-gillis-1236446365/,entertainment,‘tires’ renewed third season netflix netflix rolling back tire third season scripted comedy first debuted 2024 revolves around steven gerben nervous unqualified heir auto repair chain attempt turn father’s business around despite constant…
"Madeline Delp, Rob Delaney & Ray Fisher Join Apple’s ‘Being Heumann’","EXCLUSIVE: Madeline Delp (Ballroom), Rob Delaney (Dying for Sex), and Ray Fisher (The Piano Lesson) are new additions to Being Heumann, Apple’s civil rights drama based on the bestselling memoir from disability activist Judy Heumann. The trio joins previously…",2025-07-01T16:25:59Z,http://deadline.com/2025/07/being-heumann-casts-madeline-delp-rob-delaney-ray-fisher-1236446777/,entertainment,madeline delp rob delaney ray fisher join apple’s ‘being heumann’ exclusive madeline delp ballroom rob delaney dying sex ray fisher piano lesson new addition heumann apple’s civil right drama based bestselling memoir disability activist judy heumann trio join previously…
‘The Lawrence Welk Show’ Turns 70: A Bubbly TV Flashback,"Celebrating 70 years...""The Lawrence Welk Show"" debuted on this day in 1955.",2025-07-02T14:59:03Z,https://www.forbes.com/sites/marcberman1/2025/07/02/the-lawrence-welk-show-turns-70-a-bubbly-tv-flashback/,entertainment,‘the lawrence welk show’ turn 70 bubbly tv flashback celebrating 70 yearsthe lawrence welk show debuted day 1955
"‘Weird History’ Is An Account That Shares Interesting, Odd, And Funny Things That Happened And Here’s 44 Of Their Best Posts","Probably one of the best things about education in the digital age is just how accessible it is. One click away and you get some of the best bits of knowledge you otherwise would have gone all the way to the library for, hoping to find what you were looking f…",2025-07-01T17:40:25Z,https://www.boredpanda.com/pics-weird-history-msn/,entertainment,‘weird history’ account share interesting odd funny thing happened here’s 44 best post probably one best thing education digital age accessible one click away get best bit knowledge otherwise would gone way library hoping find looking f…
‘South Park’ Creators Blame Season 27 Delay on ‘Shitshow’ Paramount Merger,"Paramount and Skydance inked the $8 billion deal almost a year ago, but have yet to receive FCC approval. Meanwhile, South Park is also stuck in limbo regarding its future streaming home",2025-07-02T17:01:46Z,http://www.rollingstone.com/tv-movies/tv-movie-news/south-park-season-27-delay-paramount-merger-1235377650/,entertainment,‘south park’ creator blame season 27 delay ‘shitshow’ paramount merger paramount skydance inked 8 billion deal almost year ago yet receive fcc approval meanwhile south park also stuck limbo regarding future streaming home
Marisa Abela Latest To Join United Artists’ New ‘Highlander’ Movie,"Industry‘s Marisa Abela is the newest addition to the cast of the new Highlander film from Amazon MGM Studios’ United Artists, Deadline can confirm. Details as to her role are under wraps. She joins a cast that includes Henry Cavill, who plays immortal warrio…",2025-07-02T21:14:19Z,http://deadline.com/2025/07/new-highlander-movie-adds-marisa-abela-1236448400/,entertainment,marisa abela latest join united artists’ new ‘highlander’ movie industry‘s marisa abela newest addition cast new highlander film amazon mgm studios’ united artist deadline confirm detail role wrap join cast includes henry cavill play immortal warrio…
"Deals: M4 iPad Pro up to $299 off, iPad A16 from $284, Apple Pencil Pro, AirTag, and more","Adding to the ongoing list of 4th of July Apple gear deals, which now include iPad mini 7 at $100 off, Apple Watch Series 10 from $299, and much more below, we are starting off with some new current generation iPad deals. You can now score the iPad A16 down a…",2025-07-02T15:44:32Z,https://9to5mac.com/2025/07/02/deals-m4-ipad-pro-ipad-a16-apple-pencil-pro-airtag/,entertainment,deal m4 ipad pro 299 ipad a16 284 apple pencil pro airtag adding ongoing list 4th july apple gear deal include ipad mini 7 100 apple watch series 10 299 much starting new current generation ipad deal score ipad a16 a…
"""I want to support the sweaty boys!"" — Fallout: New Vegas director says it's a ""mistake"" to trade RPG crunch for ""super accessible"" gameplay, and he's right","Obsidian Entertainment's Fallout: New Vegas director Josh Sawyer says it would be a ""mistake"" to get rid of RPG depth and ""crunch"" in pursuit of approachability.",2025-07-01T22:34:14Z,https://www.windowscentral.com/gaming/fallout-new-vegas-director-says-its-a-mistake-to-trade-rpg-crunch-for-super-accessible-gameplay-and-hes-right,entertainment,want support sweaty boy — fallout new vega director say mistake trade rpg crunch super accessible gameplay he right obsidian entertainment fallout new vega director josh sawyer say would mistake get rid rpg depth crunch pursuit approachability
The Beatles’ Apple Corps Names Tom Greene CEO,"Apple Corps Ltd., the operating company that oversees creative and business interests of The Beatles, has tapped British executive Tom Greene as CEO, effective September 25. He will be only the third CEO in the history of the storied company launched in 1968 …",2025-07-01T12:00:00Z,http://deadline.com/2025/07/the-beatles-apple-corps-ltd-names-tom-greene-ceo-1236446531/,entertainment,beatles’ apple corp name tom greene ceo apple corp ltd operating company oversees creative business interest beatles tapped british executive tom greene ceo effective september 25 third ceo history storied company launched 1968 …
"Save An Incredible $1,000 Off A Massive 65-Inch OLED LG TV With This Limited-Time July 4th Deal","We're firm believers that upgrading to a new, bigger TV is the single best thing that you can do to improve your home entertainment experience. The LG C5 series is a great option, and right now, the huge 65-inch version is available with an incredible $1,000 …",2025-07-02T16:37:43Z,https://www.redmondpie.com/save-an-incredible-1000-off-a-massive-65-inch-oled-lg-tv-with-this-limited-time-july-4th-deal/,entertainment,save incredible 1000 massive 65inch oled lg tv limitedtime july 4th deal firm believer upgrading new bigger tv single best thing improve home entertainment experience lg c5 series great option right huge 65inch version available incredible 1000 …
‘Spinal Tap’ Merchandising Earned Its Cast Members $81,Harry Shearer got squat from your Spinal Tap T-shirt,2025-07-02T14:45:00Z,https://www.cracked.com/article_47199_spinal-tap-merchandising-earned-its-cast-members-81.html,entertainment,‘spinal tap’ merchandising earned cast member 81 harry shearer got squat spinal tap tshirt
Club World Cup 'devaluing' football - PFA chief,"The Club World Cup is devaluing football because players cannot perform properly, according to PFA chief executive Maheta Molango.",2025-07-02T16:15:38Z,https://www.bbc.com/sport/football/articles/c0ep9pr53y3o,entertainment,club world cup devaluing football pfa chief club world cup devaluing football player cannot perform properly according pfa chief executive maheta molango
"Game Show ‘Scrambled Up,’ Hosted By Michael Yo, To Launch On Stations September 8","Upcoming syndicated game show ""Scrambled Up,"" hosted by Michael Yo, will debut on stations across the country on September 8.",2025-07-01T23:46:02Z,https://www.forbes.com/sites/marcberman1/2025/07/01/game-show-scrambled-up-hosted-by-michael-yo-to-launch-on-stations-september-8/,entertainment,game show ‘scrambled up’ hosted michael yo launch station september 8 upcoming syndicated game show scrambled hosted michael yo debut station across country september 8
Gov. approves funds for new Browns stadium,"Ohio Gov. Mike DeWine has signed a two-year, $60 billion budget that sets aside $600 million in unclaimed funds for a new Browns stadium.",2025-07-01T18:21:15Z,https://www.espn.com/nfl/story/_/id/45632687/ohio-governor-signs-budget-includes-funds-browns-stadium,entertainment,gov approves fund new brown stadium ohio gov mike dewine signed twoyear 60 billion budget set aside 600 million unclaimed fund new brown stadium
‘Emily In Paris’ Adds Bryan Greenberg & Michèle Laroque To Season 5 Cast; Nico & Laurent G Latest Characters Set To Return,"Lily Collins’ Emily will meet a fellow American expat in the upcoming fifth season of Netflix’s hit comedy Emily In Paris. Bryan Greenberg (Suits LA) has joined the cast as recurring, playing Jake, an American living in Paris. Also set to recur in Season 5 is…",2025-07-02T16:00:00Z,http://deadline.com/2025/07/emily-in-paris-season-5-bryan-greenberg-nico-laurent-g-1236447414/,entertainment,‘emily paris’ add bryan greenberg michèle laroque season 5 cast nico laurent g latest character set return lily collins’ emily meet fellow american expat upcoming fifth season netflix’s hit comedy emily paris bryan greenberg suit la joined cast recurring playing jake american living paris also set recur season 5 is…
Cassie’s Lawyer Says She ‘Paved the Way’ for Diddy’s Conviction,"“By coming forward with her experience, Cassie has left an indelible mark on both the entertainment industry and the fight for justice.”",2025-07-02T17:10:10Z,http://www.vulture.com/article/cassie-reaction-diddy-verdict.html,entertainment,cassie’s lawyer say ‘paved way’ diddy’s conviction “by coming forward experience cassie left indelible mark entertainment industry fight justice”
Comedian Earthquake The Subject Of Planned Multi-Cam Fox Sitcom,Comedian Earthquake is the subject of a potential new live action comedy on Fox from Bill Burr.,2025-07-01T14:10:51Z,https://www.forbes.com/sites/marcberman1/2025/07/01/comedian-earthquake-the-subject-of-planned-multi-cam-fox-sitcom/,entertainment,comedian earthquake subject planned multicam fox sitcom comedian earthquake subject potential new live action comedy fox bill burr
Fun Trailer for Trost's 'The Waves of Madness' Side-Scrolling Film,"""If you get this message - don't send help!"" Umbrella Ent. has revealed an official trailer for an indie action horror film titled The Waves of Madness, from filmmaker Jason Trost. This trailer originally debuted a few months ago, but we're just catching up w…",2025-07-02T14:31:43Z,https://www.firstshowing.net/2025/fun-trailer-for-trosts-the-waves-of-madness-side-scrolling-film/,entertainment,fun trailer trosts wave madness sidescrolling film get message dont send help umbrella ent revealed official trailer indie action horror film titled wave madness filmmaker jason trost trailer originally debuted month ago catching w…
Post-Apocalyptic Action Thriller 'Afterburn' Trailer with Dave Bautista,"""The world is a gladiatorial arena... A worthy opponent is hard to find."" Enter: Bautista.  Inaugural Ent. has revealed the official trailer for a sci-fi action comedy called Afterburn, arriving sometime later this year. The film follows a treasure hunter w…",2025-07-02T19:47:11Z,https://www.firstshowing.net/2025/post-apocalyptic-action-thriller-afterburn-trailer-with-dave-bautista/,entertainment,postapocalyptic action thriller afterburn trailer dave bautista world gladiatorial arena worthy opponent hard find enter bautista inaugural ent revealed official trailer scifi action comedy called afterburn arriving sometime later year film follows treasure hunter w…
"“I’m coming home, baby!”: Diddy celebrates, prays in courtroom following verdict",The music mogul was elated to avoid a potential life sentence [UPDATED],2025-07-02T19:40:14Z,https://www.salon.com/2025/07/02/im-coming-home-baby-diddy-celebrates-prays-in-courtroom-following-verdict/,entertainment,“i’m coming home baby” diddy celebrates prays courtroom following verdict music mogul elated avoid potential life sentence updated
Nintendo confirms Donkey Kong Bananza is being made by the Mario Odyssey team,"Nintendo famously keeps its various game developers under wraps, with the team responsible for a release often only coming to light once the credits roll. However, in a change from the norm, Nintendo revealed the Donkey Kong Bananza development team during a …",2025-07-01T13:00:00Z,https://www.eurogamer.net/nintendo-confirms-donkey-kong-bananza-is-being-made-by-the-mario-odyssey-team,entertainment,nintendo confirms donkey kong bananza made mario odyssey team nintendo famously keep various game developer wrap team responsible release often coming light credit roll however change norm nintendo revealed donkey kong bananza development team …
David Schulner Joins New Fox Drama ‘Memory Of A Killer’ As Co-Showrunner,"EXCLUSIVE: New Amsterdam creator David Schulner is returning to broadcast television, joining the creative team of the new Fox thriller drama Memory of a Killer. He will serve as an executive producer on the project, which has a straight-to-series order, alon…",2025-07-02T20:25:55Z,http://deadline.com/2025/07/david-schulner-memory-of-a-killer-fox-co-showrunner-1236448279/,entertainment,david schulner join new fox drama ‘memory killer’ coshowrunner exclusive new amsterdam creator david schulner returning broadcast television joining creative team new fox thriller drama memory killer serve executive producer project straighttoseries order alon…
‘She Rides Shotgun’ Trailer: Taron Egerton Is an Ex Con Protecting His Daughter from Corrupt Cops in Thriller,"Nick Rowland (""Calm with Horses"") directs the Lionsgate film co-starring Ana Sophia Heger.",2025-07-02T16:00:00Z,https://www.indiewire.com/news/trailers/she-rides-shotgun-trailer-taron-egerton-1235136395/,entertainment,‘she ride shotgun’ trailer taron egerton ex con protecting daughter corrupt cop thriller nick rowland calm horse directs lionsgate film costarring ana sophia heger
TAGN Fantasy Critic League 2025 – Week Twenty-Five and Death Stranding 2,"Welcome to July!  I am couple days late on the usual weekly post, which I have done every Sunday up until this point, but I had places to be over the weekend, so some things fell by the wayside.  Also, the month in review post gets the last day of the month, …",2025-07-01T15:15:11Z,https://tagn.wordpress.com/2025/07/01/tagn-fantasy-critic-league-2025-week-twenty-five-and-death-stranding-2/,entertainment,tagn fantasy critic league 2025 – week twentyfive death stranding 2 welcome july couple day late usual weekly post done every sunday point place weekend thing fell wayside also month review post get last day month …
Rest of country demands unbearable London heat be livestreamed,THE rest of the UK has requested that today’s 33ºC heat in London be viewable on a livestream for their entertainment and pleasure.,2025-07-01T10:03:26Z,https://www.thedailymash.co.uk/news/environment/rest-of-country-demands-unbearable-london-heat-be-livestreamed-20250701258293,entertainment,rest country demand unbearable london heat livestreamed rest uk requested today’s 33ºc heat london viewable livestream entertainment pleasure
