title,description,publishedAt,url,category,cleaned_text
U.S. Will No Longer Recommend Covid Shots for Children and Pregnant Women,Health Secretary Robert F. Kennedy Jr. upended decades of standard protocol in announcing that the vaccine would be dropped from the immunization schedule for healthy children.,2025-05-27T16:22:27Z,https://www.nytimes.com/2025/05/27/health/covid-vaccines-children-pregnant-women-rfk-jr.html,health,u longer recommend covid shot child pregnant woman health secretary robert f kennedy jr upended decade standard protocol announcing vaccine would dropped immunization schedule healthy child
Overwhelmed by company? Five introvert-friendly ways to hang out,"It can be challenging to leave the house when you’re all out of eye contact, but a low social battery doesn’t have to mean a life short on socialising",2025-05-28T15:00:03Z,https://www.theguardian.com/lifeandstyle/2025/may/29/five-introvert-friendly-ways-to-hang-out,health,overwhelmed company five introvertfriendly way hang challenging leave house you’re eye contact low social battery doesn’t mean life short socialising
I did a road journey in England avoiding motorways – and discovered a whole new country | Adrian Chiles,"Aston Clinton, Weedon, Maids Moreton – motorways bypass so many fascinating places. Maybe it is this that makes us an island of strangers",2025-05-28T14:53:00Z,https://www.theguardian.com/lifeandstyle/commentisfree/2025/may/28/on-my-motorbike-i-did-a-road-journey-in-england-avoiding-motorways-and-discovered-a-whole-new-country,health,road journey england avoiding motorway – discovered whole new country adrian chile aston clinton weedon maid moreton – motorway bypass many fascinating place maybe make u island stranger
"The power secret: simple, everyday moves you need for a healthier and happier life ","From preventing serious falls to being able to walk up stairs, it’s power – or how you use your strength – that will bring quality of life as you age",2025-05-28T09:00:07Z,https://www.theguardian.com/lifeandstyle/2025/may/28/the-power-secret-simple-everyday-moves-you-need-for-a-healthier-and-happier-life,health,power secret simple everyday move need healthier happier life preventing serious fall able walk stair it’s power – use strength – bring quality life age
A moment that changed me: I was shy and cared too much what people thought of me. Then a group of K-pop fans came into my life,"From the moment I discovered Korean pop music in my 20s, I was hooked. But it took going to meet other fans to help me find my self-confidence – and my tribe",2025-05-28T05:55:00Z,https://www.theguardian.com/lifeandstyle/2025/may/28/a-moment-that-changed-me-i-was-shy-and-cared-too-much-what-people-thought-of-me-then-a-group-of-k-pop-fans-came-into-my-life,health,moment changed shy cared much people thought group kpop fan came life moment discovered korean pop music 20 hooked took going meet fan help find selfconfidence – tribe
Parenting is shaped by societal expectations and support structures | Letters,Letter: <strong>Su Weeks </strong>compares childcare in Portugal with that in the UK and praises the community-based approach,2025-05-27T15:21:54Z,https://www.theguardian.com/lifeandstyle/2025/may/27/parenting-is-shaped-by-societal-expectations-and-support-structures,health,parenting shaped societal expectation support structure letter letter strongsu week strongcompares childcare portugal uk praise communitybased approach
Drifting away from your friends? Here are 10 questions to bring you closer,"Sometimes friendships end for a good reason, but all too often we just fail to look after them. The right conversation can do a lot to patch things up",2025-05-27T09:00:22Z,https://www.theguardian.com/lifeandstyle/2025/may/27/drifting-away-from-your-friends-here-are-10-questions-to-bring-you-closer,health,drifting away friend 10 question bring closer sometimes friendship end good reason often fail look right conversation lot patch thing
Houseplant clinic: what kind of pots should I put my plants in?,"Ceramic, plastic or terracotta? Each have different properties and not all plants like all kinds of pots – so choose wisely",2025-05-27T09:00:22Z,https://www.theguardian.com/lifeandstyle/2025/may/27/houseplant-clinic-what-kinds-of-pots-should-i-put-my-plants-in,health,houseplant clinic kind pot put plant ceramic plastic terracotta different property plant like kind pot – choose wisely
My partner is non-binary. I’m worried the lack of traditional gender roles is affecting our sex life,"I love my partner, but our intimacy has become a lot less regular recently",2025-05-27T07:00:21Z,https://www.theguardian.com/lifeandstyle/2025/may/27/is-the-lack-of-a-feminine-masculine-dynamic-with-my-non-binary-partner-hindering-our-sex-life,health,partner nonbinary i’m worried lack traditional gender role affecting sex life love partner intimacy become lot less regular recently
Bridal bucket is the best wedding gift | Brief letters,<strong>Brief letters: </strong>Wedding lists | Thames Water | Semicolons | 1950s punctuation | Balaclava fashion | Terminator future,2025-05-26T16:05:09Z,https://www.theguardian.com/lifeandstyle/2025/may/26/bridal-bucket-is-the-best-wedding-gift,health,bridal bucket best wedding gift brief letter strongbrief letter strongwedding list thames water semicolon 1950s punctuation balaclava fashion terminator future
Don’t go up the wall: how to pick paint colours for your home,"Having prepared paint for The Block’s contestants, I understand the pressure to achieve interior design perfection. But choosing colours need not be excruciating",2025-05-26T15:00:03Z,https://www.theguardian.com/lifeandstyle/2025/may/27/dont-go-up-the-wall-how-to-pick-paint-colours-for-your-home,health,don’t go wall pick paint colour home prepared paint block’s contestant understand pressure achieve interior design perfection choosing colour need excruciating
"My petty gripe: I graciously let your car in, now where’s my bloody thank you wave?",I’m a considerate driver. I don’t hog the right lane. I never tailgate. And I let people in ahead of me. But woe betide you if I don’t get acknowledgement,2025-05-26T15:00:00Z,https://www.theguardian.com/lifeandstyle/2025/may/26/my-petty-gripe-i-graciously-let-your-car-in-now-wheres-my-bloody-thank-you-wave,health,petty gripe graciously let car where’s bloody thank wave i’m considerate driver don’t hog right lane never tailgate let people ahead woe betide don’t get acknowledgement
The one change that worked: I began listing everything I bought – and finally got my spending under control,"In an era of targeted ads and contactless payments, it is all too easy to splash out on things you don’t need – or already have. Here’s how I brought some mindfulness to my mindless consumption",2025-05-26T09:00:54Z,https://www.theguardian.com/lifeandstyle/2025/may/26/the-one-change-that-worked-i-began-listing-everything-i-bought-and-finally-got-my-spending-under-control,health,one change worked began listing everything bought – finally got spending control era targeted ad contactless payment easy splash thing don’t need – already here’s brought mindfulness mindless consumption
Is it true that … detox diets flush toxins out of your body?,"The body has a built-in cleansing system that needs energy and nutrients to function well, so you’re better off feeding it",2025-05-26T07:00:51Z,https://www.theguardian.com/lifeandstyle/2025/may/26/is-it-true-that-detox-diets-flush-toxins-out-of-your-body,health,true … detox diet flush toxin body body builtin cleansing system need energy nutrient function well you’re better feeding
A new start after 60: I became a dog-walker – and I’ve never been happier,"Brendan MacNeill spent more than 40 years as a photographer, loving the art but hating the business side. Now he gets paid to lead sheepdogs and labradoodles around Edinburgh’s Braid hills",2025-05-26T05:55:48Z,https://www.theguardian.com/lifeandstyle/2025/may/26/a-new-start-after-60-i-became-a-dog-walker-and-ive-never-been-happier,health,new start 60 became dogwalker – i’ve never happier brendan macneill spent 40 year photographer loving art hating business side get paid lead sheepdog labradoodles around edinburgh’s braid hill
"‘My mother didn’t try to stab my father until I was six’: Alan Alda on childhood, marriage and 60 years of stardom","Best known as Hawkeye in M*A*S*H in the 70s, the 89-year-old actor has topped the Netflix charts with a revamp of his 1981 film The Four Seasons. He talks about Martin Scorsese and Woody Allen – and what he really thinks of Donald Trump",2025-05-26T04:00:47Z,https://www.theguardian.com/lifeandstyle/2025/may/26/my-mother-didnt-try-to-stab-my-father-until-i-was-six-alan-alda-on-childhood-marriage-and-60-years-of-stardom,health,‘my mother didn’t try stab father six’ alan alda childhood marriage 60 year stardom best known hawkeye mash 70 89yearold actor topped netflix chart revamp 1981 film four season talk martin scorsese woody allen – really think donald trump
The kindness of strangers: I thought my wages would be docked but the customer I’d overpaid returned,The till was $20 short – almost a week’s pay. It meant I’d have no money for the Christmas period,2025-05-25T15:00:34Z,https://www.theguardian.com/lifeandstyle/2025/may/26/the-kindness-of-strangers-i-thought-my-wages-would-be-docked-but-the-customer-id-overpaid-returned,health,kindness stranger thought wage would docked customer i’d overpaid returned till 20 short – almost week’s pay meant i’d money christmas period
‘People in the scene would sometimes be mean to us. They’d forget we were teenagers’: Daphne and Celeste look back,"The 00s pop pair on their enduring sisterhood, an embarrassing encounter with Brian Eno, and somehow ending up on a tour of the UK’s Asda supermarkets",2025-05-25T13:00:29Z,https://www.theguardian.com/lifeandstyle/2025/may/25/daphne-and-celeste-pop-duo-look-back,health,‘people scene would sometimes mean u they’d forget teenagers’ daphne celeste look back 00s pop pair enduring sisterhood embarrassing encounter brian eno somehow ending tour uk’s asda supermarket
"‘The giant penis took shape easily, as I passed through a village called Three Cocks’: meet the artist athletes drawing with GPS ","From the phallus on a Welsh hillside, to a huge portrait of Chappell Roan, these Strava runners, riders and skaters have been busy …",2025-05-25T11:00:27Z,https://www.theguardian.com/lifeandstyle/2025/may/25/artist-athletes-drawing-gps-fitness-trackers-strava,health,‘the giant penis took shape easily passed village called three cocks’ meet artist athlete drawing gps phallus welsh hillside huge portrait chappell roan strava runner rider skater busy …
 Dining across the divide: ‘He was quite apologetic about some of his past voting choices’,"Can a jaded lifelong Tory agree with a Green voter on immigration, second homes and Brexit?",2025-05-25T11:00:25Z,https://www.theguardian.com/lifeandstyle/2025/may/25/dining-across-the-divide-david-yung-yung,health,dining across divide ‘he quite apologetic past voting choices’ jaded lifelong tory agree green voter immigration second home brexit
"This is how we do it: ‘I was twice her age, married and her boss. I questioned whether I was a bad person’",Benji and Ava have overcome the age gap and discovered exciting ways to develop their sex life,2025-05-25T10:00:25Z,https://www.theguardian.com/lifeandstyle/2025/may/25/this-is-how-we-do-it-i-was-twice-her-age-married-and-her-boss-i-questioned-whether-i-was-a-bad-person,health,‘i twice age married bos questioned whether bad person’ benji ava overcome age gap discovered exciting way develop sex life
"I’m smitten, but does my boyfriend’s dysfunctional family bode ill for our future? | Ask Annalisa Barbieri",How we’re parented deeply affects us but it doesn’t determine how we are as parents ourselves. It sounds as if your boyfriend understands this,2025-05-25T05:00:18Z,https://www.theguardian.com/lifeandstyle/2025/may/25/im-smitten-but-i-am-worried-that-my-boyfriends-dysfunctional-family-will-impact-our-relationship,health,i’m smitten boyfriend’s dysfunctional family bode ill future ask annalisa barbieri we’re parented deeply affect u doesn’t determine parent sound boyfriend understands
