title,description,publishedAt,url,category,cleaned_text
"I put Garmin's Connect Plus Trails, breathing variations, and rucking sport to the test","The May 2025 Garmin update also added premium golf tools, a passcode, and a marksman timer, but I tested the health and hiking tools on my Fenix 8.",2025-05-25T15:00:20Z,https://www.androidcentral.com/wearables/garmin/i-put-garmins-connect-trails-breathing-variations-and-rucking-sport-to-the-test,health,put garmins connect plus trail breathing variation rucking sport test may 2025 garmin update also added premium golf tool passcode marksman timer tested health hiking tool fenix 8
Here's how newly public Hinge Health wants to use AI to automate more care delivery and bring in more cash,Physical therapy company Hinge Health finally went public Thursday. Its CEO says it's banking on AI to automate more care and drive growth.,2025-05-25T09:00:02Z,https://www.businessinsider.com/public-hinge-health-wants-to-use-ai-care-delivery-2025-5,health,here newly public hinge health want use ai automate care delivery bring cash physical therapy company hinge health finally went public thursday ceo say banking ai automate care drive growth
"5 years after anti-police protests, initiatives for officer mental health have traction","Efforts to improve officers' mental health have grown over the past five years. They were sparked in part by the death of George Floyd, which prompted a wave of anti- police protests.",2025-05-26T11:00:00Z,https://www.npr.org/2025/05/26/nx-s1-5389653/police-protests-mental-health-treatment-growth,health,5 year antipolice protest initiative officer mental health traction effort improve officer mental health grown past five year sparked part death george floyd prompted wave anti police protest
Expert urges calm over mosquito disease found in UK,"Prof Jonathan Ball says tropical viruses are moving north but people should not be ""too concerned"".",2025-05-25T07:20:53Z,https://www.bbc.com/news/articles/c75341zkgd9o,health,expert urge calm mosquito disease found uk prof jonathan ball say tropical virus moving north people concerned
Father of nine children killed by Israeli strike still in critical condition,"Hamdi al-Najjar's ""life remains in danger"", a Bulgarian doctor working at Nasser hospital in southern Gaza tells the BBC.",2025-05-25T15:02:33Z,https://www.bbc.com/news/articles/cp8djlg3zq5o,health,father nine child killed israeli strike still critical condition hamdi alnajjars life remains danger bulgarian doctor working nasser hospital southern gaza tell bbc
Forever chemicals found in American beer — the worst is brewed in this part of the country,"A recent study discovered 95% of beers across the US contain forever chemicals, which have been linked to cancer and other health issues.",2025-05-26T18:38:37Z,https://nypost.com/2025/05/26/health/forever-chemicals-found-in-us-beer-where-the-worst-is-brewed/?utm_source=yahoo&amp;utm_campaign=nypost&amp;utm_medium=referral,health,forever chemical found american beer — worst brewed part country recent study discovered 95 beer across u contain forever chemical linked cancer health issue
I Overlooked These 12 Foods Until I Learned How Healthy They Are,These everyday foods are doing more for my body than I realized.,2025-05-25T12:00:10Z,https://www.cnet.com/health/nutrition/i-overlooked-these-12-foods-until-i-learned-how-healthy-they-are/,health,overlooked 12 food learned healthy everyday food body realized
Researchers make shocking discovery about hidden health threat lurking inside wine bottles: 'Very difficult to assess',The group tested 49 bottles of commercial wine.,2025-05-27T10:30:49Z,https://www.yahoo.com/news/researchers-shocking-discovery-hidden-health-103049632.html,health,researcher make shocking discovery hidden health threat lurking inside wine bottle difficult assess group tested 49 bottle commercial wine
Prison violence harming rehabilitation - families,The BBC speaks to families of criminals in a prison where there have been serious outbreaks of violence.,2025-05-27T05:03:57Z,https://www.bbc.com/news/articles/c9vgg7wemv1o,health,prison violence harming rehabilitation family bbc speaks family criminal prison serious outbreak violence
Garmin drops another Connect+ exclusive in the May 2025 update,"Garmin quietly rolled out a big new update for several of its latest smartwatches, and it’s not just boring bug fixes this time.",2025-05-25T13:52:26Z,https://www.androidcentral.com/wearables/garmin/garmin-drops-another-connect-exclusive-in-the-may-2025-update,health,garmin drop another connect exclusive may 2025 update garmin quietly rolled big new update several latest smartwatches it’s boring bug fix time
India state on alert after ship carrying hazardous cargo capsizes,All 24 crew members on board the ship were rescued by Indian navy personnel after an hours-long operation.,2025-05-26T06:18:17Z,https://www.bbc.com/news/articles/cdd2mr388ypo,health,india state alert ship carrying hazardous cargo capsizes 24 crew member board ship rescued indian navy personnel hourslong operation
Stimulating your vagus nerve could help you live longer. A top scientist shares 3 easy things he does to activate his.,The vagus nerve has a reputation for being an anxiety hack in wellness circles. But research suggests it might play a role in preventing chronic illnesses too.,2025-05-26T07:50:02Z,https://www.businessinsider.com/how-stimulate-activate-vagus-nerve-live-longer-top-scientist-2025-5,health,stimulating vagus nerve could help live longer top scientist share 3 easy thing activate vagus nerve reputation anxiety hack wellness circle research suggests might play role preventing chronic illness
Here's how much it costs to raise a child in each state,"On average, US parents spend 22.6% of their income on costs related to raising their children each year, a report found.",2025-05-25T13:10:02Z,https://www.businessinsider.com/annual-cost-to-raise-a-child-each-state-2025-5,health,here much cost raise child state average u parent spend 226 income cost related raising child year report found
Hundreds of lawyers call for UK sanctions on Israel over Gaza war,"Their letter warns of genocide in Gaza, and calls on the UK to take concrete actions to meet its international legal obligations.",2025-05-27T17:22:57Z,https://www.bbc.com/news/articles/cx274gj54xpo,health,hundred lawyer call uk sanction israel gaza war letter warns genocide gaza call uk take concrete action meet international legal obligation
You Can Earn a Running Day Apple Watch Activity Award on June 4,"Apple's next Apple Watch activity challenge is set to take place on June 4 to celebrate Global Running Day. Apple started hosting an activity challenge for running day last year.





To complete the challenge, Apple Watch owners will need to record a running…",2025-05-27T18:30:35Z,https://www.macrumors.com/2025/05/27/apple-watch-running-day-activity/,health,earn running day apple watch activity award june 4 apple next apple watch activity challenge set take place june 4 celebrate global running day apple started hosting activity challenge running day last year complete challenge apple watch owner need record running…
Royal Caribbean warns cruisers about deadly disease,The cruise line is keeping its passengers informed and working to protect their health.,2025-05-26T15:07:00Z,https://comecruisewith.com/royal-caribbean-alerts-cruisers-about-disease-linked-to-hot-tubs,health,royal caribbean warns cruiser deadly disease cruise line keeping passenger informed working protect health
Creative Branding: Bike For Brain Health Visual Identity,"Creative Branding: Bike For Brain Health Visual Identity

 


 abduzeedo
 05/26 — 2025


 Explore the award-winning ""Bike For Brain Health"" project. See how dynamic art direction and branding create a powerful visual identity for a cause.
Every so often, a de…",2025-05-27T02:48:02Z,https://abduzeedo.com/node/88831,health,creative branding bike brain health visual identity creative branding bike brain health visual identity abduzeedo 0526 — 2025 explore awardwinning bike brain health project see dynamic art direction branding create powerful visual identity cause every often de…
'My husband shouldn't have died from a heart attack at 48',Widows of two men who died from undiagnosed heart conditions call for more routine screening.,2025-05-27T05:27:29Z,https://www.bbc.com/news/articles/cq5435q493do,health,husband shouldnt died heart attack 48 widow two men died undiagnosed heart condition call routine screening
US aid kept many hungry Somali children alive. Now that money is disappearing,The U.S. Agency for International Development once provided 65% of Somalia’s foreign aid. Now that funding is disappearing. The money had been crucial in a...,2025-05-27T03:01:23Z,https://www.yahoo.com/news/us-aid-kept-many-hungry-030123140.html,health,u aid kept many hungry somali child alive money disappearing u agency international development provided 65 somalia’s foreign aid funding disappearing money crucial
CDC Stops Recommending COVID-19 Vaccines for Pregnant Women and Children,"The government's COVID-19 vaccine policies are changing while the science stays the same, experts say.",2025-05-27T20:19:36Z,https://time.com/7288915/cdc-covid-19-vaccines-pregnant-women-children/,health,cdc stop recommending covid19 vaccine pregnant woman child government covid19 vaccine policy changing science stay expert say
"I spoke with the CFOs of Vercel, Mercury, and Cribl about doing business in uncertain times","BI sat down this week with the CFOs of Mercury, Vercel, and Cribl, who shared how they are faring amid market uncertainty and IPO jitters.",2025-05-26T16:00:01Z,https://www.businessinsider.com/late-stage-cfos-about-doing-business-in-uncertain-times-2025-5,health,spoke cfo vercel mercury cribl business uncertain time bi sat week cfo mercury vercel cribl shared faring amid market uncertainty ipo jitter
"What?! The Galaxy Watch Ultra just scored a 40% discount, and I must be dreaming","In a shocking turn of events, Amazon's Memorial Day sale is seeing the price of the Galaxy Watch Ultra slashed by 40% for a limited time.",2025-05-26T17:15:00Z,https://www.androidcentral.com/wearables/what-the-galaxy-watch-ultra-just-scored-a-40-percent-discount-and-i-must-be-dreaming,health,galaxy watch ultra scored 40 discount must dreaming shocking turn event amazon memorial day sale seeing price galaxy watch ultra slashed 40 limited time
"The #1 Nutrient for Brain Health as You Age, According to a Dietitian",,2025-05-25T00:23:00Z,https://consent.yahoo.com/v2/collectConsent?sessionId=1_cc-session_9582d7fd-3669-47ba-970c-532ea57cac73,health,1 nutrient brain health age according dietitian nan
Frustrated job seekers are giving up on their dream roles: 'I'll take almost anything',"In a difficult job market, these Americans are giving up on work they're passionate about and taking whatever they can get for the paycheck.",2025-05-25T08:01:01Z,https://www.businessinsider.com/difficult-job-market-people-take-anything-give-up-dream-job-2025-5,health,frustrated job seeker giving dream role ill take almost anything difficult job market american giving work theyre passionate taking whatever get paycheck
"RFK Jr. cuts COVID-19 vaccine recommendation for healthy kids, pregnant women",The move could alter guidance for doctors as well as some insurance coverage.,2025-05-27T16:05:38Z,https://abcnews.go.com/Politics/rfk-jr-cuts-covid-vaccine-recommendation-healthy-kids/story?id=122233770,health,rfk jr cut covid19 vaccine recommendation healthy kid pregnant woman move could alter guidance doctor well insurance coverage
Donald Trump’s War on Gender Is Also a War on Government,Paisley Currah on how the Trump Administration’s rigid definitions of sex across federal agencies is undermining the administrative state’s ability to protect the public.,2025-05-27T19:08:52Z,https://www.newyorker.com/news/the-lede/donald-trumps-war-on-gender-is-also-a-war-on-government,health,donald trump’s war gender also war government paisley currah trump administration’s rigid definition sex across federal agency undermining administrative state’s ability protect public
10 Best Smartwatches To Consider In May 2025: Find The Perfect Wearable For You,"10 Best Smartwatches To Consider In May 2025: Find The Perfect Wearable For YouSmartwatches aren’t just timepieces—they’re portals to our digital lives, fashion statements, health trackers, and productivity boosters. As technology surges forward in 2025, desi…",2025-05-27T11:40:22Z,https://www.yankodesign.com/2025/05/27/10-best-smartwatches-to-consider-in-may-2025-find-the-perfect-wearable-for-you/,health,10 best smartwatches consider may 2025 find perfect wearable 10 best smartwatches consider may 2025 find perfect wearable yousmartwatches aren’t timepieces—they’re portal digital life fashion statement health tracker productivity booster technology surge forward 2025 desi…
Oura Ring 4: 5 Pros and 2 Cons,"I would buy the Oura Ring 4, but it does have a couple of downsides",2025-05-25T17:09:10Z,https://www.androidpolice.com/reasons-im-a-fan-of-the-oura-ring-4-reasons-why-im-not/,health,oura ring 4 5 pro 2 con would buy oura ring 4 couple downside
Summer Is Almost Here. Here's How to Check for Skin Cancer Signs,"Who doesn't love spending more time in the summer sun? However, it's important to protect your skin and check for signs of skin cancer.",2025-05-27T08:14:02Z,https://www.cnet.com/health/medical/summer-almost-here-how-check-skin-cancer-signs/,health,summer almost here check skin cancer sign doesnt love spending time summer sun however important protect skin check sign skin cancer
'Nine Perfect Strangers' Season 2: How to Watch Episode 3 of the Nicole Kidman Drama,The first two episodes are streaming now.,2025-05-27T19:00:06Z,https://www.cnet.com/tech/services-and-software/nine-perfect-strangers-season-2-how-to-watch-episode-3-of-the-nicole-kidman-drama/,health,nine perfect stranger season 2 watch episode 3 nicole kidman drama first two episode streaming
TIL: timeout in Bash scripts,How to use the `timeout` command to terminate processes after a specified time and how to combine it with `until` for smarter shell scripting.,2025-05-26T11:34:28Z,https://heitorpb.github.io/bla/timeout/,health,til timeout bash script use timeout command terminate process specified time combine smarter shell scripting
Cord blood banking is not living up to its promise,"Banking a baby’s umbilical cord blood was once seen as a reasonable way to protect their future health, but much of that potential has turned out to be mere hype",2025-05-26T15:00:57Z,https://www.newscientist.com/article/2481776-cord-blood-banking-is-not-living-up-to-its-promise/,health,cord blood banking living promise banking baby’s umbilical cord blood seen reasonable way protect future health much potential turned mere hype
Texas lawmakers pass bill making it easier to request vaccine exemptions,"Texas lawmakers have passed a bill that would make it easier for parents to opt out of vaccinating their children, despite the current measles outbreak in West Texas.",2025-05-27T20:21:02Z,https://abcnews.go.com/US/new-texas-bill-makes-easier-request-vaccine-exemptions/story?id=122235535,health,texas lawmaker pas bill making easier request vaccine exemption texas lawmaker passed bill would make easier parent opt vaccinating child despite current measles outbreak west texas
'My life was saved by a stranger on the other side of the world',An Australian man meets his stem-cell donor for the first time after travelling to the UK.,2025-05-27T05:01:50Z,https://www.bbc.com/news/articles/cpqe52pj1d2o,health,life saved stranger side world australian man meet stemcell donor first time travelling uk
New pace of aging measurement reveals trajectories of healthspan and lifespan in older people,"A newly refined method for measuring the Pace of Aging in population-based studies provides a powerful tool for predicting risks associated with aging, including chronic illness, cognitive impairment, disability, and mortality. The method offers researchers a…",2025-05-27T16:44:33Z,https://www.sciencedaily.com/releases/2025/05/250527124433.htm,health,new pace aging measurement reveals trajectory healthspan lifespan older people newly refined method measuring pace aging populationbased study provides powerful tool predicting risk associated aging including chronic illness cognitive impairment disability mortality method offer researcher a…
"Israel solidarity walk in Toronto needed amid rising antisemitism, organizer says",Tens of thousands of people gathered in Toronto on Sunday for an annual fundraising walk in solidarity with Israel — an event participants said is...,2025-05-25T21:47:40Z,https://ca.news.yahoo.com/israel-solidarity-walk-toronto-needed-214740421.html,health,israel solidarity walk toronto needed amid rising antisemitism organizer say ten thousand people gathered toronto sunday annual fundraising walk solidarity israel — event participant said
Next Apple Watch fitness challenge set for June,"On your mark, get set, go! Apple will mark Global Running Day in June for its next virtual fitness challenge.



 more…",2025-05-27T18:28:51Z,https://9to5mac.com/2025/05/27/next-apple-watch-fitness-challenge-set-for-june/,health,next apple watch fitness challenge set june mark get set go apple mark global running day june next virtual fitness challenge more…
Honoring fallen military service members this Memorial Day,"It's Memorial Day. To honor the fallen military service members this year, the Up First newsletter asked readers to share stories of their loved ones.",2025-05-26T10:30:00Z,https://www.npr.org/2025/05/26/g-s1-68701/up-first-newsletter-memorial-day,health,honoring fallen military service member memorial day memorial day honor fallen military service member year first newsletter asked reader share story loved one
"Garmin watches reveal your personal data, and what you can do","TL;DR A walk-through of obtaining sensitive data from a Garmin watch using forensic techniques How digital forensics on a Garmin watch helped solve a double murder case A comparison of Garmin's privacy with other brands including Fitbit, Apple, and Samsung Un…",2025-05-26T15:23:22Z,https://www.pentestpartners.com/security-blog/how-garmin-watches-reveal-your-personal-data-and-what-you-can-do/,health,garmin watch reveal personal data tldr walkthrough obtaining sensitive data garmin watch using forensic technique digital forensics garmin watch helped solve double murder case comparison garmins privacy brand including fitbit apple samsung un…
Huawei Watch Fit 4 Pro & Watch 5 Review: When Fitness Meets Flagship,"Huawei Watch Fit 4 Pro & Watch 5 Review: When Fitness Meets FlagshipWhat happens when you combine titanium alloy, sapphire glass, and aerospace-grade aluminum into a smartwatch that weighs less than six sheets of paper? You get...",2025-05-26T17:37:17Z,https://www.yankodesign.com/2025/05/26/huawei-watch-fit-4-pro-watch-5-review-when-fitness-meets-flagship/,health,huawei watch fit 4 pro watch 5 review fitness meet flagship huawei watch fit 4 pro watch 5 review fitness meet flagshipwhat happens combine titanium alloy sapphire glass aerospacegrade aluminum smartwatch weighs less six sheet paper get
Olympic legend Mary Lou Retton arrested for DUI,"Retton was arrested in West Virginia on May 17, court records show.",2025-05-27T17:00:57Z,https://abcnews.go.com/GMA/Culture/olympic-legend-mary-lou-retton-arrested-dui/story?id=122228978,health,olympic legend mary lou retton arrested duo retton arrested west virginia may 17 court record show
"This Florida woman, 78, lives in her car — as more seniors in the Sunshine State suddenly face homelessness",Older Americans aren't immune to homelessness.,2025-05-26T10:15:00Z,https://www.yahoo.com/news/florida-woman-78-lives-her-101500876.html,health,florida woman 78 life car — senior sunshine state suddenly face homelessness older american arent immune homelessness
A physician who advocates for the power of human touch over technology will deliver Harvard’s commencement speech,"Abraham Verghese is a Stanford University professor, bestselling author and a prominent doctor who advocates for strengthening the physician-patient...",2025-05-26T09:00:50Z,https://www.cnn.com/2025/05/26/us/harvard-commencement-speaker-abraham-verghese,health,physician advocate power human touch technology deliver harvard’s commencement speech abraham verghese stanford university professor bestselling author prominent doctor advocate strengthening physicianpatient
Scientists issue urgent warning after witnessing collapse of iconic insect species: 'Losing them means losing a piece of who we are',"""Now, they're a fleeting memory.""",2025-05-25T10:15:01Z,https://www.yahoo.com/news/scientists-issue-urgent-warning-witnessing-101501009.html,health,scientist issue urgent warning witnessing collapse iconic insect specie losing mean losing piece theyre fleeting memory
The 1 Thing That'll Wash Pesticides Off Fruits And Vegetables,Complicated washes are trending on TikTok. But are they even necessary?View Entire Post ›,2025-05-26T10:31:02Z,https://www.buzzfeed.com/taylortobin/how-to-wash-pesticides-off-fruits-and-vegeatbles-7517545-sc,health,1 thing thatll wash pesticide fruit vegetable complicated wash trending tiktok even necessaryview entire post ›
Why can't we let Taylor Swift take a vacation?,"Critics and Swifties alike have questioned Taylor Swift's hiatus, fueling debates over work-life balance.",2025-05-25T10:01:01Z,https://www.businessinsider.com/where-is-taylor-swift-2025-5,health,cant let taylor swift take vacation critic swifties alike questioned taylor swift hiatus fueling debate worklife balance
"I used to buy my kids expensive clothes out of mom guilt. Now, I only shop for them at consignment shops to save money.","I wanted to give my kids everything I couldn't have growing up, so I bought pricey clothing. That wasn't practical so I now shop at consignment shops.",2025-05-25T12:07:01Z,https://www.businessinsider.com/mom-used-to-buy-pricey-kids-clothes-consignment-2025-5,health,used buy kid expensive clothes mom guilt shop consignment shop save money wanted give kid everything couldnt growing bought pricey clothing wasnt practical shop consignment shop
I'm one of the oldest moms at my kid's elementary school. I no longer feel the need to dress a certain way or volunteer for everything.,"As a mom in her 40s who has been there, done that, I no longer feel the need to keep up with appearances or overextend myself.",2025-05-25T14:20:02Z,https://www.businessinsider.com/oldest-mom-at-kids-elementary-school-easier-than-young-mom-2025-5,health,im one oldest mom kid elementary school longer feel need dress certain way volunteer everything mom 40 done longer feel need keep appearance overextend
Are These Cancer-Preventing Habits A Part Of Your Routine? (Because They Should Be),Keep cancer at bay with these underutilized health tips.,2025-05-27T11:24:00Z,https://www.mindbodygreen.com/articles/3-cancer-preventing-habits-you-should-add-to-your-daily-routine-for-us,health,cancerpreventing habit part routine keep cancer bay underutilized health tip
"Presidential Health, the Brain, and VIP Syndrome",Many people have cognitive slippage as they age and some may try to hide it. We need better ways to face these challenges in ourselves and our leaders.,2025-05-25T16:14:11Z,https://www.psychologytoday.com/us/blog/am-i-my-genes/202505/presidential-health-the-brain-and-vip-syndrome,health,presidential health brain vip syndrome many people cognitive slippage age may try hide need better way face challenge leader
Swapping spit with your spouse may spread anxiety and depression,"In a study of newlywed couples, researchers found that depression and anxiety can be passed from one spouse to the other via the oral microbiome, which is transferred during close contact, such as kissing.Continue ReadingCategory: Mental Health, Brain Health,…",2025-05-26T06:03:00Z,https://newatlas.com/mental-health/oral-microbiome-spouse-anxiety-and-depression/,health,swapping spit spouse may spread anxiety depression study newlywed couple researcher found depression anxiety passed one spouse via oral microbiome transferred close contact kissingcontinue readingcategory mental health brain health…
A self-created fairy story: The rise and fall of Michelle Mone,"A new documentary follows the bra firm founder's journey from poverty to fame, fortune and controversy.",2025-05-25T23:39:00Z,https://www.bbc.com/news/articles/cwyvqqr51pno,health,selfcreated fairy story rise fall michelle mone new documentary follows bra firm founder journey poverty fame fortune controversy
Did Brigitte Macron Push the French President in the Face? What to Know About Their Moment on the Plane,Emmanuel Macron dismisses speculation over Brigitte's gesture as playful interaction.,2025-05-26T16:59:07Z,https://time.com/7288678/macron-wife-brigitte-plane-shove/,health,brigitte macron push french president face know moment plane emmanuel macron dismisses speculation brigittes gesture playful interaction
“I Sadly Thought This Was Normal Behavior For A Long Time”: 19 Signs That Somebody Is Not Okay,Mental health is extremely important for our overall well-being. And not just for our own but for our loved ones as well. Wouldn't it be wonderful if we had the superpower to immediately clock the tiniest hints that someone close to us was having problems wit…,2025-05-27T10:30:11Z,https://www.boredpanda.com/subtle-signs-person-mentally-unwell-msn/,health,“i sadly thought normal behavior long time” 19 sign somebody okay mental health extremely important overall wellbeing loved one well wouldnt wonderful superpower immediately clock tiniest hint someone close u problem wit…
