title,description,publishedAt,url,category,cleaned_text
A MD's Favorite Superfoods & Her Top Tips For Cravings & Blood Sugar Control,"Your guide to recalibrating hunger signals, improving insulin sensitivity, &amp; supporting long-term metabolic health.",2025-05-25T09:59:00Z,https://www.mindbodygreen.com/articles/these-5-simple-habits-support-longevity-blood-sugar-and-brain-health,health,md favorite superfoods top tip craving blood sugar control guide recalibrating hunger signal improving insulin sensitivity amp supporting longterm metabolic health
Want To Stay Sharp? This Simple Habit Can Delay Dementia By 5 Years,This might just be the most fun way to improve cognitive health.,2025-05-27T11:24:00Z,https://www.mindbodygreen.com/articles/this-enjoyable-activity-delays-dementia-onset-by-5-years-early-stage-of-memory-decline,health,want stay sharp simple habit delay dementia 5 year might fun way improve cognitive health
"Israeli strikes kill 30 in Gaza, including rescue service official and local journalist","CAIRO (Reuters) -Israeli military strikes killed at least 30 Palestinians across the Gaza Strip on Sunday, including a senior rescue service official and a...",2025-05-25T09:57:44Z,https://www.yahoo.com/news/israeli-strikes-kill-20-gaza-095744377.html,health,israeli strike kill 30 gaza including rescue service official local journalist cairo reuters israeli military strike killed least 30 palestinian across gaza strip sunday including senior rescue service official
Here's how newly public Hinge Health wants to use AI to automate more care delivery and bring in more cash,"Hinge Health
Physical therapy company Hinge Health finally went public Thursday.
Its CEO says Hinge Health is banking on AI to automate care as it expands beyond physical therapy.
The company says it's automated away about 95% of human clinician hours.
Physic…",2025-05-25T09:06:02Z,https://biztoc.com/x/238231ccf9b382ce,health,here newly public hinge health want use ai automate care delivery bring cash hinge health physical therapy company hinge health finally went public thursday ceo say hinge health banking ai automate care expands beyond physical therapy company say automated away 95 human clinician hour physic…
"Employee asks to work remotely while office bathroom is out of order, boss denies request: 'I’ve been skipping food and water from 6 a.m. to 10 p.m. on office days'","One of the hallmarks of an unnecessarily harsh work environment is when your concerns as an employee are not taken seriously. This can manifest itself in a variety of scenarios. For instance, you could raise serious questions about how a process is handled an…",2025-05-26T12:00:00Z,https://cheezburger.com/40715269/employee-asks-to-work-remotely-while-office-bathroom-is-out-of-order-boss-denies-request-ive-been,health,employee asks work remotely office bathroom order bos denies request i’ve skipping food water 6 10 pm office day one hallmark unnecessarily harsh work environment concern employee taken seriously manifest variety scenario instance could raise serious question process handled an…
How To Pick The Right Commander Deck For Magic The Gathering's Final Fantasy Set,Most Final Fantasy fans have probably heard about the upcoming FF-themed set coming to Magic the Gathering on June 12th. One of the biggest products of the collaboration is a collection of four pre-constructed decks for MTG’s popular “Commander” format. Each …,2025-05-27T19:03:28Z,https://kotaku.com/magic-the-gathering-final-fantasy-commander-cloud-tidus-1851782536,health,pick right commander deck magic gathering final fantasy set final fantasy fan probably heard upcoming ffthemed set coming magic gathering june 12th one biggest product collaboration collection four preconstructed deck mtg’s popular “commander” format …
Want to monitor your phone’s battery health? Too bad if it’s not a Pixel,"Google's latest iteration of Android's Battery Health feature has sparked controversy among Pixel users. The much-anticipated functionality, finally arriving",2025-05-25T15:30:00Z,https://www.talkandroid.com/507551-want-to-monitor-your-phones-battery-health-too-bad-if-its-not-a-pixel/,health,want monitor phone’s battery health bad it’s pixel google latest iteration android battery health feature sparked controversy among pixel user muchanticipated functionality finally arriving
Texas Bill Would Ban Social Media for Minors. Here's What That Would Mean,The Texas law would allow parents to request the deletion of social media accounts for those under 18.,2025-05-27T15:03:16Z,https://www.cnet.com/tech/services-and-software/texas-bill-would-ban-social-media-for-minors-heres-what-that-would-mean/,health,texas bill would ban social medium minor here would mean texas law would allow parent request deletion social medium account 18
“Has Done Wonders For My Mental Health”: 29 Small Life Changes That Made People Happier,"According to the 2023 Global Happiness Survey by Ipsos, on average, two in three people are happy. That's quite good, wouldn't you say? Ongoing wars, the current political climate, doom scrolling, and dystopian-esque economic situation might get anyone down. …",2025-05-27T13:00:17Z,https://www.boredpanda.com/small-changes-made-people-happier-msn/,health,“has done wonder mental health” 29 small life change made people happier according 2023 global happiness survey ipsos average two three people happy thats quite good wouldnt say ongoing war current political climate doom scrolling dystopianesque economic situation might get anyone …
‘Duck Dynasty’ Star Phil Robertson Passes Away At 79 Following Agonizing Health Battle,"‘Duck Dynasty’ patriarch Phil Robertson, who stirred controversy in the past for his derogatory homophobic comments, passed away at the age of 79.",2025-05-26T06:00:55Z,https://www.boredpanda.com/duck-dynastys-phil-robertson-passes-away-at-79/,health,‘duck dynasty’ star phil robertson pass away 79 following agonizing health battle ‘duck dynasty’ patriarch phil robertson stirred controversy past derogatory homophobic comment passed away age 79
Timely initiation of statin therapy for diabetes shown to dramatically reduce risk of heart attack and stroke,"Taking a statin medication is an effective, safe, and low-cost way to lower cholesterol and reduce risk of cardiovascular events. Despite clinicians recommending that many patients with diabetes take statins, nearly one-fifth of them opt to delay treatment. I…",2025-05-27T16:41:28Z,https://www.sciencedaily.com/releases/2025/05/250527124128.htm,health,timely initiation statin therapy diabetes shown dramatically reduce risk heart attack stroke taking statin medication effective safe lowcost way lower cholesterol reduce risk cardiovascular event despite clinician recommending many patient diabetes take statin nearly onefifth opt delay treatment i…
The 5 best states in America for military retirees — and the 5 worst,"Transitioning from the military to civilian life can be difficult no matter where you live in the U.S., but some places put up more barriers than others.Read more...",2025-05-26T09:00:00Z,https://qz.com/military-retirees-veterans-best-worst-us-states-2025-1851781785,health,5 best state america military retiree — 5 worst transitioning military civilian life difficult matter live u place put barrier othersread
Administrative Burdens in Mental Health: The Patient Side,Whether or not someone gets the help they need is often more dependent on their ability to cut through red tape than anything else.,2025-05-26T12:26:05Z,https://www.psychologytoday.com/us/blog/all-about-cognitive-and-behavior-therapy/202505/administrative-burdens-in-mental-health-the,health,administrative burden mental health patient side whether someone get help need often dependent ability cut red tape anything else
More bad news for people looking for a job,"Companies are taking much longer to fill their open roles, and there's one big reason why.",2025-05-27T12:58:58Z,https://www.businessinsider.com/job-market-bad-interviews-tech-white-collar-rejection-economic-uncertainty-2025-5,health,bad news people looking job company taking much longer fill open role there one big reason
Energy Star on the chopping block; better access to mental health care needed: CBC's Marketplace cheat sheet,CBC's Marketplace rounds up the consumer and health news you need from the week.,2025-05-25T12:00:00Z,https://www.cbc.ca/news/business/marketplace-cheat-sheet-may-25-1.7541877,health,energy star chopping block better access mental health care needed cbc marketplace cheat sheet cbc marketplace round consumer health news need week
How Parents Can Support Incoming Students With Mental Health Concerns,Many parents seek ways to support incoming students who have a history of serious mental health concerns. Providing such vital support doesn't have to be daunting.,2025-05-27T03:38:43Z,https://www.forbes.com/sites/ericwood/2025/05/26/how-parents-can-support-incoming-students-with-mental-health-concerns/,health,parent support incoming student mental health concern many parent seek way support incoming student history serious mental health concern providing vital support doesnt daunting
The Body's Role in Emotional Healing,Feeling off? Your body holds clues to your emotional and physical health—learn how to listen and heal.,2025-05-25T12:31:39Z,https://www.psychologytoday.com/us/blog/somatic-psychology/202505/the-bodys-role-in-emotional-healing,health,body role emotional healing feeling body hold clue emotional physical health—learn listen heal
How to Help Kids Navigate Our Dangerous World—With Science,Research has shown ways parents can help children cope with the stressors of modern life,2025-05-26T12:00:00Z,https://www.scientificamerican.com/article/how-to-help-kids-navigate-our-dangerous-world-with-science/,health,help kid navigate dangerous world—with science research shown way parent help child cope stressor modern life
'Duck Dynasty' Star Phil Robertson Dead at 79,"""Duck Dynasty"" patriarch Phil Robertson is dead ... according to his daughter-in-law. Korie Robertson -- Phil's son Willie's wife of more than 30 years -- posted the news to Facebook Sunday ... saying Phil was a man of God, who always tried to…",2025-05-26T00:29:40Z,https://www.tmz.com/2025/05/25/phil-robertson-duck-dynasty-dead-dies/,health,duck dynasty star phil robertson dead 79 duck dynasty patriarch phil robertson dead according daughterinlaw korie robertson phils son willies wife 30 year posted news facebook sunday saying phil man god always tried to…
"5 Ways Reading Makes You Smarter, Healthier And Helps You Live Longer",Discover 5 science-backed benefits of reading and learn how reading makes you smarter and boosts mental health and longevity.,2025-05-27T11:00:13Z,https://www.forbes.com/sites/tracybrower/2025/05/27/5-ways-reading-makes-you-smarter-healthier-and-helps-you-live-longer/,health,5 way reading make smarter healthier help live longer discover 5 sciencebacked benefit reading learn reading make smarter boost mental health longevity
Palestinians wary as US-backed aid group begins operations in Gaza,"CAIRO (Reuters) -Palestinians voiced wariness on Tuesday toward a U.S.-backed foundation set to bring aid to Gaza amid signs of famine, with Hamas warnings...",2025-05-27T12:54:38Z,https://www.yahoo.com/news/palestinians-wary-us-backed-aid-125438557.html,health,palestinian wary usbacked aid group begin operation gaza cairo reuters palestinian voiced wariness tuesday toward usbacked foundation set bring aid gaza amid sign famine hamas warning
When Your Watch Makes You Worry,Suppose you have health anxiety or recurring panic attacks and are using devices to monitor your body symptoms. Chances are you are making things worse for yourself!,2025-05-25T12:07:10Z,https://www.psychologytoday.com/us/blog/liberate-yourself/202505/when-your-watch-makes-you-worry,health,watch make worry suppose health anxiety recurring panic attack using device monitor body symptom chance making thing worse
"Eating A Cup Of This Fruit A Day Supports Brain Health & Memory, Study Finds",It's a sweet one.,2025-05-26T11:20:00Z,https://www.mindbodygreen.com/articles/want-to-support-your-brain-eat-cup-of-this-fruit-day,health,eating cup fruit day support brain health memory study find sweet one
“What Is Actually Healthy But People Think It Is Not?” (28 Answers),"With so many viral wellness trends and health information circulating online, it’s sometimes hard to keep track of what’s healthy and what's not. It can get pretty confusing when you start scrolling on TikTok and the first video you see is promoting intuitive…",2025-05-27T14:30:10Z,https://www.boredpanda.com/actually-healthy-things-people-question-msn/,health,“what actually healthy people think not” 28 answer many viral wellness trend health information circulating online it’s sometimes hard keep track what’s healthy whats get pretty confusing start scrolling tiktok first video see promoting intuitive…
U.S. No Longer Recommends Covid Vaccine For Pregnant Women And Healthy Children,"Health and Human Services Secretary Robert F. Kennedy Jr. announced the change, saying it was based on “common sense” and “good science.”",2025-05-27T15:21:16Z,https://www.forbes.com/sites/tylerroush/2025/05/27/us-no-longer-recommends-covid-vaccine-for-pregnant-women-and-healthy-children/,health,u longer recommends covid vaccine pregnant woman healthy child health human service secretary robert f kennedy jr announced change saying based “common sense” “good science”
AI In Consumer Health: Biohacking And The Path To Self‑Directed Healthcare,"AI is fundamentally changing the way healthcare leaders are helping people manage their health by enabling personalized, data-driven care that places individuals in control.",2025-05-27T11:30:00Z,https://www.forbes.com/councils/forbesbusinesscouncil/2025/05/27/ai-in-consumer-health-biohacking-and-the-path-to-selfdirected-healthcare/,health,ai consumer health biohacking path self‑directed healthcare ai fundamentally changing way healthcare leader helping people manage health enabling personalized datadriven care place individual control
Duck Dynasty's Korie Robertson Details Phil Robertson’s Health Decline,"Phil Robertson’s family knew their time with him was coming to a close.
Just before the Duck Dynasty patriarch died at the age of 79, his daughter-in-law Korie Robertson shared Phil’s health had...",2025-05-27T19:30:19Z,https://www.eonline.com/news/1418015/phil-robertsons-health-decline-detailed-by-family,health,duck dynasty korie robertson detail phil robertson’s health decline phil robertson’s family knew time coming close duck dynasty patriarch died age 79 daughterinlaw korie robertson shared phil’s health
"Dyson Hits All-Time Low Price on Hair Dryer, Amazon Is Going Nuts for Memorial Day",This is quite possibly the best deal Amazon has ever offered on a Dyson product.,2025-05-26T19:02:22Z,https://gizmodo.com/dyson-hits-all-time-low-price-on-hair-dryer-amazon-is-going-nuts-for-memorial-day-2000607360,health,dyson hit alltime low price hair dryer amazon going nut memorial day quite possibly best deal amazon ever offered dyson product
"Forget Apple Watches, This Google Pixel Watch 2 Is 50% Off and a Steal Compared to Black Friday","This Google smartwatch can do just about anything for the money, so snap yours up while you can.",2025-05-27T13:40:17Z,https://gizmodo.com/forget-apple-watches-this-google-pixel-watch-2-is-50-off-and-a-steal-compared-to-black-friday-2000607408,health,forget apple watch google pixel watch 2 50 steal compared black friday google smartwatch anything money snap
"These Birds Are So Stuffed With Plastic, You Can Hear Them Crunch",A dead baby bird—found with 778 pieces of plastic in its stomach—has shattered a grim 15-year record.,2025-05-27T16:15:58Z,https://gizmodo.com/these-birds-are-so-stuffed-with-plastic-you-can-hear-them-crunch-2000607662,health,bird stuffed plastic hear crunch dead baby bird—found 778 piece plastic stomach—has shattered grim 15year record
Far-right marchers attack Palestinians as Israel marks taking of Jerusalem,"Israeli opposition leaders condemned attacks on Palestinians as ""racist"" and a disgrace to Judaism.",2025-05-26T18:22:43Z,https://www.bbc.com/news/articles/czelwkwn3y2o,health,farright marcher attack palestinian israel mark taking jerusalem israeli opposition leader condemned attack palestinian racist disgrace judaism
The CFPB wanted medical debt to be left off credit reports. That's changed under Trump,"Under the Biden administration, the Consumer Financial Protection Bureau finalized a rule barring medical debt from appearing on credit reports. Now, the agency is siding with the credit industry groups suing to have the rule vacated.",2025-05-26T09:00:00Z,https://www.npr.org/2025/05/26/nx-s1-5406799/cfpbs-medical-debt-credit-report-lawsuit,health,cfpb wanted medical debt left credit report thats changed trump biden administration consumer financial protection bureau finalized rule barring medical debt appearing credit report agency siding credit industry group suing rule vacated
Trump cuts could hurt after-school programs that serve low-income students,"Schools in Maine have been at the center of a political battle with the Trump administration. Now, many fear after-school programs, critical for low-income communities, could be lost.",2025-05-27T09:00:00Z,https://www.npr.org/2025/05/27/nx-s1-5398042/trump-cuts-could-harm-after-school-programs,health,trump cut could hurt afterschool program serve lowincome student school maine center political battle trump administration many fear afterschool program critical lowincome community could lost
3 moms in tech who had to RTO share how going back to the office has changed their lives,Three mothers with tech jobs share how RTO policies are reshaping their lives and highlighting the need for flexible work environments.,2025-05-27T09:05:02Z,https://www.businessinsider.com/moms-tech-jobs-rto-changed-lives-families-2025-5,health,3 mom tech rto share going back office changed life three mother tech job share rto policy reshaping life highlighting need flexible work environment
Thousands of people celebrate toddler’s cancer recovery in Istanbul,Thousands of people gathered in Istanbul to celebrate three-year-old Ali Asaf Demir's recovery from leukaemia.,2025-05-26T16:11:39Z,https://www.aljazeera.com/video/newsfeed/2025/5/26/thousands-of-people-celebrate-toddlers-cancer-recovery-in-istanbul,health,thousand people celebrate toddler’s cancer recovery istanbul thousand people gathered istanbul celebrate threeyearold ali asaf demirs recovery leukaemia
Fact-checking Trump’s claims about Medicaid cuts in GOP bill,"House bill alters healthcare programme significantly despite Trump claiming cuts target only 'waste, fraud and abuse'.",2025-05-25T15:33:42Z,https://www.aljazeera.com/news/2025/5/25/fact-checking-trumps-claims-about-medicaid-cuts-in-gop-bill,health,factchecking trump’s claim medicaid cut gop bill house bill alters healthcare programme significantly despite trump claiming cut target waste fraud abuse
"Retail Store Manager’s Mental Health Was Suffering From The Toxic Work Environment, So When His Boss Threatened Him, He Walked Out",Mental health really is more important than money.,2025-05-25T15:35:01Z,http://twistedsifter.com/2025/05/retail-store-managers-mental-health-was-suffering-from-the-toxic-work-environment-so-when-his-boss-threatened-him-he-walked-out/,health,retail store manager’s mental health suffering toxic work environment bos threatened walked mental health really important money
Kennedy says government no longer recommends COVID vaccines for healthy children and pregnant women,U.S. Health Secretary Robert F. Kennedy Jr. says COVID-19 vaccines are no longer recommended for healthy children and pregnant women.,2025-05-27T17:46:09Z,https://biztoc.com/x/4f4a0c2e1885768e,health,kennedy say government longer recommends covid vaccine healthy child pregnant woman u health secretary robert f kennedy jr say covid19 vaccine longer recommended healthy child pregnant woman
"Israeli strike kills at least 20 in Gaza school housing displaced people, health authorities say","An Israeli strike on a school housing displaced people in Gaza killed nearly two dozen people and injured dozens of others, local authorities told Reuters early on Monday.",2025-05-26T08:55:43Z,https://www.cbc.ca/news/world/israeli-strike-gaza-school-1.7543529,health,israeli strike kill least 20 gaza school housing displaced people health authority say israeli strike school housing displaced people gaza killed nearly two dozen people injured dozen others local authority told reuters early monday
Former Mashpee employee files race-based discrimination complaint against the town,"Stephanie Coleman, former administrative secretary for Mashpee Town Manager Rodney Collins, filed a race, color, and retaliation complaint March 25.",2025-05-25T09:01:21Z,https://www.capecodtimes.com/story/news/local/2025/05/25/stephanie-coleman-mashpee-town-manager-rodney-collins-administrative-secretary/83099462007/,health,former mashpee employee file racebased discrimination complaint town stephanie coleman former administrative secretary mashpee town manager rodney collins filed race color retaliation complaint march 25
How Ohana Is Revolutionizing Mental Health By Helping Parents And Kids Build Resilience,"What if we thought about mental health the way we think about physical fitness? Not just as the absence of illness, but as a proactive, daily practice—a skillset that can be cultivated.",2025-05-27T15:30:27Z,https://www.forbes.com/sites/afdhelaziz/2025/05/27/how-ohana-is-revolutionizing-mental-health-by-helping-parents-and-kids-build-resilience/,health,ohana revolutionizing mental health helping parent kid build resilience thought mental health way think physical fitness absence illness proactive daily practice—a skillset cultivated
‘RPDR’s Tina Burner Discovered Autism Diagnosis Thanks To Show’s Therapy Resources,"After first strutting into the ‘Werk Room’ four years ago, Tina Burner is pulling back the wig to share her mental health journey. The RuPaul’s Drag Race Season 13 alum, who is currently competing on Season 10 of All Stars, recently thanked the show’s therapy…",2025-05-25T15:51:40Z,http://deadline.com/2025/05/rpdr-tina-burner-discovered-autism-diagnosis-1236410745/,health,‘rpdr’s tina burner discovered autism diagnosis thanks show’s therapy resource first strutting ‘werk room’ four year ago tina burner pulling back wig share mental health journey rupaul’s drag race season 13 alum currently competing season 10 star recently thanked show’s therapy…
Billy Joel’s Wife Thanks Fans For Outpouring Of Support Following Musician’s Brain Disorder Diagnosis: “We Are Hopeful For His Recovery”,Billy Joel’s wife Alexis Roderick shared a health update for the musician following the outpouring of fan support after it was revealed he was diagnosed with brain disorder normal pressure hydrocephalus (NPH) last week. “Thank you for the outpouring of love a…,2025-05-27T01:38:19Z,http://deadline.com/2025/05/billy-joel-brain-disorder-recovery-update-1236411287/,health,billy joel’s wife thanks fan outpouring support following musician’s brain disorder diagnosis “we hopeful recovery” billy joel’s wife alexis roderick shared health update musician following outpouring fan support revealed diagnosed brain disorder normal pressure hydrocephalus nph last week “thank outpouring love a…
WATCH: Dog and cat face off for last bite of food,"This dog and cat squared off as the feline tried to snatch the pooch's last bite of food earlier this month in Hyderabad, India.",2025-05-25T20:22:32Z,https://abcnews.go.com/Lifestyle/video/dog-cat-face-off-bite-food-122180704,health,watch dog cat face last bite food dog cat squared feline tried snatch pooch last bite food earlier month hyderabad india
WATCH: Truck explosion damages multiple homes in Chicago suburb,"Home security camera video captured the moment a truck exploded, damaging homes in suburban Chicago and injuring the driver. Police believe a leaking propane tank may have triggered the blast.",2025-05-25T20:22:59Z,https://abcnews.go.com/US/video/truck-explosion-damages-multiple-homes-chicago-suburb-122180786,health,watch truck explosion damage multiple home chicago suburb home security camera video captured moment truck exploded damaging home suburban chicago injuring driver police believe leaking propane tank may triggered blast
WATCH: Newly uncovered ABC footage helps family hear late war hero father's voice again,"Capt. Riley L. Pitts died fighting in Vietnam, earning the Medal of Honor for his bravery. Nearly 60 years after his death, his children see and hear him for the first time in decades.",2025-05-27T06:01:03Z,https://abcnews.go.com/Nightline/video/newly-uncovered-abc-footage-helps-family-hear-late-122214122,health,watch newly uncovered abc footage help family hear late war hero father voice capt riley l pitt died fighting vietnam earning medal honor bravery nearly 60 year death child see hear first time decade
Study Finds a Steep Drop in Mothers’ Mental Health,"New research involving nearly 200,000 mothers found that one in 12 rated her mental health as fair or poor.",2025-05-27T21:37:42Z,https://www.nytimes.com/2025/05/27/well/family/maternal-mental-health-study.html,health,study find steep drop mothers’ mental health new research involving nearly 200000 mother found one 12 rated mental health fair poor
