title,description,publishedAt,url,category,cleaned_text
Charter and Cox to combine businesses in $34.5 billion megamerger,Charter and Cox have announced plans to merge in a $34.5 billion deal that will create a cable and internet behemoth. The two telecom companies say the merger will allow them to “aggressively compete” against larger broadband companies and mobile providers th…,2025-05-16T13:41:57Z,https://www.theverge.com/news/668365/charter-cox-megamerger-deal-34-billion,sports,charter cox combine business 345 billion megamerger charter cox announced plan merge 345 billion deal create cable internet behemoth two telecom company say merger allow “aggressively compete” larger broadband company mobile provider th…
"Bluesky is testing a new ‘live’ indicator, starting with the NBA","Bluesky is making it easier to know when an NBA game is happening with a new test that adds a red border to the NBA’s profile picture, along with a “live” callout below it. When you click the profile picture, you’ll be taken out of Bluesky and to whatever liv…",2025-05-19T16:52:18Z,https://www.theverge.com/news/669675/bluesky-nba-live-indicator-broadcasts,sports,bluesky testing new ‘live’ indicator starting nba bluesky making easier know nba game happening new test add red border nba’s profile picture along “live” callout click profile picture you’ll taken bluesky whatever liv…
"Apple Sports App Updated With Improved Access to Standings and NHL Goal Scorers, New Sports Newsletter","Apple today updated its Apple Sports app with several tweaks to improve the user experience, including at-a-glance standings on league pages, highlighting of goal scorers at the top of NHL game pages, and support for the upcoming Relegation Playoff in the Ger…",2025-05-19T17:35:42Z,https://www.macrumors.com/2025/05/19/apple-sports-app-newsletter/,sports,apple sport app updated improved access standing nhl goal scorer new sport newsletter apple today updated apple sport app several tweak improve user experience including ataglance standing league page highlighting goal scorer top nhl game page support upcoming relegation playoff ger…
"Today's NYT Connections: Sports Edition Hints and Answers for May 17, #236","Here's today's Connections: Sports Edition answer and hints for groups. These clues will help you solve The New York Times' popular puzzle game, Connections: Sports Edition, every day.",2025-05-16T20:00:06Z,https://www.cnet.com/tech/gaming/todays-nyt-connections-sports-edition-hints-and-answers-for-may-17-236/,sports,today nyt connection sport edition hint answer may 17 236 here today connection sport edition answer hint group clue help solve new york time popular puzzle game connection sport edition every day
"Today's NYT Connections: Sports Edition Hints and Answers for May 20, #239","Here's today's Connections: Sports Edition answer and hints for groups. These clues will help you solve The New York Times' popular puzzle game, Connections: Sports Edition, every day.",2025-05-19T20:00:06Z,https://www.cnet.com/tech/gaming/todays-nyt-connections-sports-edition-hints-and-answers-for-may-20-239/,sports,today nyt connection sport edition hint answer may 20 239 here today connection sport edition answer hint group clue help solve new york time popular puzzle game connection sport edition every day
Decluttering can pay off. Here's how I got my family to part with the things they no longer use and pad our gift fund.,"Cashing in on our clutter was the motivation my kids needed to part with their old toy, clothes, and sports equipment.",2025-05-17T10:55:02Z,https://www.businessinsider.com/selling-unused-toys-kids-more-willing-to-part-with-them-2025-5,sports,decluttering pay here got family part thing longer use pad gift fund cashing clutter motivation kid needed part old toy clothes sport equipment
I felt guilty for not signing my kids up for sports and activities. I realized I'm doing enough already.,I worried I was letting my kids down by not signing them up for sports and extracurriculars. I realized being present for them is enough already.,2025-05-19T11:21:01Z,https://www.businessinsider.com/felt-guilty-not-signing-kids-up-after-school-activities-2025-5,sports,felt guilty signing kid sport activity realized im enough already worried letting kid signing sport extracurriculars realized present enough already
Salah criticises 'harsh' Alexander-Arnold boos,Mohamed Salah says Trent Alexander-Arnold did not deserve to be booed by some Liverpool fans after the defender announced he will leave his boyhood club this summer.,2025-05-16T17:29:38Z,https://www.bbc.com/sport/football/articles/cy75g77lgyyo,sports,salah criticises harsh alexanderarnold boo mohamed salah say trent alexanderarnold deserve booed liverpool fan defender announced leave boyhood club summer
New Huawei Watch 5 looks great but it might be out of your reach,"Huawei has announced a bunch of products under its “Fashion Next” theme, which include two smartwatches, two fitness trackers, a pair of earbuds and a tablet.",2025-05-15T14:00:36Z,https://www.androidcentral.com/wearables/huawei-watch/huaweis-new-watch-5-series-looks-great-but-you-may-not-be-able-to-wear-it,sports,new huawei watch 5 look great might reach huawei announced bunch product “fashion next” theme include two smartwatches two fitness tracker pair earbuds tablet
Premier League Soccer: Stream West Ham vs. Nottingham Forest Live From Anywhere,Can the Tricky Trees keep their fading hopes of Champions League football alive at the London Stadium?,2025-05-18T10:15:04Z,https://www.cnet.com/tech/services-and-software/premier-league-soccer-stream-west-ham-vs-nottingham-forest-live-from-anywhere/,sports,premier league soccer stream west ham v nottingham forest live anywhere tricky tree keep fading hope champion league football alive london stadium
Premier League Soccer: Stream Brighton vs. Liverpool Live From Anywhere,The Seagulls need a home win against the champions to stay in contention for European qualification.,2025-05-19T16:00:09Z,https://www.cnet.com/tech/services-and-software/premier-league-soccer-stream-brighton-vs-liverpool-live-from-anywhere/,sports,premier league soccer stream brighton v liverpool live anywhere seagull need home win champion stay contention european qualification
Premier League Soccer: Stream Arsenal vs. Newcastle Live From Anywhere,It's a crucial clash in the battle for second-place at the Emirates today.,2025-05-18T12:30:04Z,https://www.cnet.com/tech/services-and-software/premier-league-soccer-stream-arsenal-vs-newcastle-live-from-anywhere/,sports,premier league soccer stream arsenal v newcastle live anywhere crucial clash battle secondplace emirate today
You can snag a year of Peacock Premium for just $24.99 right now,"May and June are rarely considered the best time of year to land a streaming deal, though that doesn’t mean there aren’t ways to save if you can forgo big-name services like Netflix and Hulu. Now through May 30th, for instance, both new and returning subscrib…",2025-05-15T17:27:24Z,https://www.theverge.com/tech/667255/peacock-premium-streaming-deal-insta360-x5-action-cam-sale,sports,snag year peacock premium 2499 right may june rarely considered best time year land streaming deal though doesn’t mean aren’t way save forgo bigname service like netflix hulu may 30th instance new returning subscrib…
Record lows for Man Utd & Spurs - but who's in best shape for Bilbao?,All eyes will be on Bilbao now as Manchester United and Tottenham switch focus from their disappointing domestic campaigns and try to win the Europa League.,2025-05-16T23:17:50Z,https://www.bbc.com/sport/football/articles/cx2j9g34n57o,sports,record low man utd spur who best shape bilbao eye bilbao manchester united tottenham switch focus disappointing domestic campaign try win europa league
I have 5 clear takeaways about the state of the TV business after a week of ad sales parties and presentations,"Streaming and network giants like Amazon, Disney, and NBCUniversal gathered in New York this week to make their best pitches to ad buyers.",2025-05-16T12:47:11Z,https://www.businessinsider.com/tv-ad-upfronts-week-takeaways-youtube-amazon-netflix-sports-2025-5,sports,5 clear takeaway state tv business week ad sale party presentation streaming network giant like amazon disney nbcuniversal gathered new york week make best pitch ad buyer
Pokémon TCG's Return Of Team Rocket Is A Triumph,"Oh it’s fun to have good news! The latest set from the Pokémon TCG, Scarlet & Violet Destined Rivals, is a top-notch collection of cards bursting with Team Rocket antics, which sports (in my limited experience, at least) pull rates I don’t believe we’ve seen …",2025-05-16T14:10:00Z,https://kotaku.com/pokemon-tcg-destined-rivals-review-pull-rates-mewtwo-1851781001,sports,pokémon tcgs return team rocket triumph oh it’s fun good news latest set pokémon tcg scarlet violet destined rival topnotch collection card bursting team rocket antic sport limited experience least pull rate don’t believe we’ve seen …
"Today's NYT Mini Crossword Answers for Friday, May 16","Here's today's NYT Mini Crossword answer. These answers will help you solve New York Times' popular crossword game, Mini Crossword, every day!",2025-05-16T02:28:52Z,https://www.cnet.com/tech/gaming/todays-nyt-mini-crossword-answers-for-friday-may-16/,sports,today nyt mini crossword answer friday may 16 here today nyt mini crossword answer answer help solve new york time popular crossword game mini crossword every day
Premier League Soccer: Stream Everton vs. Southampton From Anywhere,It's the Toffees final game at Goodison Park.,2025-05-18T08:30:04Z,https://www.cnet.com/tech/services-and-software/premier-league-soccer-stream-everton-vs-southampton-from-anywhere/,sports,premier league soccer stream everton v southampton anywhere toffee final game goodison park
Sport stars fear 'vile' abuse could cost a life,"Azeem Rafiq, Eni Aluko and Wayne Barnes among sport names helping Ofcom tackle online abuse.",2025-05-15T23:17:58Z,https://www.bbc.com/sport/articles/cgr5n57pp5do,sports,sport star fear vile abuse could cost life azeem rafiq eni aluko wayne barnes among sport name helping ofcom tackle online abuse
Moto Watch Fit launches this week to keep your fitness goals in reach for cheap,Motorola detailed the pricing and availability for the Watch Fit ahead of its launch this week.,2025-05-19T16:52:22Z,https://www.androidcentral.com/wearables/moto-watch-fit-availability-price-details-confirmed,sports,moto watch fit launch week keep fitness goal reach cheap motorola detailed pricing availability watch fit ahead launch week
Apple Sports app updated with daily newsletter and more,"Apple’s Sports app has evolved into a powerful way to track your favorite teams and leagues. In a new update this week, the app has added easier access to league standings, a new Sports Newsletter, and more. 



 more…",2025-05-19T18:14:58Z,https://9to5mac.com/2025/05/19/apple-sports-app-updated-with-daily-newsletter-and-more/,sports,apple sport app updated daily newsletter apple’s sport app evolved powerful way track favorite team league new update week app added easier access league standing new sport newsletter more…
"Today's NYT Mini Crossword Answers for Saturday, May 17","Here's today's NYT Mini Crossword answer. These answers will help you solve New York Times' popular crossword game, Mini Crossword, every day!",2025-05-17T02:54:00Z,https://www.cnet.com/tech/gaming/todays-nyt-mini-crossword-answers-for-saturday-may-17/,sports,today nyt mini crossword answer saturday may 17 here today nyt mini crossword answer answer help solve new york time popular crossword game mini crossword every day
MJ jersey from '92-'93 season sells for $2.6M,A uniform Michael Jordan wore for 17 games with the Chicago Bulls during the 1992-93 NBA season has sold for $2.623 million.,2025-05-18T21:06:22Z,https://www.espn.com/nba/story/_/id/45212317/michael-jordan-bulls-jersey-92-93-season-sells-26m,sports,mj jersey 9293 season sell 26m uniform michael jordan wore 17 game chicago bull 199293 nba season sold 2623 million
Pixel's At a Glance widget could soon help to keep an eye on your finances,Your Pixel's home and lock screens could soon highlight sports and finances at a glance,2025-05-15T17:47:14Z,https://www.androidpolice.com/piel-at-a-glance-sports-finance/,sports,pixel glance widget could soon help keep eye finance pixel home lock screen could soon highlight sport finance glance
"Today's NYT Connections: Sports Edition Hints and Answers for May 18, #237","Here's today's Connections: Sports Edition answer and hints for groups. These clues will help you solve The New York Times' popular puzzle game, Connections: Sports Edition, every day.",2025-05-18T06:55:06Z,https://www.cnet.com/tech/gaming/todays-nyt-connections-sports-edition-hints-and-answers-for-may-18-237/,sports,today nyt connection sport edition hint answer may 18 237 here today connection sport edition answer hint group clue help solve new york time popular puzzle game connection sport edition every day
"Today's NYT Connections: Sports Edition Hints and Answers for May 19, #238","Here's today's Connections: Sports Edition answer and hints for groups. These clues will help you solve The New York Times' popular puzzle game, Connections: Sports Edition, every day.",2025-05-19T02:37:50Z,https://www.cnet.com/tech/gaming/todays-nyt-connections-sports-edition-hints-and-answers-for-may-19-238/,sports,today nyt connection sport edition hint answer may 19 238 here today connection sport edition answer hint group clue help solve new york time popular puzzle game connection sport edition every day
Ricky Cobb Finds Himself on Fox,"A former community-college sociology professor, who broke into comedy as the Super 70s Sports guy on Twitter, drops by for a spot on “Gutfeld!,” Nick Paumgarten writes.",2025-05-19T10:00:00Z,https://www.newyorker.com/magazine/2025/05/26/ricky-cobb-finds-himself-on-fox,sports,ricky cobb find fox former communitycollege sociology professor broke comedy super 70 sport guy twitter drop spot “gutfeld” nick paumgarten writes
Garmin announces new Forerunner watches with splashy colors and running metrics,"Garmin's back with a bunch of goodies for runners. That includes two new Forerunner watches, a new chest strap, and several new running and triathlete features that won't be paywalled behind its newly launched Garmin Connect Plus subscription. On the watch fr…",2025-05-15T17:05:03Z,https://www.theverge.com/hands-on/667677/garmin-forerunner-970-and-570-specs-price-battery,sports,garmin announces new forerunner watch splashy color running metric garmins back bunch goody runner includes two new forerunner watch new chest strap several new running triathlete feature wont paywalled behind newly launched garmin connect plus subscription watch fr…
"Today's Wordle Hints, Answer and Help for May 20, #1431","Here's today's Wordle answer, plus a look at spoiler-free hints and past solutions. These clues will help you solve The New York Times' popular puzzle game, Wordle, every day.",2025-05-19T20:00:03Z,https://www.cnet.com/tech/gaming/todays-wordle-hints-answer-and-help-for-may-20-1431/,sports,today wordle hint answer help may 20 1431 here today wordle answer plus look spoilerfree hint past solution clue help solve new york time popular puzzle game wordle every day
"Today's Wordle Hints, Answer and Help for May 17, #1428","Here's today's Wordle answer, plus a look at spoiler-free hints and past solutions. These clues will help you solve The New York Times' popular puzzle game, Wordle, every day.",2025-05-16T20:00:03Z,https://www.cnet.com/tech/gaming/todays-wordle-hints-answer-and-help-for-may-17-1428/,sports,today wordle hint answer help may 17 1428 here today wordle answer plus look spoilerfree hint past solution clue help solve new york time popular puzzle game wordle every day
"Today's Wordle Hints, Answer and Help for May 16, #1427","Here's today's Wordle answer, plus a look at spoiler-free hints and past solutions. These clues will help you solve The New York Times' popular puzzle game, Wordle, every day.",2025-05-15T20:00:04Z,https://www.cnet.com/tech/gaming/todays-wordle-hints-answer-and-help-for-may-16-1427/,sports,today wordle hint answer help may 16 1427 here today wordle answer plus look spoilerfree hint past solution clue help solve new york time popular puzzle game wordle every day
"9to5Mac Daily: May 20, 2025 – New Apple Maps feature, Apple Sports app","Listen to a recap of the top stories of the day from 9to5Mac. 9to5Mac Daily is available on iTunes and Apple’s Podcasts app, Stitcher, TuneIn, Google Play, or through our dedicated RSS feed for Overcast and other podcast players.



Sponsored by Backblaze: Ne…",2025-05-20T14:19:21Z,https://9to5mac.com/2025/05/20/daily-may-20-2025/,sports,9to5mac daily may 20 2025 – new apple map feature apple sport app listen recap top story day 9to5mac 9to5mac daily available itunes apple’s podcasts app stitcher tunein google play dedicated rss feed overcast podcast player sponsored backblaze ne…
"Jenn Sterger on the Brett Favre Sexting Scandal, 15 Years Later",New Netflix documentary 'The Fall of Favre' looks at two controversies that have stained the legacy of Brett Favre,2025-05-20T17:38:32Z,https://time.com/7286963/fall-of-favre-netflix-jenn-sterger-interview/,sports,jenn sterger brett favre sexting scandal 15 year later new netflix documentary fall favre look two controversy stained legacy brett favre
Melania Trump Sports Prada Suit for Take It Down Act Signing,,2025-05-20T00:22:53Z,https://consent.yahoo.com/v2/collectConsent?sessionId=1_cc-session_146e474c-a29a-4c82-8038-049f0531f166,sports,melania trump sport prada suit take act signing nan
Dick's Sporting Goods is buying Foot Locker for $2.4 billion,"Together, the two retailers will have to wade the choppy waters of new tariffs on imports, including footwear. And they'll face the growing competition from shoe brands selling directly to shoppers.",2025-05-15T21:19:30Z,https://www.npr.org/2025/05/15/nx-s1-5399732/dicks-sporting-goods-foot-locker,sports,dick sporting good buying foot locker 24 billion together two retailer wade choppy water new tariff import including footwear theyll face growing competition shoe brand selling directly shopper
Tulane students face disciplinary action for “scavenger hunt”,"Surveillance video from Bruno's Tavern on Maple Street, shows several Tulane students on Monday, May 12, lurking outside.",2025-05-15T04:53:36Z,https://wgno.com/news/tulane-students-face-disciplinary-action-for-scavenger-hunt/,sports,tulane student face disciplinary action “scavenger hunt” surveillance video bruno tavern maple street show several tulane student monday may 12 lurking outside
"15 movies and shows to stream this weekend, from season 2 of 'The Secret Lives of Mormon Wives' to a new sci-fi thriller","From season two of ""The Secret Lives of Mormon Wives"" to the series premiere of ""Murderbot,"" here's what to watch on Hulu and other streaming services.",2025-05-16T19:17:59Z,https://www.businessinsider.com/best-shows-movies-streaming-netflix-hulu-max-may-16-2025,sports,15 movie show stream weekend season 2 secret life mormon wife new scifi thriller season two secret life mormon wife series premiere murderbot here watch hulu streaming service
"Today's NYT Strands Hints, Answers and Help for May 16, #439","Here's today's Strands answers and hints. These clues will help you solve The New York Times' popular puzzle game, Strands, every day.",2025-05-15T20:00:06Z,https://www.cnet.com/tech/gaming/todays-nyt-strands-hints-answers-and-help-for-may-16-439/,sports,today nyt strand hint answer help may 16 439 here today strand answer hint clue help solve new york time popular puzzle game strand every day
"Today's NYT Strands Hints, Answers and Help for May 20, #443","Here's today's Strands answers and hints. These clues will help you solve The New York Times' popular puzzle game, Strands, every day.",2025-05-19T20:00:05Z,https://www.cnet.com/tech/gaming/todays-nyt-strands-hints-answers-and-help-for-may-20-443/,sports,today nyt strand hint answer help may 20 443 here today strand answer hint clue help solve new york time popular puzzle game strand every day
"Today's NYT Connections Hints, Answers and Help for May 20, #709","Here's today's Connections answer and hints for groups. These clues will help you solve New York Times' popular puzzle game, Connections, every day!",2025-05-19T20:00:05Z,https://www.cnet.com/tech/gaming/todays-nyt-connections-hints-answers-and-help-for-may-20-709/,sports,today nyt connection hint answer help may 20 709 here today connection answer hint group clue help solve new york time popular puzzle game connection every day
"Today's NYT Connections Hints, Answers and Help for May 16, #705","Here's today's Connections answer and hints for groups. These clues will help you solve New York Times' popular puzzle game, Connections, every day!",2025-05-15T20:00:05Z,https://www.cnet.com/tech/gaming/todays-nyt-connections-hints-answers-and-help-for-may-16-705/,sports,today nyt connection hint answer help may 16 705 here today connection answer hint group clue help solve new york time popular puzzle game connection every day
"Today's NYT Strands Hints, Answers and Help for May 17, #440","Here's today's Strands answers and hints. These clues will help you solve The New York Times' popular puzzle game, Strands, every day.",2025-05-16T20:00:00Z,https://www.cnet.com/tech/gaming/todays-nyt-strands-hints-answers-and-help-for-may-17-440/,sports,today nyt strand hint answer help may 17 440 here today strand answer hint clue help solve new york time popular puzzle game strand every day
"Today's NYT Connections Hints, Answers and Help for May 17, #706","Here's today's Connections answer and hints for groups. These clues will help you solve New York Times' popular puzzle game, Connections, every day!",2025-05-16T20:00:04Z,https://www.cnet.com/tech/gaming/todays-nyt-connections-hints-answers-and-help-for-may-17-706/,sports,today nyt connection hint answer help may 17 706 here today connection answer hint group clue help solve new york time popular puzzle game connection every day
U.S. Travelers Warned About New Risk in Popular European Destination,The U.S. Department of State suggests travels exercise caution when traveling abroad.,2025-05-20T20:47:48Z,https://parade.com/news/travel-warning-switzerland-level,sports,u traveler warned new risk popular european destination u department state suggests travel exercise caution traveling abroad
Rugby star Jamie Roberts 'excited' to become junior doctor,Jamie Roberts says he is ready to become a junior doctor and complete his medical training in the NHS.,2025-05-16T21:52:19Z,https://www.bbc.com/news/articles/cx2qvle97nvo,sports,rugby star jamie robert excited become junior doctor jamie robert say ready become junior doctor complete medical training nh
Dump truck crashes into I-10 overpass,"WALTON COUNTY, Fla. (WKRG) — A dump truck crashed into the I-10 overpass early Friday morning, News 5 has learned. According to a Florida Highway Patrol...",2025-05-16T16:18:28Z,https://www.wkrg.com/northwest-florida/dump-truck-gets-stuck-under-i-10-overpass/,sports,dump truck crash i10 overpass walton county fla wkrg — dump truck crashed i10 overpass early friday morning news 5 learned according florida highway patrol
Panic at Santa Rosa County baseball field leads to arrest,"PACE, Fla. (WKRG) — A man wanted after panic ensued last month at the Pace Athletic Recreation Association has turned himself in, News 5 has learned...",2025-05-15T17:44:22Z,https://www.wkrg.com/northwest-florida/panic-at-santa-rosa-county-baseball-field-leads-to-arrest/,sports,panic santa rosa county baseball field lead arrest pace fla wkrg — man wanted panic ensued last month pace athletic recreation association turned news 5 learned
Suburban teacher facing child porn charges accused of sharing student images,"Todd Fowler, a teacher at Woodland Elementary School in Gurnee, Illinois, was arrested on Thursday for disseminating and possessing child pornography, and is...",2025-05-16T00:28:13Z,https://wgntv.com/news/north-suburbs/suburban-teacher-facing-child-porn-charges-accused-of-sharing-student-images/,sports,suburban teacher facing child porn charge accused sharing student image todd fowler teacher woodland elementary school gurnee illinois arrested thursday disseminating possessing child pornography
Major VPN Providers Ordered to Block Pirate Sports Streaming Sites,"The world's leading VPN providers have been ordered to block around 200 pirate site domains following legal action in France by Canal+ Group. The broadcaster argued that users of NordVPN, CyberGhost, Surfshark, ExpressVPN and ProtonVPN, use those services to …",2025-05-16T14:01:29Z,https://torrentfreak.com/major-vpn-providers-ordered-to-block-pirate-sports-streaming-sites-250516/,sports,major vpn provider ordered block pirate sport streaming site world leading vpn provider ordered block around 200 pirate site domain following legal action france canal group broadcaster argued user nordvpn cyberghost surfshark expressvpn protonvpn use service …
"Bond vibes, six-figure price tag: Apple's CarPlay Ultra debuts in new Aston Martins","CarPlay Ultra, Apple's next-gen dashboard integration, just debuted in Aston Martin models.",2025-05-15T22:03:22Z,https://www.businessinsider.com/apple-carplay-ultra-is-here-for-aston-martin-drivers-2025-5,sports,bond vibe sixfigure price tag apple carplay ultra debut new aston martin carplay ultra apple nextgen dashboard integration debuted aston martin model
