title,description,publishedAt,url,category,cleaned_text
Scottie Scheffler plays down career grand slam talk after ‘sweet’ US PGA success,Scottie Scheffler refused to identify the career grand slam as his next target after securing the US PGA Championship at Quail Hollow,2025-05-19T01:23:47Z,https://www.theguardian.com/sport/2025/may/19/us-pga-championship-scottie-scheffler-victory-reaction,sports,scottie scheffler play career grand slam talk ‘sweet’ u pga success scottie scheffler refused identify career grand slam next target securing u pga championship quail hollow
US PGA Championship 2025: Scheffler holds off Rahm to win third major – as it happened,"<strong>Hole-by-hole report:</strong> Scottie Scheffler dug deep to pull away from a chasing pack, led by Jon Rahm, that briefly hauled him in. Scott Murray was watching",2025-05-18T23:16:59Z,https://www.theguardian.com/sport/live/2025/may/18/us-pga-championship-2025-golf-day-four-live,sports,u pga championship 2025 scheffler hold rahm win third major – happened strongholebyhole reportstrong scottie scheffler dug deep pull away chasing pack led jon rahm briefly hauled scott murray watching
Scottie Scheffler runs away with US PGA title after challengers fade away,"Scottie Scheffler enjoyed a comfortable victory in the US PGA at Quail Hollow, fnishing five shots clear of the field",2025-05-18T22:58:55Z,https://www.theguardian.com/sport/2025/may/18/scottie-scheffler-runs-away-with-us-pga-title-after-challengers-fade-away,sports,scottie scheffler run away u pga title challenger fade away scottie scheffler enjoyed comfortable victory u pga quail hollow fnishing five shot clear field
Carlos Alcaraz storms Sinner’s Roman kingdom to show he rules on clay,"Carlos Alcaraz beat Jannik Sinner 7-6 (5), 6-1 in the final to pick up his first Italian Open title",2025-05-18T20:21:06Z,https://www.theguardian.com/sport/2025/may/18/carlos-alcaraz-sinks-jannik-sinner-to-claim-first-italian-open-title,sports,carlos alcaraz storm sinner’s roman kingdom show rule clay carlos alcaraz beat jannik sinner 76 5 61 final pick first italian open title
WNBA investigating claims of racist comments during Clark-Reese game,The WNBA says it is looking into allegations of ‘hateful fan comments”’ during Indiana Fever’s fiery win over the Chicago Sky,2025-05-18T19:27:10Z,https://www.theguardian.com/sport/2025/may/18/wnba-caitlin-clark-angel-reese-investigation,sports,wnba investigating claim racist comment clarkreese game wnba say looking allegation ‘hateful fan comments”’ indiana fever’s fiery win chicago sky
‘An amazing experience’: Lewis Hamilton revels in support for Ferrari at Emilia-Romagna GP,Ferrari’s Lewis Hamilton said there was a ‘sea of red everywhere’ as he finished fourth after starting the Emilia-Romagna Grand Prix 12th,2025-05-18T19:08:41Z,https://www.theguardian.com/sport/2025/may/18/lewis-hamilton-revels-in-support-ferrari-emilia-romagna-grand-prix-f1,sports,‘an amazing experience’ lewis hamilton revel support ferrari emiliaromagna gp ferrari’s lewis hamilton said ‘sea red everywhere’ finished fourth starting emiliaromagna grand prix 12th
"Somerset beat Sussex, Leicestershire flying high in Division Two: county cricket – as it happened",Somerset beat high-flying Sussex by five wickets while Leicestershire aided their Division Two promotion bid,2025-05-18T18:13:05Z,https://www.theguardian.com/sport/live/2025/may/18/lancashire-v-derbyshire-somerset-v-sussex-and-more-county-cricket-live,sports,somerset beat sussex leicestershire flying high division two county cricket – happened somerset beat highflying sussex five wicket leicestershire aided division two promotion bid
Mane event: Lions’ road to Australia begins with get-to-know-you coffees,"The task of bringing together 38 disparate players begins at a Richmond hotel, with kit to be collected and friends to be made",2025-05-18T15:56:06Z,https://www.theguardian.com/sport/2025/may/18/lions-australia-get-to-know-you-coffees-rugby-union,sports,mane event lions’ road australia begin gettoknowyou coffee task bringing together 38 disparate player begin richmond hotel kit collected friend made
Formula One: Max Verstappen wins Emilia-Romagna Grand Prix – as it happened,Max Verstappen hit back in the title race with an imperious display as both McLarens made the podium with Lewis Hamilton in fourth,2025-05-18T15:35:58Z,https://www.theguardian.com/sport/live/2025/may/18/formula-one-emilia-romagna-grand-prix-updates-live,sports,formula one max verstappen win emiliaromagna grand prix – happened max verstappen hit back title race imperious display mclarens made podium lewis hamilton fourth
Verstappen wins Emilia-Romagna GP to close gap on F1 title rivals,"Max Verstappen won the F1 Emilia-Romagna Grand Prix for Red Bull, with Lando Norris second and Oscar Piastri third",2025-05-18T15:31:47Z,https://www.theguardian.com/sport/2025/may/18/max-verstappen-sweeps-to-victory-in-emilia-romagna-f1-gp,sports,verstappen win emiliaromagna gp close gap f1 title rival max verstappen f1 emiliaromagna grand prix red bull lando norris second oscar piastri third
A week of grief is a reminder to reflect on the magnificent triviality of sport | Jonathan Horn,"After the death of Adam Selwood followed that of his twin brother Troy, all we can do is afford the family the full measure of their unspeakable grief",2025-05-18T15:00:38Z,https://www.theguardian.com/sport/blog/2025/may/19/adam-selwood-robert-walls-grief-magnificent-triviality-of-sport,sports,week grief reminder reflect magnificent triviality sport jonathan horn death adam selwood followed twin brother troy afford family full measure unspeakable grief
