title,description,publishedAt,url,category,cleaned_text
Beyoncé and Sabrina Carpenter's choreographer shares how she gets her clients so fit they can sing and dance — in just 12 weeks,"The choreographer Jasmine ""JB"" Badie trains pop stars like Beyoncé and Sabrina Carpenter to achieve peak cardiovascular fitness in just 12 weeks.",2025-05-20T11:11:28Z,https://www.businessinsider.com/beyonce-sabrina-carpenter-train-tours-choreographer-jasmine-jb-badie-2025-5,sports,beyoncé sabrina carpenter choreographer share get client fit sing dance — 12 week choreographer jasmine jb badie train pop star like beyoncé sabrina carpenter achieve peak cardiovascular fitness 12 week
Bill Belichick Was Always in Control. Then He Fell for Jordon Hudson.,"The romance between Mr. Belichick, the 73-year-old former coach of the New England Patriots, and his girlfriend, Jordon Hudson, 24, has roiled the worlds of professional and collegiate athletics.",2025-05-20T07:00:13Z,https://www.nytimes.com/2025/05/20/sports/bill-belichick-age-girlfriend-jordon-hudson.html,sports,bill belichick always control fell jordon hudson romance mr belichick 73yearold former coach new england patriot girlfriend jordon hudson 24 roiled world professional collegiate athletics
Mets-Yankees Subway Series Clash Will Compete for Fans’ Attention,The first game of the annual regular season event coincides with a crucial Friday night Knicks playoff game against the Celtics.,2025-05-16T19:23:18Z,https://www.nytimes.com/2025/05/16/sports/yankees-mets-knicks-playoffs.html,sports,metsyankees subway series clash compete fans’ attention first game annual regular season event coincides crucial friday night knicks playoff game celtic
The Classic Villa Borghese Hosts a Classic Equestrian Event,The Piazza di Siena horse show will be held in an arena inside the Roman park.,2025-05-21T09:01:35Z,https://www.nytimes.com/2025/05/21/sports/horse-racing/villa-borghese-equestrian-event.html,sports,classic villa borghese host classic equestrian event piazza di siena horse show held arena inside roman park
Never Bet Against Pete Rose,His removal from baseball’s ineligible list will allow him to enter the Hall of Fame.,2025-05-15T09:05:27Z,https://www.nytimes.com/2025/05/15/opinion/pete-rose-hall-of-fame-baseball.html,sports,never bet pete rose removal baseball’s ineligible list allow enter hall fame
Stephen A. Smith Is Running. To Be Joe Rogan.,"America’s best-known sports-talker is hosting boldface Democrats and MAGA luminaries and teasing a 2028 run. But what he really wants is ubiquitous political influence, and things of that nature.",2025-05-15T14:45:36Z,https://www.nytimes.com/2025/05/15/style/stephen-a-smith-espn-politics.html,sports,stephen smith running joe rogan america’s bestknown sportstalker hosting boldface democrat maga luminary teasing 2028 run really want ubiquitous political influence thing nature
"With a New Fair in Qatar, Art Basel Branches Out in the Mideast","Because of its enormous wealth, the Persian Gulf has long been viewed by the international art trade as a prime market for expansion.",2025-05-20T12:01:03Z,https://www.nytimes.com/2025/05/20/arts/design/art-basel-doha-qatar.html,sports,new fair qatar art basel branch mideast enormous wealth persian gulf long viewed international art trade prime market expansion
The New York Liberty’s Season Opener Added Another Win for the City,"Fans including Jason Sudeikis, Spike Lee and Robin Roberts cheered the reigning W.N.B.A champions to victory during an exciting weekend for New York sports.",2025-05-18T09:01:38Z,https://www.nytimes.com/2025/05/18/style/new-york-liberty-season-opener.html,sports,new york liberty’s season opener added another win city fan including jason sudeikis spike lee robin robert cheered reigning wnba champion victory exciting weekend new york sport
"A Haven for High School Girls’ Wrestling, Filled With Grit and Pride",The Lucha Wrestling Club in the Bronx provides a safe place for an aggressive sport. The Bronx has more public high school girls’ teams than any other New York City borough.,2025-05-17T07:00:19Z,https://www.nytimes.com/2025/05/17/nyregion/bronx-girls-wrestling-clubs.html,sports,high school girls’ wrestling filled grit pride lucha wrestling club bronx provides safe place aggressive sport bronx public high school girls’ team new york city borough
"In Approving Soda Ban for Food Stamps, U.S.D.A. Reverses Decades of Policy","The Trump administration approved a first of its kind waiver for Nebraska, allowing a ban on soda purchases through the Supplemental Nutrition Assistance Program, starting next year.",2025-05-20T23:20:53Z,https://www.nytimes.com/2025/05/20/us/politics/nebraska-bans-soda-snap-benefits-usda.html,sports,approving soda ban food stamp usda revers decade policy trump administration approved first kind waiver nebraska allowing ban soda purchase supplemental nutrition assistance program starting next year
Eiza González Says Legend of Zelda Changed How She Looks at Life,"“At first glance you’d be like, ‘Oh, it’s a simple game,’” said the star of the new movie “Fountain of Youth.” “But it’s so much more deep than anyone could imagine.”",2025-05-17T09:00:57Z,https://www.nytimes.com/2025/05/17/movies/eiza-gonzalez-fountain-of-youth.html,sports,eiza gonzález say legend zelda changed look life “at first glance you’d like ‘oh it’s simple game’” said star new movie “fountain youth” “but it’s much deep anyone could imagine”
"England v Zimbabwe: men’s cricket Test, day one – live",<strong>Over-by-over report:</strong> Join our writers for updates as Zimbabwe play their first Test in England since 2003,2025-05-22T10:18:53Z,https://www.theguardian.com/sport/live/2025/may/22/england-v-zimbabwe-first-cricket-test-day-one-live-updates,sports,england v zimbabwe men’s cricket test day one – live strongoverbyover reportstrong join writer update zimbabwe play first test england since 2003
"Is the Mets’ $765m slugger Juan Soto sad, bad or just playing in New York?","The 26-year-old has been good rather than great in his first season with his new team, and he’s playing in an unforgiving environment",2025-05-22T09:00:05Z,https://www.theguardian.com/sport/2025/may/22/juan-soto-mets-baseball,sports,mets’ 765m slugger juan soto sad bad playing new york 26yearold good rather great first season new team he’s playing unforgiving environment
Northampton’s Champions Cup final date with Bordeaux should be all-out attack | Ugo Monye,We can expect Phil Dowson’s Saints to hit the accelerator in Cardiff against a French side packed with creative talent,2025-05-22T07:00:53Z,https://www.theguardian.com/sport/2025/may/22/northampton-bordeaux-champions-cup-final-attack,sports,northampton’s champion cup final date bordeaux allout attack ugo monye expect phil dowson’s saint hit accelerator cardiff french side packed creative talent
Haliburton and Pacers stun Knicks with epic comeback in Game 1 of East finals,Indiana completed a stunning 14-point comeback in the final three minutes of regulation to shock the Knicks 138-135 in overtime in Game 1 of the East finals,2025-05-22T03:40:11Z,https://www.theguardian.com/sport/2025/may/21/knicks-pacers-game-one-comeback-nba-playoffs,sports,haliburton pacer stun knicks epic comeback game 1 east final indiana completed stunning 14point comeback final three minute regulation shock knicks 138135 overtime game 1 east final
"Athletes warn against potential health risks of ‘dangerous, unethical’ Enhanced Games",Sport Integrity Australia takes aim at event planned for May 2026 as Australian body calls on clean athletes to resist the lure of prize money,2025-05-22T01:05:55Z,https://www.theguardian.com/sport/2025/may/22/enhanced-games-2025-athletes-warning,sports,athlete warn potential health risk ‘dangerous unethical’ enhanced game sport integrity australia take aim event planned may 2026 australian body call clean athlete resist lure prize money
"Jim Irsay, longtime owner of NFL’s Indianapolis Colts, dies aged 65","Jim Irsay, longtime owner and CEO of the Indianapolis Colts and one of the NFL’s most recognizable figures, has died at age 65",2025-05-22T00:07:43Z,https://www.theguardian.com/sport/2025/may/21/jim-irsay-death-indianapolis-colts-owner-obit,sports,jim irsay longtime owner nfl’s indianapolis colt dy aged 65 jim irsay longtime owner ceo indianapolis colt one nfl’s recognizable figure died age 65
Sophia Dunkley launches England into new era with win over West Indies in first T20,Sophia Dunkley struck an unbeaten 81 as England eased to an eight-wicket victory over West Indies in the opening Twenty20 international,2025-05-21T21:08:45Z,https://www.theguardian.com/sport/2025/may/21/sophia-dunkley-launches-england-into-new-era-with-win-over-west-indies-in-first-t20,sports,sophia dunkley launch england new era win west indie first t20 sophia dunkley struck unbeaten 81 england eased eightwicket victory west indie opening twenty20 international
England beat West Indies by eight wickets: first women’s T20 cricket international – as it happened,An impressive victory for England was underpinned by 81 not out for Sophia Dunkley,2025-05-21T20:55:46Z,https://www.theguardian.com/sport/live/2025/may/21/england-v-west-indies-first-womens-t20-cricket-international-live,sports,england beat west indie eight wicket first women’s t20 cricket international – happened impressive victory england underpinned 81 sophia dunkley
Oklahoma City Thunder’s Shai Gilgeous-Alexander named NBA MVP,"Shai Gilgeous-Alexander has been named the NBA’s Most Valuable Player, capping a breakout year in which he led Oklahoma City to a NBA-best 68 wins",2025-05-21T20:16:33Z,https://www.theguardian.com/sport/2025/may/21/nba-mvp-shai-gilgeous-alexander-winner,sports,oklahoma city thunder’s shai gilgeousalexander named nba mvp shai gilgeousalexander named nba’s valuable player capping breakout year led oklahoma city nbabest 68 win
Pro-doping Enhanced Games to debut in Las Vegas with Trump Jr backing,A controversial new Olympics-style sporting event where athletes will be permitted to use drugs is set to debut in Las Vegas next year,2025-05-21T20:00:37Z,https://www.theguardian.com/sport/2025/may/21/enhanced-games-las-vegas-dates-trump-jr-thiel,sports,prodoping enhanced game debut la vega trump jr backing controversial new olympicsstyle sporting event athlete permitted use drug set debut la vega next year
Ben Stokes targets No 1 spot in world Test rankings: ‘One more place to go’,England’s Test captain Ben Stokes has set his sights on taking his team to No 1 in the world rankings,2025-05-21T17:02:59Z,https://www.theguardian.com/sport/2025/may/21/england-cricket-ben-stokes-zimbabwe-test-match-news,sports,ben stokes target 1 spot world test ranking ‘one place go’ england’s test captain ben stokes set sight taking team 1 world ranking
Steve Borthwick: don’t bet against Henry Pollock making Lions Test team ,Steve Borthwick believes Henry Pollock can force his way into the British &amp; Irish Lions Test team for the series against Australia this summer,2025-05-21T17:00:34Z,https://www.theguardian.com/sport/2025/may/21/steve-borthwick-dont-bet-against-henry-pollock-making-lions-test-team,sports,steve borthwick don’t bet henry pollock making lion test team steve borthwick belief henry pollock force way british amp irish lion test team series australia summer
Bazball’s moment of truth arrives in year that will define era of McCullum and Stokes,One-off Zimbabwe Test at Trent Bridge the launchpad for a decisive summer for England and their abstemious captain,2025-05-21T15:00:36Z,https://www.theguardian.com/sport/2025/may/21/england-test-cricket-zimbabwe-bazball-ben-stokes,sports,bazball’s moment truth arrives year define era mccullum stokes oneoff zimbabwe test trent bridge launchpad decisive summer england abstemious captain
The Spin | Test cricket summers are the sunshine-shaped bookmarks of our lives,"When you reach a certain age you start measuring life in cricket summers, bringing memories of old acquaintances",2025-05-21T10:35:42Z,https://www.theguardian.com/sport/2025/may/21/the-spin-cricket-test-summers-sunshine-shaped-bookmarks-of-our-lives,sports,spin test cricket summer sunshineshaped bookmark life reach certain age start measuring life cricket summer bringing memory old acquaintance
"Former tennis star Jelena Dokic confirms death of estranged father, Damir Dokic",Father and coach of former world No 4 and Wimbledon semi-finalist died on Friday,2025-05-21T10:32:32Z,https://www.theguardian.com/sport/2025/may/21/former-tennis-star-jelena-dokic-confirms-death-of-estranged-father-damir-dokic,sports,former tennis star jelena dokic confirms death estranged father damir dokic father coach former world 4 wimbledon semifinalist died friday
Ride of the Valkyries: how the WNBA finally found a home in the Bay Area,"As the league’s newest team targets a bright future, they are also keen to respect the culture and history of the Bay Area they represent",2025-05-21T10:00:23Z,https://www.theguardian.com/sport/2025/may/21/ride-of-the-valkyries-how-the-wnba-finally-found-a-home-in-the-bay-area,sports,ride valkyrie wnba finally found home bay area league’s newest team target bright future also keen respect culture history bay area represent
Drop by drop: Carlos Alcaraz leads shift back to the most deft shot in tennis,Roger Federer saw it as a ‘panic shot’ but the drop shot is back in vogue thanks to a greater understanding of its effectiveness,2025-05-21T09:17:18Z,https://www.theguardian.com/sport/2025/may/21/drop-shot-tennis-carlos-alcaraz-clay-french-open,sports,drop drop carlos alcaraz lead shift back deft shot tennis roger federer saw ‘panic shot’ drop shot back vogue thanks greater understanding effectiveness
"‘It sucks, man’: World Surf League’s dreaded cut claims its final victims | Kieran Pender","The controversial feature, added in 2022, will disappear after the Margaret River Pro. Few surfers on the elite tour are sad to see it go",2025-05-21T05:12:14Z,https://www.theguardian.com/sport/2025/may/21/world-surf-league-mid-season-cut-margaret-river-pro,sports,‘it suck man’ world surf league’s dreaded cut claim final victim kieran pender controversial feature added 2022 disappear margaret river pro surfer elite tour sad see go
Essendon must stop pining for the past after finding a semblance of stability,The Bombers are on the right path under coach Brad Scott but need to resist the urge to jump at shadows after a crushing defeat to the Bulldogs,2025-05-21T04:56:27Z,https://www.theguardian.com/sport/2025/may/21/from-the-pocket-essendon-must-stop-pining-for-the-past-after-finding-a-semblance-of-stability,sports,essendon must stop pining past finding semblance stability bomber right path coach brad scott need resist urge jump shadow crushing defeat bulldog
Racing chiefs warn Labour plans on betting could cost sport tens of millions | Greg Wood,British Horseracing Authority is protesting about proposals to harmonise online and gaming duty rates,2025-05-20T20:01:07Z,https://www.theguardian.com/sport/2025/may/20/horse-racing-chiefs-warn-labour-plans-betting-could-cost-sport-tens-of-millions-talking-horses,sports,racing chief warn labour plan betting could cost sport ten million greg wood british horseracing authority protesting proposal harmonise online gaming duty rate
Immanuel Feyi-Waboso on track for England return on Argentina tour,The 22-year-old wing took part in a mini training camp and was praised in glowing terms by England head coach,2025-05-20T19:31:43Z,https://www.theguardian.com/sport/2025/may/20/immanuel-feyi-waboso-on-track-for-england-return-on-argentina-tour,sports,immanuel feyiwaboso track england return argentina tour 22yearold wing took part mini training camp praised glowing term england head coach
Northampton four face fitness battle before Champions Cup final,"Three Northampton players were unable to train this week, with the club particularly stretched at hooker",2025-05-20T18:06:30Z,https://www.theguardian.com/sport/2025/may/20/northampton-sweat-on-fitness-of-key-players-before-champions-cup-final,sports,northampton four face fitness battle champion cup final three northampton player unable train week club particularly stretched hooker
Bring back that Bazball feeling: McCullum wants England to reconnect with fans,Brendon McCullum has called on England’s cricketers to reconnect with their fans as some comments may have given the impression they are ‘out of touch with the general population’,2025-05-20T15:34:00Z,https://www.theguardian.com/sport/2025/may/20/bring-back-that-bazball-feeling-mccullum-asks-england-to-reconnect-with-fans-zimbabwe-test-cricket,sports,bring back bazball feeling mccullum want england reconnect fan brendon mccullum called england’s cricketer reconnect fan comment may given impression ‘out touch general population’
The Fall of Favre: the making – and unmaking – of a flawed NFL gunslinger,"A new documentary explores how the legend of one of the league’s greatest quarterbacks endures, despite the multiple scandals that have engulfed him",2025-05-20T13:13:10Z,https://www.theguardian.com/sport/2025/may/20/brett-favre-netflix-documentary,sports,fall favre making – unmaking – flawed nfl gunslinger new documentary explores legend one league’s greatest quarterback endures despite multiple scandal engulfed
Magnus Carlsen v The World: chess champion’s 46-day match ends in draw,"After 46 days the online freestyle chess match between the Norwegian grandmaster Magnus Carlsen and 143,000 enthusiasts from around the globe ended in a surprise draw",2025-05-20T12:09:57Z,https://www.theguardian.com/sport/2025/may/20/chess-champion-magnus-carlsen-vs-the-world-match-ends-in-surprise-draw,sports,magnus carlsen v world chess champion’s 46day match end draw 46 day online freestyle chess match norwegian grandmaster magnus carlsen 143000 enthusiast around globe ended surprise draw
Mets to talk to $765m Soto about hustling out of box after second incident in two days,Carlos Mendoza says he will talk to Juan Soto about hustling out of the batter’s box after the slugger watched a would-be home run bounce off the Green Monster,2025-05-20T11:39:26Z,https://www.theguardian.com/sport/2025/may/20/juan-soto-hustle-mets-yankees-red-sox,sports,mets talk 765m soto hustling box second incident two day carlos mendoza say talk juan soto hustling batter’s box slugger watched wouldbe home run bounce green monster
"‘Doubles is absolute carnage’: meet Henry Patten, GB’s unsung Wimbledon champion",Tennis is a ‘fun hobby’ for the doubles player looking to add to grand slams won in SW19 and at the Australian Open,2025-05-20T11:00:22Z,https://www.theguardian.com/sport/2025/may/20/doubles-is-absolute-carnage-meet-henry-patten-gbs-unsung-wimbledon-champion-tennis,sports,‘doubles absolute carnage’ meet henry patten gb’s unsung wimbledon champion tennis ‘fun hobby’ double player looking add grand slam sw19 australian open
The Breakdown | Rare English double in Europe would be a dream result for Premiership,"Northampton and Bath have a chance to restore English rugby to its pedestal, but French foes will have other ideas",2025-05-20T09:21:19Z,https://www.theguardian.com/sport/2025/may/20/rare-english-double-in-europe-would-be-a-dream-result-for-the-premiership,sports,breakdown rare english double europe would dream result premiership northampton bath chance restore english rugby pedestal french foe idea
Rival league forges ahead in fresh twist to British basketball’s civil war,"Former NBA executive Marshall Glickman, who heads the consortium awarded 15-year league licence, outlines bold plans for change with or without the Super League clubs",2025-05-20T07:00:51Z,https://www.theguardian.com/sport/2025/may/20/rival-league-forges-ahead-in-fresh-twist-to-british-basketballs-civil-war,sports,rival league forge ahead fresh twist british basketball’s civil war former nba executive marshall glickman head consortium awarded 15year league licence outline bold plan change without super league club
Zimbabwe’s Sean Williams: ‘It’s been a rollercoaster ride of ups and downs – mainly downs’,All-rounder has been playing for his country – on and off – for 20 years and is relishing Thursday’s Test in England,2025-05-20T07:00:50Z,https://www.theguardian.com/sport/2025/may/20/zimbabwe-sean-williams-rollercoaster-ride-of-ups-and-downs-cricket,sports,zimbabwe’s sean williams ‘it’s rollercoaster ride ups down – mainly downs’ allrounder playing country – – 20 year relishing thursday’s test england
"County cricket: Lancs denied by Derbyshire, Notts slip to Durham defeat – as it happened","Derbyshire’s tail stood up to Jimmy Anderson while in the top division, Surrey put pressure on leaders Nottinghamshire",2025-05-19T19:19:10Z,https://www.theguardian.com/sport/live/2025/may/19/county-cricket-day-four-surrey-v-yorkshire-lancashire-v-derbyshire-and-more-live,sports,county cricket lancs denied derbyshire notts slip durham defeat – happened derbyshire’s tail stood jimmy anderson top division surrey put pressure leader nottinghamshire
Needless controversy over foreign-born Lions players ramps up pressure,"The ‘Southern Hemisphere Seven’ long ago proved their commitment, making criticism of selection unwarranted",2025-05-19T17:00:33Z,https://www.theguardian.com/sport/2025/may/19/needless-controversy-over-foreign-born-lions-players-ramps-up-pressure,sports,needless controversy foreignborn lion player ramp pressure ‘southern hemisphere seven’ long ago proved commitment making criticism selection unwarranted
‘We are a passionately multiracial team’: Zimbabwe return to England transformed,Visitors have endured political chaos and miserable results over 22 years but cricket is finally a national game,2025-05-19T14:54:44Z,https://www.theguardian.com/sport/2025/may/19/we-are-a-passionately-multiracial-team-zimbabwe-return-to-england-transformed,sports,‘we passionately multiracial team’ zimbabwe return england transformed visitor endured political chaos miserable result 22 year cricket finally national game
"The strange twilight of Russell Westbrook, the NBA’s ultimate fetish player","The guard is the type of player around which you can build a highlights reel, but not a championship. Maybe that’s enough when the highlights were so good",2025-05-19T11:58:24Z,https://www.theguardian.com/sport/2025/may/19/russell-westbrook-denver-nuggets-nba,sports,strange twilight russell westbrook nba’s ultimate fetish player guard type player around build highlight reel championship maybe that’s enough highlight good
Red Bull confident Verstappen’s Imola win will be a turning point in F1 season,Christian Horner believes Max Verstappen’s victory at the Emilia-Romagna GP showed Red Bull have the car and race pace to challenge McLaren,2025-05-19T11:08:02Z,https://www.theguardian.com/sport/2025/may/19/red-bull-confident-max-verstappen-imola-win-will-be-a-turning-point-in-f1-season-emilia-romagna-grand-prix-mclaren,sports,red bull confident verstappen’s imola win turning point f1 season christian horner belief max verstappen’s victory emiliaromagna gp showed red bull car race pace challenge mclaren
Men’s Six Nations starts midweek and is cut shorter for 2026,Next year’s men’s Six Nations starts midweek when France host Ireland due to the start of the Winter Olympics,2025-05-19T11:00:31Z,https://www.theguardian.com/sport/2025/may/19/mens-six-nations-starts-midweek-cut-shorter-2026-rugby-union,sports,men’s six nation start midweek cut shorter 2026 next year’s men’s six nation start midweek france host ireland due start winter olympics
The Caitlin Clark-Angel Reese rivalry is becoming a mirror for American bigotry,"The WNBA stars are helping drive record-setting interest in the league. But the conversation distracts from other players, and brings in unwelcome ugliness",2025-05-19T09:00:03Z,https://www.theguardian.com/sport/2025/may/19/caitlin-clark-angel-reese-wnba-basketball,sports,caitlin clarkangel reese rivalry becoming mirror american bigotry wnba star helping drive recordsetting interest league conversation distracts player brings unwelcome ugliness
Tyrese Haliburton’s moment of reflection sheds light on stars’ secret struggles | Sean Ingle,Sportspeople’s reluctance to open up is understandable given the unforgiving environment but doing so could be of benefit,2025-05-19T07:00:58Z,https://www.theguardian.com/sport/2025/may/19/tyrese-haliburtons-moment-of-reflection-sheds-light-on-stars-secret-struggles,sports,tyrese haliburton’s moment reflection shed light stars’ secret struggle sean ingle sportspeople’s reluctance open understandable given unforgiving environment could benefit
Few surprises from conservative NSW Blues as Queensland Maroons handle late State of Origin curveballs | Nick Tedeschi,Returning Blues coach Laurie Daley is unlikely to take a kamikaze approach and it appears the Maroons have the advantage heading into the series,2025-05-19T02:06:26Z,https://www.theguardian.com/sport/blog/2025/may/19/state-of-origin-team-selection-nsw-blues-queensland-qld-maroons-game-1,sports,surprise conservative nsw blue queensland maroon handle late state origin curveballs nick tedeschi returning blue coach laurie daley unlikely take kamikaze approach appears maroon advantage heading series
