title,description,publishedAt,url,category,cleaned_text
"Wrong Logo, No Piracy Proof: French Court Rejects DNS Piracy Blocking Bids","French courts continue to expand the scope of sports piracy related DNS blocking, as requested by rightsholders. While perceived as too broad by the targeted DNS resolvers, the orders are not signed blindly. A new court order issued this month rejects blockin…",2025-05-15T11:07:50Z,https://torrentfreak.com/wrong-logo-no-piracy-proof-french-court-rejects-dns-piracy-blocking-bids-250515/,sports,wrong logo piracy proof french court reject dns piracy blocking bid french court continue expand scope sport piracy related dns blocking requested rightsholders perceived broad targeted dns resolvers order signed blindly new court order issued month reject blockin…
Nike’s Zoom Spiridon “Hot Fuchsia” Sports a Striking Mixed-Material Design,"Name: Nike Air Max Plus “Hot Fuchsia”Colorway: Hot Fuchsia/Negre/Canyon Purple/ViotechSKU: IH3360-599MSRP: $170 USDRelease Date: August 2025Where to Buy: NikeA new color variant is set to join Nike’s Zoom Spiridon roster. Dubbed “Hot Fuchsia,” the entire snea…",2025-05-21T09:17:40Z,https://hypebeast.com/2025/5/nike-zoom-spiridon-hot-fuchsia-negre-canyon-purple-viotech-ih3360-599-release-info,sports,nike’s zoom spiridon “hot fuchsia” sport striking mixedmaterial design name nike air max plus “hot fuchsia”colorway hot fuchsianegrecanyon purpleviotechsku ih3360599msrp 170 usdrelease date august 2025where buy nikea new color variant set join nike’s zoom spiridon roster dubbed “hot fuchsia” entire snea…
WEATHER ALERT: Strong to severe thunderstorms expected Saturday afternoon,"The 22News Storm Team issued a Weather Alert for widespread strong, potentially severe, thunderstorms expected Saturday afternoon.",2025-05-16T16:00:00Z,https://www.wwlp.com/weather/weather-news/weather-alert-strong-to-severe-thunderstorms-expected-saturday-afternoon/,sports,weather alert strong severe thunderstorm expected saturday afternoon 22news storm team issued weather alert widespread strong potentially severe thunderstorm expected saturday afternoon
"Kevin O’Leary on Trump, Walmart: Retailers aren’t going to ‘eat the tariffs’","“Shark Tank” investor Kevin O’Leary said in a Monday interview that retailers are not going to “eat the tariffs,” despite pressure from the Trump...",2025-05-20T01:00:47Z,https://thehill.com/business/5308558-kevin-oleary-on-trump-walmart-retailers-tariffs/,sports,kevin o’leary trump walmart retailer aren’t going ‘eat tariffs’ “shark tank” investor kevin o’leary said monday interview retailer going “eat tariffs” despite pressure trump
Lady Gaga Nears EGOT Status After Sports Emmy Win,"Lady Gaga won a Sports Emmy for her performance of ""Hold My Hand"" before the Super Bowl, getting her only one award away from EGOT status.",2025-05-21T06:23:23Z,http://www.rollingstone.com/music/music-news/lady-gaga-sports-emmy-win-hold-my-hand-1235344544/,sports,lady gaga nears egot status sport emmy win lady gaga sport emmy performance hold hand super bowl getting one award away egot status
Gemini Can Now Answer Questions About Images in Android's TalkBack Screen Reader,Google's Expressive Captions can also convey more emotions and label new sounds in videos.,2025-05-15T16:00:08Z,https://www.cnet.com/tech/mobile/gemini-can-now-answer-questions-about-images-in-googles-talkback-screen-reader/,sports,gemini answer question image android talkback screen reader google expressive caption also convey emotion label new sound video
Inside the Democrats’ Reboot,"After the 2024 fiasco, the party is rethinking everything",2025-05-19T11:00:00Z,https://time.com/7286163/inside-the-democratic-party-reboot/,sports,inside democrats’ reboot 2024 fiasco party rethinking everything
Doom: One of gaming's oldest series reckons with the challenges of 2025,Doom is one of the most well-known series in gaming but it still has to work to find new players.,2025-05-17T00:08:51Z,https://www.bbc.com/news/articles/c4gezq2q911o,sports,doom one gaming oldest series reckons challenge 2025 doom one wellknown series gaming still work find new player
Peacock built adaptively on Android to deliver great experiences across screens,Learn how Peacock used Jetpack Compose to build an adaptive Android app delivering seamless streaming experiences across various screens and devices.,2025-05-20T17:45:00Z,https://android-developers.googleblog.com/2025/05/peacock-optimizes-streaming-jetpack-compose.html,sports,peacock built adaptively android deliver great experience across screen learn peacock used jetpack compose build adaptive android app delivering seamless streaming experience across various screen device
"Love it or hate it, everyone is talking about Lululemon's $148 dress","You can find stretchy, strapless dresses almost anywhere, but Lululemon has one of the most popular and controversial options on the market.",2025-05-20T19:29:39Z,https://www.businessinsider.com/lululemon-2-in-1-maxi-dress-popularity-explained-2025-5,sports,love hate everyone talking lululemons 148 dress find stretchy strapless dress almost anywhere lululemon one popular controversial option market
Live Sports Piracy: France ‘Contained’ Illegal IPTV & Illicit Streaming in 2024,"Telecoms regulator Arcom has published a new report on the illicit streaming of sports content in France. In 2024, 18% of French citizens accessed sports content illegally, a figure unchanged from the previous year. Arcom notifications led to the blocking of …",2025-05-21T08:22:25Z,https://torrentfreak.com/live-sports-piracy-france-contained-illegal-iptv-illicit-streaming-in-2024-250521/,sports,live sport piracy france ‘contained’ illegal iptv illicit streaming 2024 telecom regulator arcom published new report illicit streaming sport content france 2024 18 french citizen accessed sport content illegally figure unchanged previous year arcom notification led blocking …
"‘Grouchy’ neighbor repeatedly reports homeowner for their basketball net and sports-playing, despite other homeowners on the street doing the same things: ‘I'm seriously fed up’","The best thing about owning a home… is that you own your home. Anything you decide to do on your property is nobody else's business but yours (unless you're harming someone or something, obviously). It's important to always be mindful of your neighbors as wel…",2025-05-17T13:00:00Z,https://cheezburger.com/40562181/grouchy-neighbor-repeatedly-reports-homeowner-for-their-basketball-net-and-sports-playing-despite,sports,‘grouchy’ neighbor repeatedly report homeowner basketball net sportsplaying despite homeowner street thing ‘im seriously fed up’ best thing owning home… home anything decide property nobody elses business unless youre harming someone something obviously important always mindful neighbor wel…
How sports coaches are helping tackle toxic masculinity,BBC Sport looks at the role sports coaches are playing in steering young people away from the influences of toxic masculinity.,2025-05-16T07:23:40Z,https://www.bbc.com/sport/articles/c5y6v907260o,sports,sport coach helping tackle toxic masculinity bbc sport look role sport coach playing steering young people away influence toxic masculinity
Trump questions why Biden’s cancer wasn’t caught sooner,President Trump on Monday questioned why former President Biden’s prostate cancer diagnosis was not caught and disclosed sooner. “I think it’s very sad...,2025-05-19T21:45:01Z,https://thehill.com/homenews/administration/5308322-trump-joe-biden-prostate-cancer/,sports,trump question biden’s cancer wasn’t caught sooner president trump monday questioned former president biden’s prostate cancer diagnosis caught disclosed sooner “i think it’s sad
Trump on China trade switch-up: They ‘would have broken apart’,"President Trump believes that China would have suffered more harm than the U.S. in a prolonged trade war, and lowered tariffs on Chinese imports to 30% from ...",2025-05-17T12:02:46Z,https://thehill.com/policy/international/5305302-donald-trump-china-us-trade-deal/,sports,trump china trade switchup ‘would broken apart’ president trump belief china would suffered harm u prolonged trade war lowered tariff chinese import 30
‘I am scared’: Wichita woman demands harsher charge after being sucker punched,A woman is demanding a harsher charge for the man she says randomly attacked her in downtown Wichita last weekend. She says the man accused is getting off...,2025-05-15T03:38:18Z,https://www.ksn.com/news/i-am-scared-wichita-woman-demands-harsher-charge-after-being-sucker-punched/,sports,‘i scared’ wichita woman demand harsher charge sucker punched woman demanding harsher charge man say randomly attacked downtown wichita last weekend say man accused getting
Walmart responds to Trump comment that retailer should ‘eat the tariffs’,"Shortly after Walmart announced prices would increase on multiple items sold by the chain, President Donald Trump blasted the company on social media...",2025-05-20T11:48:57Z,https://thehill.com/business/5307935-walmart-donald-trump-tariff-response/,sports,walmart responds trump comment retailer ‘eat tariffs’ shortly walmart announced price would increase multiple item sold chain president donald trump blasted company social medium
Walmart Selling Portable Solar Panel & Charger for $25: Buyers 'Stunned' By Fast Charging,"""Best price and bang for buck by far.""",2025-05-18T00:39:21Z,https://athlonsports.com/other-sports/yelomin-portable-solar-panel-charger-walmart-sale,sports,walmart selling portable solar panel charger 25 buyer stunned fast charging best price bang buck far
"Two arrested, one wanted on arson charges in the Poconos","BARRETT TOWNSHIP, MONROE COUNTY (WBRE/WYOU) — The Pocono Mountain Regional Police have announced the arrest of two individuals and a third suspect still on...",2025-05-19T20:38:01Z,https://www.pahomepage.com/news/two-arrested-one-wanted-on-arson-charges-in-the-poconos/,sports,two arrested one wanted arson charge poconos barrett township monroe county wbrewyou — pocono mountain regional police announced arrest two individual third suspect still
La Liga Soccer Livestream: How to Watch Espanyol vs. Barcelona From Anywhere,The Blaugrana could clinch the title with a win today at their local rivals.,2025-05-15T16:30:03Z,https://www.cnet.com/tech/services-and-software/la-liga-soccer-livestream-how-to-watch-espanyol-vs-barcelona-from-anywhere/,sports,la liga soccer livestream watch espanyol v barcelona anywhere blaugrana could clinch title win today local rival
Serie A Italian Soccer Livestream: How to Watch Inter Milan vs. Lazio From Anywhere,Internazionale need a win at San Siro to keep their double hopes alive.,2025-05-18T15:45:03Z,https://www.cnet.com/tech/services-and-software/serie-a-italian-soccer-livestream-how-to-watch-inter-milan-vs-lazio-from-anywhere/,sports,serie italian soccer livestream watch inter milan v lazio anywhere internazionale need win san siro keep double hope alive
Serie A Italian Soccer Livestream: How to Watch Parma vs. Napoli From Anywhere,Gli Azzurri could move a step closer to clinching the title as they go in search of a win at the Stadio Ennio Tardini.,2025-05-18T15:45:05Z,https://www.cnet.com/tech/services-and-software/serie-a-italian-soccer-livestream-how-to-watch-parma-vs-napoli-from-anywhere/,sports,serie italian soccer livestream watch parma v napoli anywhere gli azzurri could move step closer clinching title go search win stadio ennio tardini
Premier League Soccer: Stream Man City vs. Bournemouth Live From Anywhere,Pep Guardiola's men look to bounce back quickly from their FA Cup Final defeat.,2025-05-20T16:00:06Z,https://www.cnet.com/tech/services-and-software/premier-league-soccer-stream-man-city-vs-bournemouth-live-from-anywhere/,sports,premier league soccer stream man city v bournemouth live anywhere pep guardiolas men look bounce back quickly fa cup final defeat
Premier League Soccer: Stream Aston Villa vs. Tottenham Live From Anywhere,The Villans could move a step closer to UEFA Champions League qualification with a win over a preoccupied Spurs.,2025-05-16T15:31:00Z,https://www.cnet.com/tech/services-and-software/premier-league-soccer-stream-aston-villa-vs-tottenham-live-from-anywhere/,sports,premier league soccer stream aston villa v tottenham live anywhere villans could move step closer uefa champion league qualification win preoccupied spur
"Today's NYT Connections Hints, Answers and Help for May 24, #713","Here's today's Connections answer and hints for groups. These clues will help you solve New York Times' popular puzzle game, Connections, every day!",2025-05-20T01:53:43Z,https://www.cnet.com/tech/gaming/todays-nyt-connections-hints-answers-and-help-for-may-24-713/,sports,today nyt connection hint answer help may 24 713 here today connection answer hint group clue help solve new york time popular puzzle game connection every day
Are Protein Shakes Good for You?,"Shakes can’t replace a balanced, nutrient-dense diet, but they can supplement healthy eating habits.",2025-05-19T12:00:00Z,https://time.com/7285935/are-protein-shakes-good-for-you/,sports,protein shake good shake can’t replace balanced nutrientdense diet supplement healthy eating habit
Losing faith: Rural religious colleges are among the most endangered,Some religious colleges and universities are cutting programs. Others are seeking mergers to reduce costs and expand offerings.,2025-05-18T09:00:00Z,https://www.npr.org/2025/05/18/nx-s1-5381012/rural-religious-colleges-facing-threats,sports,losing faith rural religious college among endangered religious college university cutting program others seeking merger reduce cost expand offering
"YouTube TV’s multiview expansion gets started with ESPN, Bravo, and USA",YouTube TV also plans to launch an 'Always On' multiview.,2025-05-16T20:50:51Z,https://www.androidauthority.com/youtube-tv-espn-bravo-usa-3558722/,sports,youtube tv’s multiview expansion get started espn bravo usa youtube tv also plan launch always multiview
The World's Top 10 Highest Paid Athletes of 2025,"SummaryForbes announced its annual list of the world's highest-paid athletes for 2025Cristiano Ronaldo sits at the top of the list with $275 million USD, with Stephen Curry coming in second, Tyson Fury in at third and moreThe athletes in the list come from va…",2025-05-19T08:20:39Z,https://hypebeast.com/2025/5/worlds-top-10-highest-paid-athletes-2025-cristiano-ronaldo-stephen-curry-tyson-fury-forbes-list,sports,world top 10 highest paid athlete 2025 summaryforbes announced annual list world highestpaid athlete 2025cristiano ronaldo sits top list 275 million usd stephen curry coming second tyson fury third morethe athlete list come va…
Olympic star 'broken' by top swim coach's regime,Gold medallist Ruta Meilutytė describes toxic training environment under esteemed trainer Jon Rudd at top swim club.,2025-05-19T05:02:30Z,https://www.bbc.com/news/articles/cn4gmm2zv8no,sports,olympic star broken top swim coach regime gold medallist ruta meilutytė describes toxic training environment esteemed trainer jon rudd top swim club
"Livvy Dunne, Salma Hayek Stun At Sports Illustrated Swimsuit Issue Launch Party","Livvy Dunne, Salma Hayek and a sea of models flocked to New York City on Thursday night to celebrate the launch of Sports Illustrated's latest swim issue ... and check out pics from the party they all attended, the ladies looked gooooooood!!!! The…",2025-05-16T14:37:07Z,https://www.tmz.com/2025/05/16/sports-illustrated-swimsuit-issue-launch-party-at-the-hard-rock-hotel/,sports,livvy dunne salma hayek stun sport illustrated swimsuit issue launch party livvy dunne salma hayek sea model flocked new york city thursday night celebrate launch sport illustrateds latest swim issue check pic party attended lady looked gooooooood the…
"Today's NYT Mini Crossword Answers for Monday, May 19","Here's today's NYT Mini Crossword answer. These answers will help you solve New York Times' popular crossword game, Mini Crossword, every day!",2025-05-19T02:32:04Z,https://www.cnet.com/tech/gaming/todays-nyt-mini-crossword-answers-for-monday-may-19/,sports,today nyt mini crossword answer monday may 19 here today nyt mini crossword answer answer help solve new york time popular crossword game mini crossword every day
"Today's NYT Mini Crossword Answers for Sunday, May 18","Here's today's NYT Mini Crossword answer. These answers will help you solve New York Times' popular crossword game, Mini Crossword, every day!",2025-05-18T06:49:35Z,https://www.cnet.com/tech/gaming/todays-nyt-mini-crossword-answers-for-sunday-may-18/,sports,today nyt mini crossword answer sunday may 18 here today nyt mini crossword answer answer help solve new york time popular crossword game mini crossword every day
In pictures: Sporting photos of the week,A selection of some of the most striking sports photographs taken around the world over the past seven days.,2025-05-20T10:13:11Z,https://www.bbc.com/sport/articles/cx2eelgd7jgo,sports,picture sporting photo week selection striking sport photograph taken around world past seven day
4Warn Storm Team tracks severe weather in Oklahoma Monday,The 4Warn Storm Team is tracking severe weather Monday after storms hit the state Saturday and Sunday.,2025-05-19T13:50:30Z,https://kfor.com/news/local/4warn-storm-team-tracks-severe-weather-in-oklahoma-monday/,sports,4warn storm team track severe weather oklahoma monday 4warn storm team tracking severe weather monday storm hit state saturday sunday
PL-linked Sesko to decide future at the end of the season,"Benjamin Sesko will decide his future at the end of the season, Sky Sports News understands.",2025-05-16T18:50:00Z,https://www.skysports.com/football/news/11095/13369177/benjamin-sesko-transfer-rb-leipzig-striker-to-decide-future-at-the-end-of-the-season-amid-premier-league-interest,sports,pllinked sesko decide future end season benjamin sesko decide future end season sky sport news understands
Xpeng P7 rolls out as electric sports sedan with sculpted rear and driving mode by AI,"designed by rafik ferrag, the mastermind behind the first-generation P7 in 2018, the recent electric car goes minimal for its exterior.
The post Xpeng P7 rolls out as electric sports sedan with sculpted rear and driving mode by AI appeared first on designboom…",2025-05-16T00:10:53Z,https://www.designboom.com/technology/xpeng-p7-electric-sports-sedan-sculpted-rear-driving-mode-ai-05-16-2025/,sports,xpeng p7 roll electric sport sedan sculpted rear driving mode ai designed rafik ferrag mastermind behind firstgeneration p7 2018 recent electric car go minimal exterior post xpeng p7 roll electric sport sedan sculpted rear driving mode ai appeared first designboom…
"AI Mode levels up with new AI features, stealing Google Search's spotlight","Google AI Mode now includes enhanced features to help you shop, book tickets online, and manage various tasks seamlessly in one place.",2025-05-20T17:45:20Z,https://www.androidcentral.com/apps-software/ai/ai-mode-levels-up-with-new-ai-features-stealing-google-searchs-spotlight,sports,ai mode level new ai feature stealing google search spotlight google ai mode includes enhanced feature help shop book ticket online manage various task seamlessly one place
Men's Casio G-Shock Sports Digital Watch w/ Black Risin Band $23.45 + Free Store Pickup,"Adult, Male wristwatch with full 200 Meter water resistant, shock resistant, 24 hour stopwatch and countdown timer, standard issue never looked this good. Black resin, plastic band. This is a digital...",2025-05-20T11:28:39Z,https://slickdeals.net/f/18326638-g-shock-dw9052-1cwt-23-45?utm_source=rss&utm_content=fp&utm_medium=RSS2,sports,men casio gshock sport digital watch w black risin band 2345 free store pickup adult male wristwatch full 200 meter water resistant shock resistant 24 hour stopwatch countdown timer standard issue never looked good black resin plastic band digital
Shokz OpenRun Pro 2 Bone Conduction Open-Ear Sports Headphones (Steel Blue) $120 + Free Shipping,"Shokz - OpenRun Pro 2 Premium Bone Conduction Open-Ear Sport Headphones - Steel Blue at Best Buy 
 
Open Box from - 108.99 
 
https://www.bestbuy.com/site/shok...Id=6590116",2025-05-19T16:06:44Z,https://slickdeals.net/f/18324442-shokz-openrun-pro-2-bone-conduction-open-ear-sports-headphones-steel-blue-120-free-shipping?utm_source=rss&utm_content=fp&utm_medium=RSS2,sports,shokz openrun pro 2 bone conduction openear sport headphone steel blue 120 free shipping shokz openrun pro 2 premium bone conduction openear sport headphone steel blue best buy open box 10899 httpswwwbestbuycomsiteshokid6590116
not for automotive use: MSCHF recycles parts of mercedes-AMG’s sports car into furniture,"for the first time since its founding, the art collective opens its garage door to the public for the exhibition, which runs between may 14th and 17th, 2025.
The post not for automotive use: MSCHF recycles parts of mercedes-AMG’s sports car into furniture app…",2025-05-15T10:10:05Z,https://www.designboom.com/design/not-for-automotive-use-mschf-recycle-mercedes-amg-sports-car-furniture-exhibition-05-15-2025/,sports,automotive use mschf recycles part mercedesamg’s sport car furniture first time since founding art collective open garage door public exhibition run may 14th 17th 2025 post automotive use mschf recycles part mercedesamg’s sport car furniture app…
Mark Cuban is leaving Shark Tank — and making a $750 million return to sports,"Mark Cuban is best known for turning around the fortunes of the Dallas Mavericks from worst to first, after he bought the team in 2000. After selling his majority stake in 2023 to Miriam Adelson, Cuban announced Thursday his return to a big play in the sports…",2025-05-16T18:50:00Z,https://qz.com/mark-cuban-shark-tank-sports-private-equity-1851781085,sports,mark cuban leaving shark tank — making 750 million return sport mark cuban best known turning around fortune dallas maverick worst first bought team 2000 selling majority stake 2023 miriam adelson cuban announced thursday return big play sports…
"2025 Sports Emmys Winners List: Lady Gaga, Charles Barkley, Peyton Manning & More","The 2025 Sports Emmys recognize excellence in sports television coverage. Roy Wood Jr. hosted the ceremony, which took place on Tuesday, May 20, at Jazz at Lincoln Center’s Frederick P. Rose Hall in New York City. During the award show, sports producer David …",2025-05-21T03:40:00Z,http://deadline.com/2025/05/2025-sports-emmys-winners-list-1236406860/,sports,2025 sport emmy winner list lady gaga charles barkley peyton manning 2025 sport emmy recognize excellence sport television coverage roy wood jr hosted ceremony took place tuesday may 20 jazz lincoln center’s frederick p rose hall new york city award show sport producer david …
Tesla rival unveils concept car with powerful features and an affordable price tag: 'Puts their competitors on their heels',The automotive world may never be the same.,2025-05-18T10:45:30Z,https://autos.yahoo.com/tesla-rival-unveils-concept-car-104530572.html,sports,tesla rival unveils concept car powerful feature affordable price tag put competitor heel automotive world may never
'TERRIBLE...no excuses!' | De Bruyne reacts to THAT open goal miss,"Speaking to Sky Sports Football, Kevin De Bruyne reacts to his massive open goal miss against Bournemouth labelling the shot as 'terrible'.",2025-05-20T21:21:00Z,https://www.skysports.com/football/video/11095/13371836/kevin-de-bruyne-reacts-to-his-massive-open-goal-miss-against-bournemouth,sports,terribleno excuse de bruyne reacts open goal miss speaking sky sport football kevin de bruyne reacts massive open goal miss bournemouth labelling shot terrible
Woman faces trespassing charge for violating year-long ‘ban’ from Lagoon Amusement Park,A woman has been charged with a misdemeanor after being trespassed from Lagoon Amusement Park and posting on social media.,2025-05-19T18:58:15Z,https://www.abc4.com/news/wasatch-front/woman-trespassing-lagoon/,sports,woman face trespassing charge violating yearlong ‘ban’ lagoon amusement park woman charged misdemeanor trespassed lagoon amusement park posting social medium
High-School Runner Rips GOP State Rep. for Anti-Trans Comments,Trans athlete Soren Stark-Chessa finished first in the 1600-meter race at a recent track meet in Maine. Republican state represent,2025-05-16T14:11:54Z,https://kottke.org/25/05/high-school-runner-rips-state-rep-for-anti-trans-comments,sports,highschool runner rip gop state rep antitrans comment trans athlete soren starkchessa finished first 1600meter race recent track meet maine republican state represent
ASICS Sees Strong Double-Digit Growth in Q1 2025,"SummaryRevenue Growth: ASICS EMEA reported an 18.7% year-over-year increase in Q1 2025 revenue, with wholesale channels up 17.6%Category Leaders: SportStyle grew by 47.7% and Apparel by 34.5%, while Performance Running, Tennis, and Indoor sports also saw prof…",2025-05-18T03:33:43Z,https://hypebeast.com/2025/5/asics-financial-growth-report-q1-2025-info,sports,asics see strong doubledigit growth q1 2025 summaryrevenue growth asics emea reported 187 yearoveryear increase q1 2025 revenue wholesale channel 176category leader sportstyle grew 477 apparel 345 performance running tennis indoor sport also saw prof…
A doctor who owns a longevity clinic shared his simple 5-step morning routine,"Darshan Shah, a doctor who owns a longevity clinic, has a 40-minute routine he follows every morning to help him live longer.",2025-05-15T11:04:52Z,https://www.businessinsider.com/longevity-clinic-doctor-morning-routine-2025-5,sports,doctor owns longevity clinic shared simple 5step morning routine darshan shah doctor owns longevity clinic 40minute routine follows every morning help live longer
