Category,Title,Description,Published At,URL
technology,Apple Foldable iPhone May Have Face ID Embedded in the Screen,"Apple is planning to put its facial recognition technology into the long-rumored folding iPhone, according to a new leak this week.",2025-04-19T13:00:09Z,https://www.cnet.com/tech/mobile/apple-foldable-iphone-may-have-face-id-embedded-in-the-screen/
technology,The secret to successful AI in hiring? Stop overthinking it,Here's what talent leaders actually need to know about today's rapidly evolving technology and how to use it.,2025-05-01T16:01:00Z,https://www.businessinsider.com/sc/how-to-stop-worrying-about-ai
technology,ICE just ordered $30 million worth of new technology from Palantir to track immigrants,Documents seen by BI show a $30 million contract between ICE and Palantir for software to track visa overstays and self-deportation.,2025-04-17T21:24:45Z,https://www.businessinsider.com/ice-palantir-new-technology-30-million-visa-overstays-self-deportation-2025-4
technology,What actually is a drone? This technology is radically changing warfare.,"Aerial, ground, and naval drones have seen extensive use in Russia's war in Ukraine. The technology is expected to be a major part of future warfare.",2025-04-19T11:17:01Z,https://www.businessinsider.com/what-is-a-drone
technology,I went on a test flight showcasing Honeywell's new technology that could prevent airliners from colliding,I flew on a test flight aboard Honeywell's Boeing 757 jet to see new tech that could prevent airliners from colliding on runways — a big issue lately.,2025-04-18T19:50:40Z,https://www.businessinsider.com/aviation-safety-crash-new-technology-prevent-accidents-honeywell-757-photos-2025-4
technology,The ‘shark skin’ technology that could make flying cheaper,,2025-05-06T13:00:00Z,https://consent.yahoo.com/v2/collectConsent?sessionId=1_cc-session_c604b33d-50e0-4461-aac0-d203cb2a6008
technology,United Airlines says it has 'no other choice' but to cancel flights from Newark airport,"United Airlines says its forced to cancel 35 daily flights from Newark due to staffing and technology issues at the airport, a major hub.",2025-05-03T17:09:03Z,https://www.businessinsider.com/united-airlines-flight-cancellations-delays-newark-2025-5
technology,Jensen Huang says he uses AI as a tutor 'every day',"Jensen Huang said at the 28th annual Milken Institute Global Conference that AI is the ""greatest opportunity for us to close the technology divide.""",2025-05-07T06:50:17Z,https://www.businessinsider.com/nvidia-ceo-jensen-huang-ai-tutor-every-day-milken-2025-5
technology,You Have Just a Few More Days to Explore Black Mirror: Bandersnatch,The dystopian series' 2018 interactive special is leaving the streamer for good May 12.,2025-05-09T20:15:03Z,https://gizmodo.com/you-have-just-a-few-more-days-to-explore-black-mirror-bandersnatch-2000600291
technology,Yours Truly on ‘Primary Technology’,"Special guest John Gruber joins us to break down Eddy Cue’s statements on AI replacing the iPhone in 10 years, using AI search in Safari, Apple’s continued fight for App Store control, and what we’...",2025-05-09T00:00:47Z,https://primarytech.fm/74
technology,This Massive Screen for Live Sports Puts You in the Best Seat in the Stadium,"Cosm's cushy venues provide a fully immersive experience that helps sports fans feel like they're really at the game—with all the thrills, the shouting, and even the hot dogs.",2025-04-21T10:00:00Z,https://www.wired.com/story/cosm-live-sports-immersive-experiences/
technology,Sex-Fantasy Chatbots Are Leaking a Constant Stream of Explicit Messages,Some misconfigured AI chatbots are pushing people’s chats to the open web—revealing sexual prompts and conversations that include descriptions of child sexual abuse.,2025-04-11T10:30:00Z,https://www.wired.com/story/sex-fantasy-chatbots-are-leaking-explicit-messages-every-minute/
technology,The Washington Post will now let ChatGPT summarize its articles,"The Washington Post and OpenAI have announced a “strategic partnership” that will “make high-quality news more accessible in ChatGPT,” according to a Washington Post press release. OpenAI has already made partnerships with over 20 other news publishers, inclu…",2025-04-22T15:45:55Z,https://www.theverge.com/news/653500/the-washington-post-openai-chatgpt-partnership
technology,OpenAI names new nonprofit ‘advisors’,"OpenAI has revealed the “advisors” for its new nonprofit commission: Dolores Huerta, Monica Lozano, Dr. Robert K. Ross, and Jack Oliver. The company says the four advisors will help “inform OpenAI’s philanthropic efforts,” according to an announcement on Tues…",2025-04-15T22:28:27Z,https://www.theverge.com/news/649430/openai-nonprofit-commission-advisors
technology,Google Is Getting Into the Movie Business to Produce Pro-Tech Propaganda,Big tech has an image problem. It's going to the people who make the images for help.,2025-05-05T20:05:25Z,https://gizmodo.com/google-is-getting-into-the-movie-business-to-produce-pro-tech-propaganda-2000598304
technology,Beijing Pulls Further Ahead With Strict New EV Battery Safety Mandate,"Starting in July 2026, the country will have some of the world's strictest EV battery safety and testing requirements.",2025-04-18T16:20:08Z,https://gizmodo.com/beijing-pulls-further-ahead-with-strict-new-ev-battery-safety-mandate-2000591408
technology,"Bose Repeats Its Black Friday Deal, SoundLink Flex Bluetooth Speaker Drops to Its Lowest Price Again","The Bose SoundLink Flex is a powerful speaker to have in your corner, plus it comes in several different colors.",2025-04-11T15:35:30Z,https://gizmodo.com/bose-repeats-its-black-friday-deal-soundlink-flex-bluetooth-speaker-drops-to-its-lowest-price-again-2000587718
technology,Driverless Semi-Trucks Are Coming Soon to a Highway in Texas,"If you find yourself driving on I-45 in Texas, look out.",2025-04-23T20:56:01Z,https://gizmodo.com/driverless-semi-trucks-are-coming-soon-to-a-highway-in-texas-2000593474
technology,VoicePatrol unveils real-time AI voice protection for games,VoicePatrol is unveiling its real-time AI voice protection technology for game studios to make gaming communities safer.,2025-04-16T13:00:00Z,https://venturebeat.com/games/voicepatrol-unveils-real-time-ai-voice-protection-for-games/
technology,EssilorLuxottica Nuance Audio Glasses Review: The Future of Hearing,When hearing aids hide in plain sight.,2025-05-05T13:00:00Z,https://www.wired.com/review/essilorluxottica-nuance-audio-glasses/
technology,"Black Friday Prices Are Here Early, This Ninja Blender Is Back at Its Lowest",You don't need to waste time or money going to a restaurant for smoothies and tasty drinks when this blender has your back.,2025-04-14T21:05:47Z,https://gizmodo.com/black-friday-prices-are-here-early-this-ninja-blender-is-back-at-its-lowest-2000588314
technology,"Amazon’s Smart Home Bundle, Echo Pop With Smart Bulb, Is Almost Free Right Now",Give your house a much-needed smart home makeover with this affordable set.,2025-04-18T13:55:43Z,https://gizmodo.com/amazons-smart-home-bundle-echo-pop-with-smart-bulb-is-almost-free-right-now-2000590792
technology,These Satellites Just Nailed the Most Precise Formation Flight in Space History,"ESA's Proba-3 just achieved a world-first: millimeter-precise formation flying, entirely on its own.",2025-05-08T14:55:15Z,https://gizmodo.com/these-satellites-just-nailed-the-most-precise-formation-flight-in-space-history-2000599575
technology,Why Settle for a Budget Speaker When Sony’s Waterproof Bluetooth Speaker Is This Cheap?,This Sony ULT Field 1 portable Bluetooth speaker for just $88 — just in time for the warm weather.,2025-05-08T14:25:24Z,https://gizmodo.com/why-settle-for-a-budget-speaker-when-sonys-waterproof-bluetooth-speaker-is-this-cheap-2000599245
technology,"Amazon Has No Profit Margin Left on This 9-In-1 Air Fryer Rated 4.8/5 From 10,000 Reviews","If you're looking for a way to make meal prep more convenient, the COSORI 9-in-1 air fryer is an investment that will pay off.",2025-04-26T14:20:47Z,https://gizmodo.com/amazon-has-no-profit-margin-left-on-this-9-in-1-air-fryer-rated-4-8-5-from-10000-reviews-2000594897
technology,DJI’s new drone speaker lets cops yell at you from the sky,"DJI’s new drone accessory is designed to ensure public safety and emergency officials are heard loud and clear — and I mean really loud. Its enterprise-focused Zenmuse V1 speaker can broadcast the sound of someone’s voice at up to 127 decibels at 1 meter, a n…",2025-04-16T15:25:27Z,https://www.theverge.com/news/649855/dji-drone-speaker-spotlight-zenmuse-jet-engine
technology,Stunts are finally getting their own category at the Oscars,"After years of stuntwork largely being overlooked by the Academy of Motion Picture Arts and Sciences, the Oscars are about to add a new category. Today, the Academy announced that it intends to start giving out Oscar statues for stunt design starting with fil…",2025-04-10T22:05:47Z,https://www.theverge.com/news/646835/oscars-stunt-awards-category-2027
technology,Netflix is removing Black Mirror: Bandersnatch,"Netflix is removing the last two shows listed on its Interactive Specials page: Black Mirror: Bandersnatch and Unbreakable Kimmy Schmidt: Kimmy vs. the Reverend, reports What’s on Netflix. The two specials will be pulled on May 12th, 2025, according to the pu…",2025-05-09T00:14:51Z,https://www.theverge.com/news/663933/netflix-black-mirror-bandersnatch-kimmy-schmidt-removal
technology,The US hikes tariffs on solar products from Asia,"Solar cells from four Southeast Asian countries that have been major suppliers to the US are facing newly increased tariffs, hiked up as high as 3,521 percent.  The tariffs affect Cambodia, Malaysia, Thailand, and Vietnam, which together accounted for more th…",2025-04-22T19:30:30Z,https://www.theverge.com/news/653750/tariffs-solar-us-china-southeast-asia
technology,"Lightricks just made AI video generation 30x faster — and you won’t need a $10,000 GPU","Lightricks unveils groundbreaking LTXV-13B AI video model that runs 30X faster than competitors on consumer hardware through innovative ""multiscale rendering"" technology.",2025-05-06T17:56:44Z,https://venturebeat.com/ai/lightricks-just-made-ai-video-generation-30x-faster-and-you-wont-need-a-10000-gpu/
technology,China Bans 'Smart' and 'Autonomous' Driving Terms From Vehicle Ads,"China is banning automakers from using the terms ""smart driving"" and ""autonomous driving"" when they advertise driving assistance features, and it will tighten scrutiny of such technology upgrades. From a report: The mandate on vehicle advertising was delivere…",2025-04-17T13:00:00Z,https://tech.slashdot.org/story/25/04/17/0813228/china-bans-smart-and-autonomous-driving-terms-from-vehicle-ads
technology,UK bans video game controller exports to Russia,"The Foreign Office says Russia was ""buying harmless goods and turning them into tools of war"".",2025-04-24T16:16:34Z,https://www.bbc.com/news/articles/crkx14jykn8o
technology,Is QUALCOMM Incorporated (QCOM) the Best Technology Dividend Stock to Invest in?,,2025-04-14T00:52:58Z,https://consent.yahoo.com/v2/collectConsent?sessionId=1_cc-session_ec05bb9c-95bf-4852-9451-6906a9eac484
technology,Why Marvell Technology (MRVL) is a Top Growth Stock for the Long-Term,"Wondering how to pick strong, market-beating stocks for your investment portfolio? Look no further than the Zacks Style Scores.",2025-05-05T13:45:10Z,https://finance.yahoo.com/news/why-marvell-technology-mrvl-top-134510149.html
technology,Stop sorting your garbage with this new technology,"Recycling robots are using artificial intelligence to learn how to sort recyclables by recognizing patterns in colors, textures, shapes and logos.",2025-04-19T10:00:33Z,https://www.foxnews.com/tech/stop-sorting-your-garbage-new-technology
technology,Marvell Technology Plunges 17% in a Year: Hold or Fold the Stock?,,2025-05-08T13:31:00Z,https://consent.yahoo.com/v2/collectConsent?sessionId=1_cc-session_3c21b2fb-250b-4e45-8c9d-0d7f83a94859
technology,Sam Altman's Eye-Scanning Orb Is Now Coming to the US,"At a high-profile event in San Francisco, World announced it is launching a series of Apple-like stores, as well as a partnership with dating giant Match Group.",2025-05-01T02:24:31Z,https://www.wired.com/story/sam-altman-orb-eyeball-scan-launch-us/
technology,Forensics Tool ‘Reanimates’ the ‘Brains’ of AIs That Fail in Order to Understand What Went Wrong,AI Psychiatry applies a series of forensic algorithms to isolate the data behind the AI system’s decision-making.,2025-04-30T21:02:18Z,https://gizmodo.com/forensics-tool-reanimates-the-brains-of-ais-that-fail-in-order-to-understand-what-went-wrong-2000596688
technology,Apple Foldable iPhone May Have Face ID Embedded in the Screen,"Apple is planning to put its facial recognition technology into the long-rumored folding iPhone, according to a new leak this week.",2025-04-19T13:00:09Z,https://www.cnet.com/tech/mobile/apples-folding-iphone-rumored-to-have-face-id-embedded-in-screen/?pageview_type=RSS-yahoo-feed
technology,"Report: US AI companies vulnerable to espionage, sabotage from China | CUOMO","American tech companies have spent billions of dollars in the name of artificial intelligence, but who is making the technology? A new report indicates the...",2025-04-23T01:12:37Z,https://www.yahoo.com/news/report-us-ai-companies-vulnerable-011237568.html
technology,Trump’s New Streaming Service Truth+ Is a Conspiracy Theorist’s Dream Come True,"Aliens, lizard people, and Jesus, oh my!",2025-05-06T20:40:53Z,https://gizmodo.com/trumps-new-streaming-service-truth-is-a-conspiracy-theorists-dream-come-true-2000598762
technology,Researchers Tattooed Tardigrades. They Promise It Will Be Useful,The world’s tiniest animal somehow got more hardcore.,2025-04-27T10:00:58Z,https://gizmodo.com/researchers-tattooed-tardigrades-they-promise-it-will-be-useful-2000593853
technology,Let The Predator Have a New Video Game,"Amid the growing Predator renaissance, the sci-fi monster may be ready to headline a new single-player game.",2025-04-26T18:15:14Z,https://gizmodo.com/predator-single-player-video-game-2000594448
technology,Sony shows off the PS5 Pro’s liquid metal updates,"Sony has published a new teardown of the PlayStation 5 Pro, highlighting improvements that it made to the cooling apparatus of the machine. They include tweaks to the PS5’s liquid metal cooling design aimed to give the console “more stable” cooling.   The cha…",2025-04-21T18:09:44Z,https://www.theverge.com/news/652556/ps5-pro-teardown-liquid-metal-cooling-changes
technology,Google is scrapping its planned changes for third-party cookies in Chrome,"Google’s plan to phase out third-party cookies in Chrome is officially over. In an update on Tuesday, Google Privacy Sandbox VP Anthony Chavez says the company has decided “to maintain our current approach to offering users third-party cookie choice in Chrome…",2025-04-22T22:06:40Z,https://www.theverge.com/news/653964/google-privacy-sandbox-plans-scrapped-third-party-cookies
technology,Improving Magnetoplasmadynamic Ion Thrusters With Superconductors,"Ion thrusters are an amazing spacecraft propulsion technology, providing very high efficiency with relatively little fuel. Yet getting one to produce more thrust than that required to lift a sheet …read more",2025-04-10T17:00:00Z,https://hackaday.com/2025/04/10/improving-magnetoplasmadynamic-ion-thrusters-with-superconductors/
technology,Back to Reality with the Time Brick,"There are a lot of distractions in daily life, especially with all the different forms of technology and their accompanying algorithms vying for our attention in the modern world. [mar1ash] …read more",2025-04-30T05:00:58Z,https://hackaday.com/2025/04/29/back-to-reality-with-the-time-brick/
technology,Supercon 2024: Photonics/Optical Stack for Smart-Glasses,Smart glasses are a complicated technology to work with. The smart part is usually straightforward enough—microprocessors and software are perfectly well understood and easy to integrate into even very compact …read more,2025-04-30T17:02:54Z,https://hackaday.com/2025/04/30/supercon-2024-photonics-optical-stack-for-smart-glasses/
technology,The Nuclear War You Didn’t Notice,"We always enjoy [The History Guy], and we wish he’d do more history of science and technology. But when he does, he always delivers! His latest video, which you can see below, focuses on the …",2025-05-10T02:00:46Z,https://hackaday.com/2025/05/09/the-nuclear-war-you-didnt-notice/
technology,A Delay Line Memory Demo Board,"Delay line memory is a technology from yesteryear, but it’s not been entirely forgotten. [P-Lab] has developed a demo board for delay-line memory, which shows how it worked in a very obvious …",2025-05-04T11:00:58Z,https://hackaday.com/2025/05/04/a-delay-line-memory-demo-board/
technology,Presence Detection Augments 1930s Home,"It can be jarring to see various sensors, smart switches, cameras, and other technology in a house built in the 1930s, like [Chris]’s was. But he still wanted presence detection so as to not …",2025-04-18T15:30:34Z,https://hackaday.com/2025/04/18/presence-detection-augments-1930s-home/
technology,Gaze Upon Robby The Robot’s Mechanical Intricacy,"One might be tempted to think that re-creating a film robot from the 1950s would be easy given all the tools and technology available to the modern hobbyist, but as [Mike Ogrinz]’s quest to r…",2025-05-01T08:00:04Z,https://hackaday.com/2025/05/01/gaze-upon-robby-the-robots-mechanical-intricacy/
technology,Exclusive: Eyeo exits stealth to give cameras human-like colour vision,"Dutch startup Eyeo has emerged from stealth with €15mn in funding to advance a breakthrough photonics technology for cameras that could radically disrupt the way we take images. Eyeo spun out last year from Belgium’s Imec, one of the world’s leading nanoelect…",2025-05-07T00:01:35Z,https://thenextweb.com/news/exclusive-eyeo-startup-exits-stealth-to-give-cameras-human-like-colour-vision
technology,First Driverless Semis Have Started Running Regular Longhaul Routes,"An anonymous reader quotes a report from CNN: Driverless trucks are officially running their first regular long-haul routes, making roundtrips between Dallas and Houston. On Thursday, autonomous trucking firm Aurora announced it launched commercial service in…",2025-05-03T03:30:00Z,https://tech.slashdot.org/story/25/05/02/2258206/first-driverless-semis-have-started-running-regular-longhaul-routes
technology,"IBM CEO Says AI Has Replaced Hundreds of Workers But Created New Programming, Sales Jobs","IBM CEO Arvind Krishna said the tech giant has used AI, and specifically AI agents, to replace the work of a couple hundred human resources workers. As a result, it has hired more programmers and salespeople, he said. From a report: Krishna's comments on Mond…",2025-05-07T14:03:00Z,https://slashdot.org/story/25/05/07/143250/ibm-ceo-says-ai-has-replaced-hundreds-of-workers-but-created-new-programming-sales-jobs
technology,Older People Who Use Smartphones 'Have Lower Rates of Cognitive Decline',"An anonymous reader quotes a report from The Guardian: Fears that smartphones, tablets and other devices could drive dementia in later life have been challenged by research that found lower rates of cognitive decline in older people who used the technology. A…",2025-04-16T03:30:00Z,https://science.slashdot.org/story/25/04/16/0028246/older-people-who-use-smartphones-have-lower-rates-of-cognitive-decline
technology,ILM’s Fan-Favorite Star Wars Making-of Series Is Now Streaming Season 2,Star Wars Celebration shared a new trailer for the Light & Magic doc series ahead of its return to Disney+.,2025-04-18T17:00:24Z,https://gizmodo.com/ilms-fan-favorite-star-wars-making-of-series-is-now-streaming-season-2-2000586776
technology,Ukrainian soldiers are evacuating wounded soldiers with ground robots — but the risks mean it's only done as a last resort,"Robots allow Ukraine's troops to evacuate the injured without putting more soldiers in danger, but it isn't often used as it can create new risks.",2025-04-29T09:10:01Z,https://www.businessinsider.com/ukraine-uses-ground-robots-rescue-wounded-last-resort-for-now-2025-4
technology,Apple Partner TSMC Unveils Advanced 1.4nm Process for 2028 Chips,"Apple chipmaker TSMC at the North America Technology Symposium has teased its next-generation A14 process node that will enter planned production in 2028.





The cutting-edge A14 node will allow for highly advanced 1.4nm chips that are likely to be utilized…",2025-04-24T11:16:09Z,https://www.macrumors.com/2025/04/24/apple-partner-tsmc-1-4nm-process-2028-chips/
entertainment,"Amazon’s Newest Fire TV Stick 4K Is So Cheap, It Feels Like a Glitch but It’s Real","Take your must-have entertainment with you wherever you go, then just plug and play! It's that easy.",2025-04-30T14:25:12Z,https://gizmodo.com/this-newest-fire-tv-stick-4k-is-so-cheap-it-feels-like-a-glitch-but-its-real-2000595974
entertainment,EA lays off staff and cancels a Titanfall game,"Electronic Arts is reportedly eliminating “between 300 and 400 positions” and scrapping a game set in the Titanfall universe, codenamed R7, that was in the works at Respawn Entertainment, according to Bloomberg. “As part of our continued focus on our long-ter…",2025-04-29T22:58:09Z,https://www.theverge.com/news/658468/ea-layoffs-respawn-entertainment-titanfall-canceled
entertainment,Remedy’s multiplayer Control spinoff FBC: Firebreak launches in June,"The summer of video game releases is starting to heat up. Remedy Entertainment, the studio behind Alan Wake and Control, announced that its first multiplayer title FBC: Firebreak will launch on June 17th. It’ll be available on PC (both Steam and the Epic Game…",2025-04-23T19:42:07Z,https://www.theverge.com/news/654718/fbc-firebreak-release-date-remedy-control
entertainment,Be careful what you read about an Elden Ring movie,"On Tuesday, a publication called Nexus Point News published a headline for what looked to be a major piece of entertainment news: “EXCLUSIVE: Alex Garland Set To Direct ‘Elden Ring’ Film For A24.” The article claimed that Elden Ring “is expected to be Garland…",2025-05-06T21:30:48Z,https://www.theverge.com/news/662200/elden-ring-movie-nexus-point-news-be-careful
entertainment,Let’s rewatch the Grand Theft Auto VI trailer,"The delay of Grand Theft Auto VI into next year is a big deal. The game is the follow-up to arguably the biggest entertainment release of all time, one that originally debuted well over a decade ago. Even if GTAV is still going strong, now spanning multiple c…",2025-05-02T16:00:19Z,https://www.theverge.com/news/660233/gta-6-trailer-rewatch-delay
entertainment,Anker’s 4K outdoor projector looks and sounds great… on paper,"Anker’s new all-in-one Nebula X1 smart projector has everything you’d want from a “cinema-grade outdoor entertainment system.” It produces a bright 4K image from a triple-laser light engine capable of 3,500 ANSI lumens, automatically finds the best place to p…",2025-04-23T20:52:53Z,https://www.theverge.com/news/654392/anker-x1-waterproof-4k-projector-satellite-speaker-price-specs
entertainment,Polygon sold to GameRant owner Valnet,"Polygon, The Verge’s sister site dedicated to gaming and entertainment, has been sold by Vox Media to Valnet, a company that owns brands like ScreenRant, GameRant, and Android Police. Some Polygon staffers will continue with the publication under its new owne…",2025-05-01T16:06:33Z,https://www.theverge.com/news/659575/polygon-vox-media-sold-valnet-gamerant
entertainment,"Amazon Offers the Newest Model of Fire TV Stick for Almost Free, Grab It Before It’s Gone",Don't miss a thing with his deal that'll let you stay on top of all the content you want at a low price.,2025-04-21T11:34:09Z,https://gizmodo.com/amazon-offers-the-newest-model-of-fire-tv-stick-for-almost-free-grab-it-before-its-gone-2000591415
entertainment,"Amazon Fire Max 11 Tablet Bundle Just Hit a Record Low, Accessories Included, No Extra Cost",Play hard or stay productive on the go with this affordable bundle.,2025-04-21T14:25:24Z,https://gizmodo.com/amazon-fire-max-11-tablet-bundle-just-hit-a-record-low-accessories-included-no-extra-cost-2000591388
entertainment,Star Wars Goes Back to Strategy Games With The Trailer for Zero Company,The Clone Wars gets tactical with the 2026 release of Star Wars: Zero Company,2025-04-19T07:35:12Z,https://gizmodo.com/star-wars-goes-back-to-strategy-games-with-the-trailer-for-zero-company-2000590354
entertainment,Apple's buzzy new Seth Rogen show mocks brand movies. People who make them are thrilled.,"""The Studio"" from Apple TV+ parodies the coupling of brands and entertainment and is the talk of brand marketing circles.",2025-04-15T12:45:17Z,https://www.businessinsider.com/seth-rogen-apple-tv-studio-marketers-buzz-art-commerce-tension-2025-4
entertainment,Pontins owner charged with corporate manslaughter after grandmother's death,"Wendy Jones died in hospital about six months after being injured at Pontins Brean Sands, in Somerset.",2025-04-14T23:55:45Z,https://www.bbc.com/news/articles/cm2xkdmjyx0o
entertainment,Star Wars is getting a turn-based strategy game called Zero Company,"The Star Wars strategy game announced in 2022 finally has a name: Zero Company, as EA revealed today. A website about the game describes it as a “single-player turn-based tactics game,” includes an image, and says that a “first look” will be shown at Star War…",2025-04-14T16:57:14Z,https://www.theverge.com/news/648151/star-wars-zero-company-strategy-game-celebration
