Category,Title,Description,Published At,URL
entertainment,"Instagram CEO testifies about competing with TikTok: ‘You’re either growing, or you’re slowly dying’","When Adam Mosseri took over Meta-owned Instagram as CEO in 2018, the app was experiencing what he'd later call ""concerning"" drops and plateaus in user engagement, thanks partly to fierce competition from a new app: TikTok. Instagram estimated in 2019 that 23 …",2025-05-08T22:00:30Z,https://www.theverge.com/antitrust/663894/instagram-ceo-adam-mosseri-ftc-meta-antitrust-trial
entertainment,Jon Voight says he's sent Trump a 'comprehensive plan' to 'make Hollywood great again',"""The President loves the entertainment business and this country, and he will help us make Hollywood great again,"" Voight said in a statement.",2025-05-06T04:32:01Z,https://www.businessinsider.com/jon-voight-help-trump-make-hollywood-great-again-2025-5
entertainment,"LG 65-Inch Alexa Built-In Smart TV Just Got a Price Cut So Deep, Now Cheaper Than Black Friday","Time for a serious renovation of your living room, and this TV will get you there.",2025-05-08T13:25:14Z,https://gizmodo.com/lg-65-inch-alexa-built-in-smart-tv-just-got-a-price-cut-so-deep-now-cheaper-than-black-friday-2000599347
entertainment,Poolhouse raises $34M for gamified pool from the creators of Topgolf,"Poolhouse, an effort from the Topgolf founders to build entertainment clubs around the game of pool, has raised $34 million.",2025-04-14T09:00:00Z,https://venturebeat.com/games/poolhouse-raises-34m-for-gamified-pool-from-the-creators-of-topgolf/
entertainment,Ziff Davis and IGN sue OpenAI for copyright infringement,"In one of the more common disputes of modern AI, Ziff Davis, IGN Entertainment and Everyday Health Media have sued Open AI for copyright infringement.",2025-04-26T21:05:00Z,https://venturebeat.com/games/ziff-davis-and-ign-sue-openai-for-copyright-infringement/
entertainment,Meta's Monopoly Made It a Fair-Weather Friend,"As the FTC trial has shown, a lack of competition allowed the company to shift its focus away from users—and toward its bottom line.",2025-04-18T14:00:00Z,https://www.wired.com/story/plaintext-ftc-meta-trial-mark-zuckerberg/
entertainment,"Universal Studios Fan Fest Nights Unleashes an Incredible, Massive Dungeons & Dragons Puppet",The epic collaboration between Wizards of the Coast and the Jim Henson Creature Shop brings legendary beholder Xanathar to life.,2025-04-21T22:30:43Z,https://gizmodo.com/universal-studios-fan-fest-nights-unleashes-an-incredible-massive-dungeons-dragons-puppet-2000592374
entertainment,I Know What You Did Last Summer‘s Returning Star on Being a Slasher Survivor,There's always another chance for Ray to die when the reboot hits theaters July 18.,2025-04-30T22:30:10Z,https://gizmodo.com/i-know-what-you-did-last-summers-returning-star-on-being-a-slasher-survivor-2000596679
entertainment,Murderbot‘s Main Character Is Both Killing Machine and Sci-Fi Nerd,Creators Chris and Paul Weitz had a lot of fun bringing SecUnit's particular pop culture tastes to their Apple TV+ show.,2025-05-02T17:15:51Z,https://gizmodo.com/murderbots-main-character-is-both-killing-machine-and-sci-fi-nerd-2000597243
entertainment,DC’s Clayface Movie Is Going Through a Surprising Re-Sculpt,"Plus, the Practical Magic sequel gets a release date.",2025-05-07T13:00:26Z,https://gizmodo.com/dc-clayface-movie-rewrite-mike-flanagan-2000598976
entertainment,Disney Just Announced a Brand New Theme Park: Disneyland Abu Dhabi,The company's seventh park is coming to United Arab Emirates and is a co-creation with Miral.,2025-05-07T16:45:11Z,https://gizmodo.com/new-disney-theme-park-abu-dhabi-2000599126
entertainment,HBO’s Harry Potter TV series has cast its regulars (not those ones),"After weeks of speculation, Warner Bros. Discovery has officially announced the first cast members who will appear in its upcoming Harry Potter TV adaptation. The casting confirmations, focused around some of the most notably adult characters from the Harry P…",2025-04-14T15:51:37Z,https://www.theverge.com/news/648099/harry-potter-tv-series-hbo-warner-bros-casting-announcement
entertainment,Here’s the cheaper Nintendo Switch 2 camera that’s small enough to go handheld,"After debuting a fun Piranha Plant-inspired alternative to Nintendo’s own $50 Switch 2 camera, Hori is back with another camera accessory for the console that’s less fun but more functional. Standing just shy of two inches tall and weighing 30 grams, the came…",2025-04-24T17:40:32Z,https://www.theverge.com/news/655709/hori-usb-nintendo-switch-2-camera-gamechat-handheld
entertainment,Bites on gladiator bones prove combat with lion,Experts say the discovery provides the first physical evidence of gladiatorial combat with animals.,2025-04-23T18:01:24Z,https://www.bbc.com/news/articles/cp8v2063r19o
entertainment,A bright spot in Hollywood is under threat from Trump's tariffs,Agencies and consultants that work with brands say film projects have been canceled or put on hold because of tariff-related uncertainty.,2025-04-28T15:06:45Z,https://www.businessinsider.com/trump-tariffs-threaten-branded-entertainment-bright-spot-for-hollywood-2025-4
entertainment,"Spectacular display of 500,000 tulips draws crowds",Visitors can tiptoe through more than 100 varieties of tulip which were planted five months ago.,2025-04-25T06:16:40Z,https://www.bbc.com/news/articles/c14x5n4j1geo
entertainment,'Class of 92' graduates aim for more Crucible glory,"Snooker's legendary 'Class of 92' - John Higgins, Mark Williams and Ronnie O'Sullivan - have won 14 world titles between them and are all in contention in 2025.",2025-04-28T21:51:28Z,https://www.bbc.com/sport/snooker/articles/cr78p790m2lo
entertainment,"The top 10 US airlines of 2025, ranked","WalletHub compared airlines across metrics such as flight cancellations, animal-related incidents, in-flight comfort, price, and safety.",2025-04-19T13:14:01Z,https://www.businessinsider.com/top-airlines-2025-ranked-wallethub-2025-4
entertainment,The Meta Trial Shows the Dangers of Selling Out,Several founders of hot startups took big payouts and let Mark Zuckerberg gobble up their companies—and came to regret it.,2025-04-25T14:00:00Z,https://www.wired.com/story/the-meta-trial-shows-the-dangers-of-selling-out/
entertainment,This Massive Screen for Live Sports Puts You in the Best Seat in the Stadium,"Cosm's cushy venues provide a fully immersive experience that helps sports fans feel like they're really at the game—with all the thrills, the shouting, and even the hot dogs.",2025-04-21T10:00:00Z,https://www.wired.com/story/cosm-live-sports-immersive-experiences/
entertainment,Hacking Spree Hits UK Retail Giants,"Plus: France blames Russia for a series of cyberattacks, the US is taking steps to crack down on a gray market allegedly used by scammers, and Microsoft pushes the password one step closer to death.",2025-05-03T10:30:00Z,https://www.wired.com/story/hacking-spree-hits-uk-retail-giants/
entertainment,Disney is building its first-ever Middle East theme park,Disney announced that it is building a new theme park and resort in Abu Dhabi ahead of its second-quarter earnings call on Wednesday.,2025-05-07T13:07:10Z,https://www.businessinsider.com/disney-building-seventh-theme-park-and-resort-in-abu-dhabi-2025-5
entertainment,Star Wars: Jedi Studio Doesn't Mention Layoffs In Announcement About Laying Developers Off,"Between Apex Legends, the Star Wars: Jedi series, and other projects, Respawn Entertainment has a lot on its plate, so it’s a little shocking to hear that EA is laying off even more members of the studio this year. It raises ongoing questions about what’s goi…",2025-04-29T18:05:00Z,https://kotaku.com/respawn-layoffs-star-wars-jedi-apex-legends-titanfall-1851778330
entertainment,Amazon’s newest Kindle Scribe has returned to its best price to date,"As a part of its ongoing Book Sale, Amazon isn’t just cutting prices on its budget-friendly Fire HD tablets — it’s also offering a great deal on the latest Kindle Scribe. Right now, you can buy it with 16GB of storage for an all-time low of $324.99 ($75 off).…",2025-04-16T16:41:46Z,https://www.theverge.com/tech/649820/amazon-kindle-scribe-2025-google-nest-indoor-cam-wired-deal-sale
entertainment,"Reading ""business"" books is a waste of time","""Business"" Books Are Cheap Entertainment, Not Strategic Tools",2025-05-09T20:51:45Z,https://theorthagonist.substack.com/p/why-reading-business-books-is-a-waste
entertainment,LG Is Clearing Out Its Best-Selling 75-inch Smart TV for Less Than Black Friday Pricing,"If you've been in the market for a new TV, it's time to go ahead and snatch one that's on sale now.",2025-04-28T13:25:52Z,https://gizmodo.com/lg-is-clearing-out-its-best-selling-75-inch-smart-tv-for-less-than-black-friday-pricing-2000594644
entertainment,Isabela Merced Is Ready to Prove Dina Haters Wrong in The Last of Us Season 2,Season two of the hit video game adaptation premieres April 13 on HBO.,2025-04-10T18:45:57Z,https://gizmodo.com/isabela-merced-is-ready-to-prove-dina-haters-wrong-in-the-last-of-us-season-2-2000587722
entertainment,"If You Own a PC or Mac, This 15″ Portable Monitor Is Just $69 and Doubles Your Screen Space",This is your chance to invest in a more efficient workflow wherever life takes you.,2025-04-26T13:25:01Z,https://gizmodo.com/if-you-own-a-pc-or-mac-this-15-portable-monitor-is-just-69-and-doubles-your-screen-space-2000594876
entertainment,Andor May Continue Its Weirdly Compelling Fascist Romance,"Karn and Meero will still be hunting for Cassian Andor, but it looks like they'll also be doing... something else?",2025-04-15T17:50:06Z,https://gizmodo.com/andor-may-continue-its-weirdly-compelling-fascist-romance-2000589565
entertainment,"Updates From Supergirl: Woman of Tomorrow, and More","Plus, a new Gremlins movie is 'imminent' at Amblin.",2025-04-14T13:00:52Z,https://gizmodo.com/supergirl-woman-of-tomorrow-movie-jason-momoa-lobo-2000588842
entertainment,The Last of Us Creators and Cast Break Down Making That Scene,Recreating that key moment from The Last of Us Part II for TV was an undertaking for its cast and its co-creators.,2025-04-21T15:07:04Z,https://gizmodo.com/the-last-of-us-creators-and-cast-break-down-making-that-scene-2000592059
entertainment,65 of the wildest looks in Met Gala history,"The Met Gala is the only place where Jared Leto can be a cat, and Rihanna can be the pope. Check out your favorite celebrities' wildest looks.",2025-05-01T07:51:01Z,https://www.businessinsider.com/wild-met-gala-outfits-looks
entertainment,A Minecraft Movie‘s Director Is More Than Okay With Its Rowdy Screening Pranks,Jared Hess thinks the frenzied audience reactions to his movie are 'hilarious.',2025-04-11T19:27:24Z,https://gizmodo.com/minecraft-movie-screenings-director-response-2000588365
entertainment,Amazon’s Latest Fire HD 10 Tablet Just Matched Its Prime Day Price,This perfectly portable tablet has everything you need to enjoy content no matter where you are.,2025-04-14T12:50:18Z,https://gizmodo.com/amazons-latest-fire-hd-10-tablet-just-matched-its-prime-day-price-2000564791
entertainment,Your Amazon Alexa Can Now Ride Shotgun With You as the Echo Auto Drops to an All-Time Low,"Amazon Alexa hub designed for the open road, now just $35.",2025-04-17T16:25:38Z,https://gizmodo.com/your-amazon-alexa-can-now-ride-shotgun-with-you-as-the-echo-auto-drops-to-an-all-time-low-2000590480
entertainment,"Yes, the Wheel of Time Game Is Real and (Hopefully) Happening","Iwot Studios hopes to turn Wheel of Time into a larger video game franchise, it's just a matter of building a team to make it happen.",2025-05-03T20:15:52Z,https://gizmodo.com/yes-the-wheel-of-time-game-is-real-and-hopefully-happening-2000597699
entertainment,Remedy will launch FBC: Firebreak on PC and consoles worldwide on June 17,"Remedy Entertainment announced FBC: Firebreak will launch worldwide on June 17 on the PC (Steam and Epic Games Store) and the consoles. During a special livestream today, Espoo, Finland-based Remedy said FBC: Firebreak, the upcoming three-player cooperative f…",2025-04-24T19:00:00Z,https://venturebeat.com/games/remedy-will-launch-fbc-firebreak-on-pc-and-consoles-worldwide-on-june-17/
entertainment,Here's how Disney imagines its new theme park in Abu Dhabi will look,The Walt Disney Company announced its seventh theme park on Wednesday. It will be built on Yas Island in Abu Dhabi.,2025-05-07T16:42:44Z,https://www.businessinsider.com/disney-abu-dhabi-theme-park-photos-2025-5
entertainment,YouTube is everything and everything is YouTube,"Looking back, the original idea behind YouTube seems almost quaint. The mythic founding story goes like this: in January of 2005, two PayPal employees, Chad Hurley and Steve Chen, were at a party. People were taking photos and videos on their digital cameras.…",2025-04-23T13:05:55Z,https://www.theverge.com/youtube/654240/youtube-future-creators-ai-music-content
entertainment,Google is heading to Hollywood to upgrade its star power,"Google is working with Range Media Partners to help produce films and TV shows, Business Insider has learned.",2025-05-05T15:56:04Z,https://www.businessinsider.com/google-tv-movie-hollywood-boost-tech-image-hundred-zeros-2025-5
entertainment,PS5 price jumps £40 as Sony cites 'challenging' market conditions,"The digital, disc-free edition of Sony's console has increased by roughly £70 since it first went on sale.",2025-04-14T09:32:47Z,https://www.bbc.com/news/articles/ce82391x2kyo
entertainment,'Now You See Me' is back after almost a decade. Here's what to know about the third film of the heist franchise.,"""Now You See Me, Now You Don't"" is the third in the series about crime-fighting magicians. Actors including Isla Fisher and Jesse Eisenberg are returning for the sequel.",2025-04-30T16:26:54Z,https://www.businessinsider.com/now-you-see-me-now-you-dont-cast-release-date-2025-4
entertainment,Overwatch 2 developers at Blizzard Entertainment form union under Microsoft,"The Overwatch 2 team at Blizzard Entertainment has formed a ""wall-to-wall"" union under Microsoft.",2025-05-09T19:52:07Z,https://www.windowscentral.com/gaming/xbox/overwatch-2-team-union-blizzard-entertainment-microsoft
entertainment,"Amazon Is Going All In, The Newest Echo Speaker Hits a Record Low in 2025 Despite Rising Tariffs",It could be the best Echo speaker with Alexa available today.,2025-04-19T13:10:36Z,https://gizmodo.com/amazon-is-going-all-in-the-newest-echo-speaker-hits-a-record-low-in-2025-despite-rising-tariffs-2000591187
entertainment,Google Is Getting Into the Movie Business to Produce Pro-Tech Propaganda,Big tech has an image problem. It's going to the people who make the images for help.,2025-05-05T20:05:25Z,https://gizmodo.com/google-is-getting-into-the-movie-business-to-produce-pro-tech-propaganda-2000598304
entertainment,Mon Mothma’s Senate Floor Speech Changes Star Wars Canon for the Better,This week's Andor builds up to the moment the Rebellion gets a visible leader.,2025-05-07T21:30:35Z,https://gizmodo.com/mon-mothmas-senate-floor-speech-changes-star-wars-canon-for-the-better-2000599424
entertainment,We Could Have Had an Avengers: Endgame-Style Conjuring Universe Send-Off,"It's a ridiculously amazing idea that, alas, won't actually be happening in The Conjuring: Last Rites.",2025-05-06T18:15:31Z,https://gizmodo.com/we-could-have-had-an-avengers-endgame-style-conjuring-universe-send-off-2000598658
entertainment,"Amazon Offers Toshiba Smart 32-inch Smart Fire TV for Practically Free, With Alexa Voice Remote Included","Save 31% on the 32"" Toshiba Fire TV for a limited time at Amazon.",2025-05-07T14:55:33Z,https://gizmodo.com/amazon-offers-toshiba-smart-32-inch-smart-fire-tv-for-practically-free-with-alexa-voice-remote-included-2000598789
entertainment,How Blizzard went about bringing its ‘Berserk x Diablo’ collaboration to life,"Last week, Blizzard Entertainment announced the full details behind its upcoming limited-time crossover event between Diablo 4 and Diablo Immortal and Berserk, the long-running dark fantasy manga created by the late Kentaro Miura. Beginning on May 1 for Diabl…",2025-05-01T13:15:12Z,https://www.polygon.com/gaming/567454/blizzard-diablo-4-immortal-berserk-crossover-interview-lead-artists
entertainment,These charts show why Netflix is unbothered in the face of economic angst,"""Netflix is a tremendous value in absolute terms and certainly in competitive terms,"" co-CEO Ted Sarandos said.",2025-04-18T18:47:06Z,https://www.businessinsider.com/netflix-charts-show-strength-despite-economic-anxiety-2025-4
entertainment,Will WWE's big Netflix gamble pay off at WrestleMania?,Wrestling's main event is to stream live on Netflix for the first time - here's why it matters.,2025-04-19T01:03:35Z,https://www.bbc.com/news/articles/c62gq8p2mj2o
entertainment,"Poker Face’s formula wasn’t broke, so Rian Johnson didn’t want to change it","Season 1 of Poker Face, Rian Johnson's eclectic crime dramedy starring Natasha Lyonne as a woman who can always tell when someone is lying, was one of Peacock's first truly fantastic series. Each Columbo-esque episode spun a uniquely wild tale of murder, myst…",2025-05-06T20:43:36Z,https://www.theverge.com/tv/660370/poker-face-season-2-rian-johnson
entertainment,It's Hard to Pick a 'Black Mirror' Season 7 Favorite. Just Don't Skip This Episode,Commentary: Netflix's anthology series has another beautiful love story on its hands with Hotel Reverie. Look closer and you'll find a covert Hollywood nightmare lurking right under the surface.,2025-04-15T14:00:04Z,https://www.cnet.com/tech/services-and-software/its-hard-to-pick-a-black-mirror-season-7-favorite-just-dont-skip-this-episode/
entertainment,How to watch Giro d'Italia: Live stream the 2025 race free from anywhere,The first of the 2025 Grand Tour races has arrived. We'll show you how to watch Giro d'Italia.,2025-05-09T08:00:01Z,https://www.businessinsider.com/guides/streaming/how-to-watch-giro-ditalia-cycling-2025
entertainment,I Bought Only Essentials for a Month. What I Learned Surprised Me,The no-buy challenge didn't just save me some cash. It changed my whole money mindset.,2025-04-30T19:40:00Z,https://www.cnet.com/personal-finance/banking/i-bought-only-essentials-for-a-month-what-learned-surprised-me/
entertainment,Trying the No-Buy Challenge for 30 Days Actually Made My Life Less Boring,"I did it to save money, but I gained a lot more in return.",2025-05-06T18:30:00Z,https://www.cnet.com/personal-finance/banking/trying-the-no-buy-challenge-for-30-days-actually-made-my-life-less-boring/
entertainment,"If You Only Watch One 'Black Mirror' Episode, It Should Be This Romantic Mindbender","Commentary: Netflix's sci-fi anthology has another beautiful love story on its hands. Look closer, and you'll find a covert Hollywood nightmare lurking right under the surface.",2025-04-11T10:00:11Z,https://www.cnet.com/tech/services-and-software/if-you-only-watch-one-black-mirror-episode-it-should-be-this-romantic-mindbender/
entertainment,Disney's Abu Dhabi Theme Park Might Be Its Most Technologically Advanced Resort Yet,Disney's seventh theme park destination could open by the early 2030s on Yas Island.,2025-05-07T14:54:37Z,https://www.cnet.com/culture/entertainment/disneys-abu-dhabi-theme-park-might-be-its-most-technologically-advanced-resort-yet/
entertainment,My family of 5 has made lifestyle adjustments to save money. We buy generic grocery brands and cut back on subscription services.,My family of 5 saves money on groceries by meal-planning and checking per-unit prices. We also cut down on subscription services and shop secondhand.,2025-04-25T10:07:01Z,https://www.businessinsider.com/family-saving-money-tips-generic-brands-cut-back-subscriptions-2025-4
entertainment,"FBC: Firebreak release date revealed — Remedy details co-op ""Control"" spin-off shooter filled with evil sticky note monsters","Remedy Entertainment just announced launch details for its ""Control"" spin-off, FBC: Firebreak, including details of a deluxe edition.",2025-04-24T19:00:30Z,https://www.windowscentral.com/gaming/fbc-firebreak-release-date-revealed
entertainment,Gayming Awards unveils 2025 nominees for LGBTQ+ celebration,"Nominations are out for the Gayming Awards 2025, with Dragon Age: The Veilguard leading the way with three nominations.",2025-04-15T16:00:00Z,https://venturebeat.com/games/gayming-awards-unveils-2025-nominees-for-lgbtq-celebration/
entertainment,"The 11 best things to stream this weekend, from 'Another Simple Favor' to season 2 of 'The Walking Dead: Dead City'","Here are the best TV shows and movies coming to streaming this weekend, from  ""Another Simple Favor"" to the return of ""The Walking Dead: Dead City.""",2025-05-02T20:32:40Z,https://www.businessinsider.com/best-shows-movies-streaming-netflix-prime-max-may-2-2025
entertainment,"James Cameron says the cost of blockbuster films needs to be cut in half, and AI is the answer","James Cameron appeared on Meta's ""Boz to the Future"" podcast, where he discussed how artificial intelligence could help the film industry survive.",2025-04-10T20:16:38Z,https://www.businessinsider.com/james-cameron-ai-blockbuster-films-costs-2025-4
entertainment,Here's how much more your next trip to Europe or Japan will cost thanks to the weak dollar,"The dollar has weakened sharply against the euro, pound, and yen this year. That's bad news for people planning summer vacations to Europe or Japan.",2025-04-16T13:29:00Z,https://www.businessinsider.com/summer-vacation-travel-london-paris-tokyo-dollar-euro-tariffs-trump-2025-4
entertainment,Topgolf's founders raised $34M to shake up a new sport. A 28-page deal memo reveals their plans.,"An investor deck shows how the founders of Topgolf are moving into a new corner of the sports world with their startup, Poolhouse.",2025-05-01T19:52:57Z,https://www.businessinsider.com/investor-deck-poolhouse-startup-from-topgolf-founders-raise-2025-5
entertainment,"Home theatre, bowling alley and more highlight Deion Sanders' former home listing","Sanders' former mansion, which includes a number of impressive amenities, sits on 5.95 acres of land in Texas.",2025-04-29T23:38:42Z,https://www.espn.com/nfl/story/_/id/44923385/deion-sanders-colorado-buffaloes-texas-home-listing
entertainment,"Disneyland and Disney World: What to Know About the 70th Anniversary, New Rides Coming","New entertainment, new lands, new rides and new experiences: Here's what we know about updates coming to Disneyland and Disney World.",2025-04-26T11:00:03Z,https://www.cnet.com/tech/services-and-software/disneyland-and-disney-world-what-to-know-about-the-70th-anniversary-new-rides-coming/
entertainment,EA announces turn-based tactics game Star Wars Zero Company ahead of a full unveiling,"EA announces Star Wars Zero Company, a turn-based tactics game from Respawn Entertainment and Bit Reactor, with a full reveal coming on April 19.",2025-04-14T16:41:09Z,https://www.windowscentral.com/gaming/star-wars-zero-company-ea-respawn-bit-reactor-april-19
entertainment,"The Outer Worlds 2: Xbox Game Pass, gameplay, and everything you need to know",Obsidian Entertainment returns to The Outer Worlds universe with The Outer Worlds 2 and we’ve got all details you need to know on this long-awaited RPG sequel.,2025-04-17T10:36:49Z,https://www.windowscentral.com/gaming/the-outer-worlds-2-everything-you-need-to-know
entertainment,"EA cancels incubation projects, lays off staff at Apex Legends and Star Wars Jedi developer Respawn Entertainment","EA cancels two incubation projects at Respawn Entertainment, reportedly laying off around 100 developers at the developer of Apex Legends and Star Wars Jedi.",2025-04-29T18:16:23Z,https://www.windowscentral.com/gaming/ea-respawn-layoffs-apex-legends-star-wars-jedi-incubation-team
entertainment,"Updates from Mission: Impossible – Final Reckoning, Supergirl: Woman of Tomorrow, and More","Plus, Paul Giamatti discusses his ""problematic"" character on Star Trek: Starfleet Academy.",2025-04-23T13:00:24Z,https://gizmodo.com/updates-from-mission-impossible-final-reckoning-supergirl-woman-of-tomorrow-and-more-2000593193
entertainment,Ryan Coogler on Sinners‘ Personal Post-Credits Scene,"Coogler brought a lot of his own history into Sinners, and its final minutes were key to making the film work.",2025-04-19T20:15:55Z,https://gizmodo.com/ryan-coogler-on-sinners-personal-post-credits-scene-2000591819
entertainment,Did Alan Cumming Accidentally Give Away an Avengers: Doomsday Fight?,"Plus, Natalie Portman wants a Padmé return... with very specific caveats.",2025-05-08T13:00:30Z,https://gizmodo.com/alan-cumming-avengers-doomsday-fight-scene-pedro-pascal-marvel-2000599513
health,"Amazon Just Slashed the Price of This Ultra-Quiet Air Purifier, Now at an All-Time Low","With rising temperatures and increasing pollution, an air purifier has become essential for maintaining good health.",2025-05-10T13:10:16Z,https://gizmodo.com/amazon-just-slashed-the-price-of-this-ultra-quiet-air-purifier-now-at-an-all-time-low-2000600494
health,Trump Signs Executive Order to Limit Funding for Controversial Gain-of-Function Research,Top health officials were there to tell Trump how smart he was.,2025-05-06T12:35:58Z,https://gizmodo.com/trump-signs-executive-order-to-limit-funding-for-controversial-gain-of-function-research-2000598356
health,New Toxic Avenger Trailer Takes Gory Aim at Health Care,Peter Dinklage's Toxie sure has some bloody and violent thoughts to share about the insurance industry in the August release.,2025-04-18T19:30:44Z,https://gizmodo.com/new-toxic-avenger-trailer-hits-at-health-care-in-latest-gory-trailer-2000591540
