Category,Title,Description,Published At,URL
sports,"Today's NYT Mini Crossword Answers for Sunday, April 27","Here's today's NYT Mini Crossword answer. These answers will help you solve New York Times' popular crossword game, Mini Crossword, every day!",2025-04-27T03:58:57Z,https://www.cnet.com/tech/gaming/todays-nyt-mini-crossword-answers-for-sunday-april-27/
sports,MoviePass Launches Box Office Betting Platform Unfortunately Tied to Crypto,"The platform, Mogul, is like fantasy sports for film buffs.",2025-05-01T21:40:23Z,https://gizmodo.com/moviepass-launches-box-office-betting-platform-unfortunately-tied-to-crypto-2000597085
sports,Ex-Tesla engineers launch luxury electric sports car startup: 'Making every effort to make cars available ... as quickly as possible',This would put them in direct competition with Tesla.,2025-04-13T10:45:52Z,https://autos.yahoo.com/ex-tesla-engineers-launch-luxury-104552165.html
sports,How to watch Giro d'Italia: Live stream the 2025 race free from anywhere,The first of the 2025 Grand Tour races has arrived. We'll show you how to watch Giro d'Italia.,2025-05-09T08:00:01Z,https://www.businessinsider.com/guides/streaming/how-to-watch-giro-ditalia-cycling-2025
sports,Draper beats Paul to reach Madrid Open last eight,An authoritative Jack Draper books his place in the quarter-finals of the Madrid Open with a convincing 6-2 6-2 win against Tommy Paul.,2025-04-30T15:54:42Z,https://www.bbc.com/sport/tennis/articles/c0l05x6458yo
sports,"EA Sports FC 25 Gets First Ever Paid Season Pass, EA Insists It's 'Purely Additive'",EA Sports FC 25's new $10 Premium Pass sparks debate among Ultimate Team players.,2025-04-24T08:57:02Z,https://www.ign.com/articles/ea-sports-fc-25-gets-first-ever-paid-season-pass-ea-insists-its-purely-additive
sports,Bueckers: Investing in Unrivaled at 'a great time',"Paige Bueckers, who was picked by No. 1 overall by the Wings in the WNBA draft, said her investment in Unrivaled comes at ""a great time to be in women's sports.""",2025-04-16T16:36:49Z,https://www.espn.com/wnba/story/_/id/44699852/wings-paige-bueckers-invests-unrivaled-great
sports,Apple Sports scores another win with new Game Card Sharing feature,"Apple Sports has rightfully earned a reputation for being an app that continues to deliver. The latest win is a new social feature coming to Apple Sports called Game Card Sharing.



 more…",2025-04-18T14:57:51Z,https://9to5mac.com/2025/04/18/apple-sports-scores-another-win-with-new-game-card-sharing-feature/
sports,Trump DOJ sues Maine in standoff over transgender athletes in women's sports,It alleges Maine’s policy allowing transgender athletes violates Title IX.,2025-04-16T12:54:29Z,https://abcnews.go.com/Politics/trump-doj-files-civil-suit-maine-standoff-transgender/story?id=120858499
sports,"Republicans seek more state laws on transgender people, putting Democrats on the spot","Since North Carolina passed a ""bathroom"" law in 2016, the number of bills has grown and Republicans have used the issue in campaigns. Democrats are still working out how to respond.",2025-05-10T10:00:00Z,https://www.npr.org/2025/05/10/nx-s1-5377402/republicans-democrats-transgender-sports-legislatures
sports,Forget the Razr 2025: you can score up to 75% OFF the Motorola Razr Plus (2023) at Best Buy right now,Best Buy is offering a massive deal on the 2023 foldable.,2025-05-08T16:57:44Z,https://www.androidcentral.com/phones/motorola/forget-the-razr-2025-you-can-score-up-to-75-percent-off-the-motorola-razr-plus-2023-at-best-buy-right-now
sports,10 New Movies on Netflix We Can't Wait to Watch This May,"This month, watch out for Vince Vaughn and Linda Cardellini in Nonnas, plus Fear Street: Prom Queen and more.",2025-05-01T13:00:03Z,https://www.cnet.com/tech/services-and-software/10-new-movies-on-netflix-we-cant-wait-to-watch-this-may/
sports,Gun Owners Group Calls for Inquiry Into Firearms Industry’s Secret Sharing of Customer Data,Gun Owners for Safety called the secret program that spanned nearly two decades “underhanded.”,2025-04-30T20:55:19Z,https://gizmodo.com/gun-owners-group-calls-for-inquiry-into-firearms-industrys-secret-sharing-of-customer-data-2000596678
sports,"Today's NYT Mini Crossword Answers for Friday, April 25","Here's today's NYT Mini Crossword answer. These answers will help you solve New York Times' popular crossword game, Mini Crossword, every day!",2025-04-25T03:15:21Z,https://www.cnet.com/tech/gaming/todays-nyt-mini-crossword-answers-for-friday-april-25/
sports,"Today's NYT Mini Crossword Answers for Thursday, April 24","Here's today's NYT Mini Crossword answer. These answers will help you solve New York Times' popular crossword game, Mini Crossword, every day!",2025-04-24T02:07:00Z,https://www.cnet.com/tech/gaming/todays-nyt-mini-crossword-answers-for-thursday-april-24/
sports,"Today's NYT Mini Crossword Answers for Thursday, May 1","Here's today's NYT Mini Crossword answer. These answers will help you solve New York Times' popular crossword game, Mini Crossword, every day!",2025-05-01T02:17:59Z,https://www.cnet.com/tech/gaming/todays-nyt-mini-crossword-answers-for-thursday-may-1/
sports,How to Watch the Masters 2025 Live Outside the US,Here's how to watch the Masters online outside the USA and enjoy the one of the biggest golf tournaments anywhere in the world.,2025-04-13T13:08:30Z,https://gizmodo.com/how-to-watch-the-masters-2025-live-outside-the-us-2000588747
sports,"Third Price Drop in a Week, The Garmin Vivoactive 5 Is Back to Its Black Friday Record Low Price","If you're looking for long battery life, detailed health information and robust activity tracking features, the Vivoactive 5 will be your best friend.",2025-04-13T00:33:15Z,https://gizmodo.com/third-price-drop-in-a-week-the-garmin-vivoactive-5-is-back-to-its-black-friday-record-low-price-2000588674
sports,"JBL’s 9.1-Channel Soundbar Just Crashed in Price, 52% Off and It’s Not Even Black Friday",Treat your home theater to cinema-quality sound without wiring your walls and save over $600 at Amazon.,2025-04-22T12:05:46Z,https://gizmodo.com/jbls-9-1-channel-soundbar-just-crashed-in-price-52-off-and-its-not-even-black-friday-2000592488
sports,"Today's NYT Connections: Sports Edition Hints and Answers for April 15, #204","Here's today's Connections: Sports Edition answer and hints for groups. These clues will help you solve The New York Times' popular puzzle game, Connections: Sports Edition, every day.",2025-04-14T20:00:13Z,https://www.cnet.com/tech/gaming/todays-nyt-connections-sports-edition-hints-and-answers-for-april-15-204/
sports,"Today's NYT Connections: Sports Edition Hints and Answers for May 3, #222","Here's today's Connections: Sports Edition answer and hints for groups. These clues will help you solve The New York Times' popular puzzle game, Connections: Sports Edition, every day.",2025-05-02T23:43:39Z,https://www.cnet.com/tech/gaming/todays-nyt-connections-sports-edition-hints-and-answers-for-may-3-222/
sports,Garmin Slashes Price on Its Top-Selling Smartwatch Vívoactive 5 to Celebrate Tariff Exemption,You may be the greatest athlete ever but you're still not going to outlast the Garmin vívoactive 5 Smartwatch.,2025-04-15T15:45:13Z,https://gizmodo.com/garmin-slashes-price-on-its-top-selling-smartwatch-vivoactive-5-to-celebrate-tariff-exemption-2000589308
sports,"Samsung TV Plus adds live sports channels from Roku, NASCAR, and more",Samsung TV Plus now offers five new live sports channels for free,2025-05-01T19:38:57Z,https://www.androidpolice.com/samsung-tv-plus-new-sports-channels/
sports,"Today's NYT Connections: Sports Edition Hints and Answers for April 23, #212","Here's today's Connections: Sports Edition answer and hints for groups. These clues will help you solve The New York Times' popular puzzle game, Connections: Sports Edition, every day.",2025-04-22T23:33:48Z,https://www.cnet.com/tech/gaming/todays-nyt-connections-sports-edition-hints-and-answers-for-april-23-212/
sports,"Today's NYT Connections: Sports Edition Hints and Answers for April 18, #207","Here's today's Connections: Sports Edition answer and hints for groups. These clues will help you solve The New York Times' popular puzzle game, Connections: Sports Edition, every day.",2025-04-17T23:27:16Z,https://www.cnet.com/tech/gaming/todays-nyt-connections-sports-edition-hints-and-answers-for-april-18-207/
sports,"Today's NYT Connections: Sports Edition Hints and Answers for April 17, #206","Here's today's Connections: Sports Edition answer and hints for groups. These clues will help you solve The New York Times' popular puzzle game, Connections: Sports Edition, every day.",2025-04-16T20:00:08Z,https://www.cnet.com/tech/gaming/todays-nyt-connections-sports-edition-hints-and-answers-for-april-17-206/
sports,"Today's NYT Connections: Sports Edition Hints and Answers for May 6, #225","Here's today's Connections: Sports Edition answer and hints for groups. These clues will help you solve The New York Times' popular puzzle game, Connections: Sports Edition, every day.",2025-05-05T23:12:00Z,https://www.cnet.com/tech/gaming/todays-nyt-connections-sports-edition-hints-and-answers-for-may-6-225/
sports,"Today's NYT Connections: Sports Edition Hints and Answers for May 4, #223","Here's today's Connections: Sports Edition answer and hints for groups. These clues will help you solve The New York Times' popular puzzle game, Connections: Sports Edition, every day.",2025-05-04T02:46:23Z,https://www.cnet.com/tech/gaming/todays-nyt-connections-sports-edition-hints-and-answers-for-may-4-223/
sports,Toyota’s Chairman Shared This Controversial Opinion About EV Sports Cars,"Akio Toyoda, the grandson of the founder of Toyota, is known to participate in motorsports events himself.",2025-04-28T19:17:42Z,https://www.autoblog.com/news/toyotas-chairman-shared-this-controversial-opinion-about-ev-sports-cars
sports,7 Sports Cars That Last the Longest Over 5 Years,,2025-05-03T14:01:32Z,https://consent.yahoo.com/v2/collectConsent?sessionId=1_cc-session_ed710b97-3d1d-4ea1-bc2d-01ca3f23bad4
sports,Gambling on the next pope is an older tradition than you might think,"Shortly after it was announced that Pope Francis had died, online gambling websites posted the betting favorites to replace him.",2025-05-04T15:00:00Z,https://www.8newsnow.com/news/gambling-on-the-next-pope-is-an-older-tradition-than-you-might-think/
sports,Federal judge orders USDA to unfreeze funds to Maine,The funds had been initially withheld following President Trump's clash with Maine Gov. Janet Mills over the issue of transgender athletes.,2025-04-12T15:14:18Z,https://www.npr.org/2025/04/12/nx-s1-5362976/maine-usda-unfreeze-janet-mills-trump
sports,Apple brings game card sharing to Apple Sports,"The steady additions to the Apple Sports app are continuing, with a new option for users to share dynamic game cards.Apple Sports users can now share game cards with friendsFollowing its launch in February 2024, Apple Sports was initially considered too basic…",2025-04-18T15:07:37Z,https://appleinsider.com/articles/25/04/18/apple-brings-game-card-sharing-to-apple-sports
sports,The next Golden Bachelor is a 66-year-old former NFL player. Here's everything we know about 'The Golden Bachelor' season 2.,"Season two of ""The Golden Bachelor"" will star Mel Owens, a former linebacker for the Los Angeles Rams. Here's what to know about him and his season.",2025-04-23T21:23:13Z,https://www.businessinsider.com/golden-bachelor-season-2-mel-owens-cast-premiere-date-2025-4
sports,The 2025 Vergecast streaming draft,"(Before we get started, a reminder: The Vergecast is nominated for a Webby Award! Voting is only open for a few more days, and the award is decided by your votes. Weâre up against some steep competition, but we really want to win â and weâd love your he…",2025-04-15T12:54:24Z,https://www.theverge.com/the-vergecast/648771/best-streaming-services-2025-vergecast
sports,"Shokz OpenRun Pro 2 Just Hit Their Lowest Price, and It’s Amazon’s Top-Rated Sports Headphones","These aren't your typical headphones, but that's what makes them such a great pick.",2025-05-06T16:15:57Z,https://gizmodo.com/shokz-openrun-pro-2-just-hit-their-lowest-price-and-its-amazons-top-rated-sports-headphones-2000598175
sports,"PSG's Doue, the teenager who is the talk of Europe","PSG teenager Desire Doue has gone from a false start to the talk of European football, says BBC Sport's chief football writer Phil McNulty.",2025-04-14T22:28:06Z,https://www.bbc.com/sport/football/articles/c62xw76dyejo
sports,Bluesky Gains Twitter-Like Message Reactions and New Search Page,"Bluesky is rolling out a new update introducing features that might ease the transition for social media users coming over from X (Twitter). 





First up, version 1.100 adds emoji reactions to Bluesky's direct messaging system. Users can now respond to mess…",2025-04-11T09:42:45Z,https://www.macrumors.com/2025/04/11/bluesky-message-reactions-new-search-page/
sports,"Today's Wordle Hints, Answer and Help for April 14, #1395","Here's today's Wordle answer, plus a look at spoiler-free hints and past solutions. These clues will help you solve The New York Times' popular puzzle game, Wordle, every day.",2025-04-13T20:00:04Z,https://www.cnet.com/tech/gaming/todays-wordle-hints-answer-and-help-for-april-14-1395/
sports,"Today's Wordle Hints, Answer and Help for April 18, #1399","Here's today's Wordle answer, plus a look at spoiler-free hints and past solutions. These clues will help you solve The New York Times' popular puzzle game, Wordle, every day.",2025-04-17T20:00:05Z,https://www.cnet.com/tech/gaming/todays-wordle-hints-answer-and-help-for-april-18-1399/
sports,"Today's Wordle Hints, Answer and Help for April 20, #1401","Here's today's Wordle answer, plus a look at spoiler-free hints and past solutions. These clues will help you solve The New York Times' popular puzzle game, Wordle, every day.",2025-04-19T20:00:05Z,https://www.cnet.com/tech/gaming/todays-wordle-hints-answer-and-help-for-april-20-1401/
sports,"Today's Wordle Hints, Answer and Help for May 2, #1413","Here's today's Wordle answer, plus a look at spoiler-free hints and past solutions. These clues will help you solve The New York Times' popular puzzle game, Wordle, every day.",2025-05-01T20:00:02Z,https://www.cnet.com/tech/gaming/todays-wordle-hints-answer-and-help-for-may-2-1413/
sports,"Wisconsin man charged with attempted murder of Rockford Police officer, shooting K9","A Madison, Wisconsin, man is charged with attempted murder of a Rockford Police officer and shooting a K9 near a Circle K Gas Station on Saturday, according ...",2025-04-19T21:02:24Z,https://www.mystateline.com/news/rockford-police-k9-shot/
sports,"Third of Brits say personal finances are ""out of control""","More than half of Brits feel some aspects of their own life are ‘out of control’ – from family life to work and finances. A poll of 2,000 adults found they...",2025-04-29T07:34:28Z,https://uk.news.yahoo.com/third-brits-personal-finances-control-073428302.html
sports,YouTube is bringing custom multi views and a redesign to its TV app,"YouTube turned 20 recently, and it is bringing new features and some tweaks to its design on its TV app.",2025-04-24T22:43:07Z,https://www.androidcentral.com/apps-software/youtube/youtube-is-bringing-custom-multi-views-and-a-redesign-to-its-tv-app
technology,Grid-Scale Battery Storage Is Quietly Revolutionizing the Energy System,This energy storage technology is harnessing the potential of solar and wind power—and its deployment is growing exponentially.,2025-04-26T11:00:00Z,https://www.wired.com/story/grid-scale-battery-storage-is-quietly-revolutionizing-the-energy-system/
technology,The Verge is nominated for two Webby Awards — help us win them!,"The time of year has arrived â Webby Award season. For the 29th annual Webby Awards, The Verge is nominated in two categories: best technology podcast and best technology video. The award show is basically a competition for âBest of the Internet,â and e…",2025-04-11T15:00:43Z,https://www.theverge.com/video/646816/webby-nominations-2025-vergecast-video
technology,Silence Speaks Has Created AI-Powered Signing Avatars for the Deaf,New technology from British startup Silence Speaks enables an AI-generated sign language avatar to effectively give the deaf and hard of hearing an interpreter in their pocket.,2025-05-07T13:39:49Z,https://www.wired.com/story/silence-speaks-deaf-ai-signing/
technology,US Border Agents Are Asking for Help Taking Photos of Everyone Entering the Country by Car,Customs and Border Protection has called for tech companies to pitch real-time face recognition technology that can capture everyone in a vehicle—not just those in the front seats.,2025-05-06T09:00:00Z,https://www.wired.com/story/cbp-photo-everyone-in-vehicle-us-border/
technology,Firefly’s Alpha Rocket Crashes Into Pacific Ocean After Failing to Reach Orbit,The failure resulted in the loss of a Lockheed Martin technology demonstration satellite.,2025-04-30T17:05:36Z,https://gizmodo.com/fireflys-alpha-rocket-crashes-into-pacific-ocean-after-failing-to-reach-orbit-2000596376
technology,PM Modi and Elon Musk talk India-US tech collaboration,Modi said he discussed with Musk India's potential to collaborate with the US on technology.,2025-04-18T12:12:50Z,https://www.bbc.com/news/articles/c8073ggz1eeo
technology,Fun With Technology,"The power of makers and making is in battling boredom, in doing something fun with others who are doing something.
The post Fun With Technology appeared first on Make: DIY Projects and Ideas for Makers.",2025-04-11T16:00:00Z,https://makezine.com/article/maker-news/maker-faire/fun-with-technology/
technology,These wireless headphones have ‘80s Sony Walkman vibes,"Headphones had existed for well over 50 years by the time Sony’s Walkman debuted in 1979, but the portable cassette player helped popularize the technology by miniaturizing it. km5’s new Lightwear Headphones Hp1 feature a minimal design similar to the one shi…",2025-04-28T16:46:04Z,https://www.theverge.com/news/657273/km5-lightwear-wireless-headphones-hp1-sony-walkman
technology,"The Kindle Colorsoft, Amazon’s first color e-reader, is $55 off","Built with E Ink’s color display technology, the Kindle Colorsoft Signature Edition brings comics, magazines, children’s books, and illustrated novels to life in a way a regular Kindle can’t. And right now, you can buy the company’s first color e-reader at Am…",2025-04-23T13:50:38Z,https://www.theverge.com/tech/653291/kindle-colorsoft-signature-edition-amazon-book-sale-2025-deal
technology,Google loses adtech monopoly case,"The US Department of Justice has won its antitrust case against Google, which accused the company of operating a monopoly in the advertising technology industry. In a ruling on Thursday, US District Judge Leonie Brinkema says Google’s anticompetitive practice…",2025-04-17T15:03:39Z,https://www.theverge.com/news/650665/google-loses-ad-tech-antitrust-monopoly-lawsuit
technology,"Waymo says it will add 2,000 more robotaxis in 2026","Waymo said it recently received its last delivery of Jaguar I-Pace SUVs, which will be retrofitted with sensors and autonomous driving technology at its factory in Arizona, before joining its robotaxi fleet. In a blog post published today, the Alphabet compan…",2025-05-05T15:10:23Z,https://www.theverge.com/news/661025/waymo-fleet-size-factory-arizona-jaguar-robotaxi-zeekr
technology,Beyond LCD: Exploring TCL's Unique NXTPAPER Technology,TCL continues to develop its NXTPAPER screen technology to combat both blue light exposure and present a paper-like finish.,2025-04-30T10:00:00Z,https://www.androidcentral.com/tablets/exploring-tcl-nxtpaper-display-tech
technology,The Tech That Safeguards the Conclave’s Secrecy,"Following the death of Pope Francis, the Vatican is preparing to organize a new conclave in less than 20 days. This is how they’ll tamp down on leaks.",2025-04-23T06:00:00Z,https://www.wired.com/story/technology-used-to-shield-conclave-pope-francis/
technology,Apple Releases Safari Technology Preview 218 With Bug Fixes and Performance Improvements,"Apple today released a new update for Safari Technology Preview, the experimental browser that was first introduced in March 2016. Apple designed ‌Safari Technology Preview‌ to allow users to test features that are planned for future release versions of the S…",2025-04-30T22:14:14Z,https://www.macrumors.com/2025/04/30/apple-releases-safari-technology-preview-218/
technology,Meet the 'Technology Brothers' behind tech's hot new daily show,"John Coogan and Jordi Hays launched ""TBPN,"" a daily tech show featuring startup founders and VCs that's gaining ground on other tech podcasts.",2025-04-11T09:01:01Z,https://www.businessinsider.com/meet-daily-tech-show-tbpn-startup-founders-vc-2025-4
technology,World Password Day: Why Haven't We Ditched This Crackable Tech?,"There's new and better technology out there, but passwords just won't go away.",2025-05-01T11:30:03Z,https://www.cnet.com/tech/services-and-software/world-password-day-why-havent-we-ditched-this-crackable-tech/
technology,"Despite The Tariff Hike, Amazon Continues to Offer The Dyson V11 at Its Lowest Price of 2025","This Dyson V11 vacuum has already sold over 5,000 units on Amazon in just a few days",2025-04-12T13:45:25Z,https://gizmodo.com/despite-the-tariff-hike-amazon-continues-to-offer-the-dyson-v11-at-its-lowest-price-of-2025-2000588615
technology,Tesla won’t have to report as many Level 2 crashes after Trump’s rule change,"Last week, the US Department of Transportation announced a major change to the Biden-era rule that requires automakers and tech companies to report crashes that involve fully or partially autonomous vehicles. Under the revised rules, companies will no longer …",2025-04-29T18:33:52Z,https://www.theverge.com/news/657859/tesla-adas-crash-report-nhtsa-sgo-trump-musk
technology,Aurora’s driverless trucks are making deliveries in Texas,"After years of testing and validation, Aurora says its first fully autonomous tractor-trailers are operating on public highways in Texas. The company’s Class 8 trucks are now making customer deliveries between Dallas and Houston, having already completed 1,20…",2025-05-01T20:19:51Z,https://www.theverge.com/news/659518/aurora-autonomous-truck-first-delivery-texas
technology,Apple's Folding iPhone Rumored to Have Face ID Embedded in Screen,The latest leak suggests Apple has put its novel facial recognition technology into the long-rumored folding iPhone.,2025-04-14T21:04:00Z,https://www.cnet.com/tech/mobile/apples-folding-iphone-rumored-to-have-face-id-embedded-in-screen/
technology,LG’s Integrated TV Ad Tech Analyzes Your Emotions,LG has licensed tech that claims to interpret TV users’ feelings and convictions. The company will use this data to more directly target the ads it’s showing to users of its smart TV platform.,2025-04-18T10:30:00Z,https://www.wired.com/story/lg-zenapse-integrated-tv-ads-emotional-analysis/
technology,Meet the new legal startup that Alex Spiro and Goodwin's top deals partner are betting on,Marveri says that it's building technology that's creating faster and more accurate corporate diligence.,2025-05-05T09:01:01Z,https://www.businessinsider.com/legal-ai-startup-marveri-secures-vc-funding-fix-due-diligence-2025-5
technology,Pinterest is prompting teens to close the app at school,"Pinterest is testing a new pop-up prompt it will display to minors in the US and Canada during school hours, encouraging them to close the app and turn off notifications until the end of the day. “Focus is a beautiful thing,” the prompt says. “Stay in the mom…",2025-04-22T09:36:33Z,https://www.theverge.com/news/653094/pinterest-school-hours-prompt-minors-focus
technology,The EU isn’t happy with Apple’s tax on alternative app stores,"The European Commission has just issued its first Digital Markets Act (DMA) fines to Apple and Meta, and now it’s telling Apple that it’s not impressed with the company’s approach to alternative app stores. The DMA originally forced Apple to begrudgingly allo…",2025-04-23T11:30:48Z,https://www.theverge.com/news/636196/apple-eu-dma-probe-alternative-app-stores-tax
technology,TECH5: DACH’s 5 top scaleups enter ‘Champions League of Technology’,"Five fast-rising scaleups from the DACH region have qualified for TECH5 — the “Champions League of Technology.” The DACH entrants fought off off stiff competition to reach the finals, which will crown the hottest scaleup in Europe. Comprising Germany, Austria…",2025-04-14T07:12:12Z,https://thenextweb.com/news/dach-5-scaleups-germany-switzerland-austria-enter-tech5
technology,"OnePlus 13T will be the ""first and only"" to sport a massive battery, company confirms","The OnePlus 13T is now confirmed to have a massive 6260mAh battery despite its compact size, thanks to OnePlus' new Glacier battery technology.",2025-04-21T18:42:48Z,https://www.androidcentral.com/phones/oneplus/oneplus-13t-to-sport-a-gigantic-battery-in-its-smaller-form-factor
technology,Trump mulls semiconductor levies after lifting reciprocal tariffs on electronics,"Trump targets Chinese technology with 20% fentanyl tariff and eyes semiconductors in a ""National Security Tariff Investigation"" over coming months.",2025-04-13T22:23:46Z,https://www.npr.org/2025/04/13/g-s1-60086/semiconduct-tariffs-trump
technology,There Are 6 Internet Connection Types to Get Online. Here’s What You Need to Know,"Learn about how different types of internet connections work, from Fiber and DSL to Satellite and Cable. Review technology, speeds, providers and more on CNET.",2025-04-23T21:31:00Z,https://www.cnet.com/home/internet/what-are-the-different-internet-connection-types/
