Category,Title,Description,Published At,URL
business,HP EliteBook Ultra G1i Review: A Laptop That’s All Business,HP’s no-nonsense EliteBook Ultra G1i is a buttoned-up laptop that’s priced accordingly.,2025-04-28T12:00:00Z,https://www.wired.com/review/hp-elitebook-ultra-g1i-2025/
business,Perplexity wants to buy Chrome if Google has to sell it,"Perplexity Chief Business Officer Dmitry Shevelenko said he didn't want to testify in a trial about how to resolve Google's search monopoly because he feared retribution from Google. But after being subpoenaed to appear in court, he seized the moment to pitch…",2025-04-23T21:38:56Z,https://www.theverge.com/policy/654835/perplexity-google-antitrust-trial-remedies-chrome
business,"Google Is Once Again Deemed a Monopoly, This Time in Ad Tech",The future of Google's advertising business is at stake after a federal judge found the company illegally monopolized parts of it.,2025-04-17T18:07:22Z,https://www.wired.com/story/judge-rules-google-ad-business-monopoly/
business,"David Zaslav Wants a Friendlier Relationship With Trump, Was Told to Be More Like Jeff Bezos",The sycophant business is booming.,2025-04-14T20:50:41Z,https://gizmodo.com/david-zaslav-wants-a-friendlier-relationship-with-trump-was-told-to-be-more-like-jeff-bezos-2000589230
business,Trump Hangers-On Open New Club for Other Rich Suck-Ups,The Executive Branch is open for business.,2025-04-27T20:30:15Z,https://gizmodo.com/trump-hangers-on-open-new-club-for-other-rich-suck-ups-2000595075
business,Neutrinos Have No Business Being This Freaking Small,A new measurement finds the universe's teensiest particles weigh no more than one-millionth the mass of an electron.,2025-04-13T12:00:44Z,https://gizmodo.com/neutrinos-have-no-business-being-this-freaking-small-2000588138
business,'My £20k bill for holiday lets deemed second homes',"Judith Robbins, 75, fears she will go out of business after the reclassification of the lettings.",2025-05-09T05:22:46Z,https://www.bbc.com/news/articles/c4gegkxxlg3o
business,Verizon’s consumer chief: Net neutrality ‘went literally nowhere’,"Today, I’m talking with Verizon consumer CEO Sowmyanarayan Sampath, who goes by “Sampath.” As CEO of Verizon’s consumer division, Sampath oversees the biggest part of the business: Verizon Wireless, which has more than 115 million wireless connections, and Fi…",2025-04-21T15:05:15Z,https://www.theverge.com/decoder-podcast-with-nilay-patel/652470/verizon-consumer-sowmyanarayan-sampath-net-neutrality-5g-china
business,"Firefox could be doomed without Google search deal, says executive","Firefox could be put out of business should a court implement all the Justice Department’s proposals to restrict Google’s search monopoly, an executive for the browser owner Mozilla testified Friday. “It’s very frightening,” Mozilla CFO Eric Muhlheim said. Th…",2025-05-02T20:01:56Z,https://www.theverge.com/news/660548/firefox-google-search-revenue-share-doj-antitrust-remedies
business,You have two months left to update your old LG phone,"Time is running out for people who are still using LG phones to download any remaining Android updates before their devices are fully retired. After closing its Android phone business back in 2021, Android Authority has spotted that LG is now preparing to shu…",2025-04-29T12:18:31Z,https://www.theverge.com/news/657725/lg-phone-android-update-servers-shutdown
business,Meta and Spotify are teaming up to lobby against Apple and Google,"Meta has joined forces with Spotify, Garmin, Match, and others to form a lobby group to represent their interests, especially as they come into conflict with those of Apple and Google. The group’s first order of business is arguing that age verification shoul…",2025-05-01T13:31:01Z,https://www.theverge.com/news/659443/meta-spotify-match-garmin-lobby-group-apple-google-age-verification
business,Amazon now sells prescription pet pills,"Amazon is expanding its prescription medication business to include your pooches and pussycats. Through its Vetsource partnership announced on Thursday, Amazon says that “hundreds of prescription pet medications” will now be available for US customers to purc…",2025-05-09T11:19:21Z,https://www.theverge.com/news/664069/amazon-online-pharmacy-pet-prescription-drugs
business,The Washington Post will now let ChatGPT summarize its articles,"The Washington Post and OpenAI have announced a “strategic partnership” that will “make high-quality news more accessible in ChatGPT,” according to a Washington Post press release. OpenAI has already made partnerships with over 20 other news publishers, inclu…",2025-04-22T15:45:55Z,https://www.theverge.com/news/653500/the-washington-post-openai-chatgpt-partnership
business,OpenAI hires former head of the Facebook app,"OpenAI has hired Fidji Simo, the CEO of Instacart and former Facebook app chief, as the head of the company’s apps business. In a post on X, OpenAI CEO Sam Altman says introducing the new role will allow him to “focus on research, compute, and safety.” After …",2025-05-08T15:45:20Z,https://www.theverge.com/news/663454/openai-fidji-simo-apps-ceo-facebook-instacart
business,Apple doesn’t seem too worried about Trump’s tariffs,Apple reported its latest quarterly earnings on Wednesday under the backdrop of a court ruling that’s poised to upend the company’s App Store business and tariff uncertainty that could spur price increases for devices including the iPhone. At least on this oc…,2025-05-01T21:00:22Z,https://www.theverge.com/news/659650/apple-q2-2025-earnings-tariffs-app-store
business,Apple says tariffs will cost it at least $900 million this quarter,"During Wednesday’s earnings call, Apple CEO Tim Cook went into the most detail yet on how the company is responding to the far-reaching US tariffs imposed by President Trump — and the potential impacts on its business. “Assuming the current global tariff rate…",2025-05-01T22:01:07Z,https://www.theverge.com/news/659866/apple-trump-tariffs-cost-tim-cook
business,Buffalo put a window on its new hard drive so you can see it at work,"To help celebrate the 50 years its parent company has been in business, Japan’s Buffalo has announced a limited edition external hard drive with a window that lets you see its inner workings. Don’t whip out your credit card just yet, though; the Buffalo Skele…",2025-05-05T18:46:38Z,https://www.theverge.com/news/661244/buffalo-skeleton-hard-disk-drive-hd-skl-transparent-window-lottery
business,Google Is Getting Into the Movie Business to Produce Pro-Tech Propaganda,Big tech has an image problem. It's going to the people who make the images for help.,2025-05-05T20:05:25Z,https://gizmodo.com/google-is-getting-into-the-movie-business-to-produce-pro-tech-propaganda-2000598304
business,The Conjuring: Last Rites Trailer Scares the Warrens Out of Business,"Vera Farmiga and Patrick Wilson return for the fourth and final film in the hit horror franchise, out September 5.",2025-05-08T17:15:17Z,https://gizmodo.com/the-conjuring-last-rites-trailer-scares-the-warrens-out-of-business-2000599733
business,Business Insider YouTube channel wins two 2025 Webby Awards,Business Insider's YouTube channel won a Webby Winner and People's Voice Winner in the category of Business Video & Film at the 2025 Webby Awards.,2025-04-22T19:33:27Z,https://www.businessinsider.com/business-insider-youtube-channel-wins-two-2025-webby-awards-2025-4
business,"This Dell Desktop Just Launched, and It’s Already 72% Off Before Tariffs Hit",Bring home a PC that can do it all and boost your productivity without spending an entire paycheck.,2025-04-16T14:25:03Z,https://gizmodo.com/this-dell-desktop-just-launched-and-its-already-72-off-before-tariffs-hit-2000589847
business,Google Cloud executive and former ads boss Jerry Dischler says he will depart the company,"Jerry Dischler, who previously steered Google's ads business, said he plans to depart the company.",2025-04-28T20:59:19Z,https://www.businessinsider.com/google-jerry-dischler-exec-former-ads-boss-steps-down-2025-4
business,DOJ asks court to split up Google’s ad tech empire,"The US Department of Justice filed a plan in court to make Google divest its advertising marketplace and ad management platform, part of a proposal to address the company’s “decade-long campaign of exclusionary conduct,” which a judge has declared violates an…",2025-05-06T14:44:03Z,https://www.theverge.com/news/661833/google-ad-tech-business-doj-break-up
business,Don't get used to seeing AI lawyers in the courtroom,"Anyone using an AI-generated avatar in the courtroom will surely face pushback from judges, legal experts told Business Insider.",2025-04-11T17:35:28Z,https://www.businessinsider.com/artifical-intelligence-generated-avatar-courtroom-ai-lawyers-2025-4
business,A Gen Xer left California to start a business in a retiree hot spot in Mexico. His only regret is that he didn't do it sooner.,Malahki Thorn left California to escape wildfire risks and start a new business in Puerto Vallarta's booming real estate market.,2025-04-18T07:03:02Z,https://www.businessinsider.com/gen-xer-moved-california-puerto-vallarta-started-business-real-estate-2025-4
business,I tracked where every item was from during my Costco trip and saw just how much the US relies on global trade,A Business Insider reporter saw firsthand how much the US relies on global trade during a recent Costco shopping trip.,2025-04-29T09:10:01Z,https://www.businessinsider.com/trump-tariffs-prices-costco-grocery-shopping-trade-war-2025-4
business,12 tips to help grow your small business in an age of uncertainty,Take the next step in your small business journey with a plan for growth.,2025-04-23T17:57:10Z,https://www.businessinsider.com/sc/how-to-grow-a-small-business
business,Don't call it DEI: Recruiters explain the hiring landscape under Trump 2.0,"Despite rollbacks, some hiring managers and employers are still prioritizing DEI, recruiters told Business Insider.",2025-04-17T08:03:01Z,https://www.businessinsider.com/dei-hiring-amid-trump-executive-order-recruiters-hiring-managers-2025-4
business,"Older Americans who need to unretire are starting businesses, earning $15 an hour, or struggling to find anything at all",Some retirees told Business Insider they're going back to work amid economic uncertainty.,2025-04-26T08:01:01Z,https://www.businessinsider.com/unretiring-economic-concerns-recession-tariffs-boomers-back-to-work-2025-4
business,Three Business Insider journalists named Livingston Award finalists,"Three Business Insider journalists named as finalists for the Livingston Awards, which honor excellence in journalism by young journalists.",2025-04-23T20:47:46Z,https://www.businessinsider.com/three-business-insider-journalists-named-livingston-award-finalists-2025-4
business,Reddit CEO Steve Huffman says the company used to be so idealistic that people were 'not working very hard',Reddit's CEO said employees had a tendency to put big-picture idealism over business.,2025-05-05T09:46:08Z,https://www.businessinsider.com/reddit-employees-werent-working-hard-ceo-steve-huffman-said-2025-5
business,"Market turmoil lifts Goldman's trading, hurts dealmaking business",Goldman reported record high trading revenues as the firm rode the waves of global markets. But dealmaking uncertainty hurt investment bankers.,2025-04-14T12:46:57Z,https://www.businessinsider.com/goldman-sachs-first-quarter-trading-market-david-solomon-volatility-dealmaking-2025-4
business,"100 days into Trump's economy, one thing's clear: Americans are worried","BI examined sentiment data, markets chaos, and interviews with small business owners, consumers, and economists. They point toward one thing.",2025-04-29T13:58:35Z,https://www.businessinsider.com/100-days-trump-economy-drama-uncertainty-stagflation-consumers-tariffs-2025-4
business,Pulitzer Prize winner says his sports experience helped in photographing the bullet whizzing by Trump: 'I didn't flinch',"""This is by far the most dangerous situation I've ever been in,"" Pulitzer Prize winner Doug Mills told Business Insider.",2025-05-06T21:01:21Z,https://www.businessinsider.com/pulitzer-prize-winner-photographing-bullet-hit-trump-did-not-flinch-2025-5
business,It's a chaotic world right now. Here's why that makes it the ideal time to start a business.,"""It's always a great time to start a business — and some of the most successful businesses are started during recessions.""",2025-05-05T08:05:01Z,https://www.businessinsider.com/should-you-start-a-business-during-recession-general-economic-uncertainty-2025-4
business,"In an Easter post, Trump said the businessmen who've criticized his tariffs are bad at both business and politics","Business leaders initially criticized Trump's sweeping tariffs, though some expressed relief when the president introduced a 90-day pause.",2025-04-21T06:01:32Z,https://www.businessinsider.com/trump-businessmen-against-tariffs-are-bad-at-business-and-politics-2025-4
business,A photographer spotlighted Holocaust survivors by pairing them with celebrities in moving portraits,Fashion photographer Bryce Thompson paired Holocaust survivors with celebrities and business leaders in an intimate portrait series.,2025-04-24T14:57:40Z,https://www.businessinsider.com/photos-holocaust-survivors-celebrities-bryce-thompson-borrowed-spotlight-2025-4
business,CEOs can't stop saying these 4 words on earnings calls,"Business Insider tallied up how many times CEOs said ""Trump"" and ""tariffs"" in earnings calls based on data from AlphaSense.",2025-04-24T23:47:45Z,https://www.businessinsider.com/ceos-cant-stop-saying-these-words-earnings-calls-2025-4
business,Google is heading to Hollywood to upgrade its star power,"Google is working with Range Media Partners to help produce films and TV shows, Business Insider has learned.",2025-05-05T15:56:04Z,https://www.businessinsider.com/google-tv-movie-hollywood-boost-tech-image-hundred-zeros-2025-5
business,Inside one of the wildest weeks for markets in recent memory,"""It seems that we go from panic to euphoria to terror,"" one analyst told Business Insider. Stocks and bonds swung violently, while the dollar plunged.",2025-04-11T20:03:10Z,https://www.businessinsider.com/stock-market-today-sell-off-bond-yields-trump-trade-tariffs-2025-4
business,A flight carrying hundreds had to divert after someone's tablet got stuck in a business class seat,A Lufthansa Airbus A380 flight to Munich had to divert to Boston after someone's tablet — reportedly an iPad — got stuck in a business class seat.,2025-04-26T07:45:27Z,https://www.businessinsider.com/lufthansa-flight-diverted-boston-tablet-stuck-business-class-seat-2025-4
business,Vimeo Promo Codes and Deals: Save Up to 40%,"Learn more about today’s Vimeo promo codes & discounts. Save up to 40% on paid membership plans, get a free trial, and more.",2025-04-22T05:20:00Z,https://www.wired.com/story/vimeo-promo-code/
business,"The Official Office 2024 Lifetime License Is Priced at a Record Low, Now 40% Off",Choosing between Office 2024 and Microsoft 365 is a no-brainer.,2025-04-14T13:46:04Z,https://gizmodo.com/the-official-office-2024-lifetime-license-is-priced-at-a-record-low-now-40-off-2000588991
business,"In the wake of tariffs, cargo at the Port of LA is down 35%","The immediate impact of the cargo decline affects virtually every business around the ports, but port officials say this downturn will soon be felt much more broadly.",2025-05-07T23:03:48Z,https://www.npr.org/2025/05/07/nx-s1-5389955/los-angeles-port-tariffs
business,'Project Greenland': How Amazon overcame a GPU crunch,How Amazon's big retail business navigated GPU shortages by emphasizing ROI and tightening its approval process to balance internal supply and demand.,2025-04-22T09:00:02Z,https://www.businessinsider.com/amazon-strategy-overcome-gpu-shortages-nvidia-2025-4
business,A couple who lives part-time in Bali spent $1.7 million building 2 luxury villas that they rent out for parties,"Justin and Annabelle Parfitt spend half the year in Bali, where they built a $1.7 million compound and now run a short-term rental business.",2025-04-20T10:49:01Z,https://www.businessinsider.com/couple-built-bali-party-villas-short-term-rentals-2025-4
business,I'm a cookie baker from Denver already dealing with soaring egg and chocolate prices. Trump's tariffs are going to hit my small business hard.,"Beth Pratt started a small cookie business in Denver in December. Since then, she's been hit with challenges, from skyrocketing egg prices to tariffs.",2025-04-14T05:18:18Z,https://www.businessinsider.com/small-cookie-business-egg-chocolate-prices-trump-tariffs-hit-hard-2025-4
business,I've worked in AI for 15 years. There are a few telltale signs of AI washing.,"John Fitzpatrick, the CTO of a document management startup and an engineer behind Siri, tells Business Insider the key signs to spot AI washing.",2025-05-01T00:00:01Z,https://www.businessinsider.com/ai-washing-signs-john-fitzpatrick-nitro-cto-apple-engineer-2025-4
business,Warren Buffett's biographer says he's 'literally not replaceable' as Berkshire Hathaway enters a new era,"Alice Schroeder, who wrote a popular biography on Warren Buffett, spoke to Business Insider about his life and legacy amid news of his resignation.",2025-05-04T08:51:01Z,https://www.businessinsider.com/warren-buffett-berkshire-hathaway-biographer-alice-schroeder-2025-5
business,"AWS preps staff for customer concerns over tariffs, data risks, and possible foreign cloud restrictions by Trump","Amazon's cloud business seems less exposed to tariffs than its e-commerce operation. And yet, AWS is advising staff on potential customer questions.",2025-04-30T08:35:02Z,https://www.businessinsider.com/aws-preps-staff-customer-questions-tariffs-trump-cloud-restrictions-2025-4
business,Google loses adtech monopoly case,"The US Department of Justice has won its antitrust case against Google, which accused the company of operating a monopoly in the advertising technology industry. In a ruling on Thursday, US District Judge Leonie Brinkema says Google’s anticompetitive practice…",2025-04-17T15:03:39Z,https://www.theverge.com/news/650665/google-loses-ad-tech-antitrust-monopoly-lawsuit
business,This is Siri-ous: Apple is told it should tone down its bold AI claims,"Apple is facing scrutiny over its  AI marketing. The Better Business Bureau advises it to tone down claims about ""Apple Intelligence"" features.",2025-04-22T18:32:42Z,https://www.businessinsider.com/apple-ai-siri-advertising-claims-watchdog-delay-2025-4
business,Tesla's 'dismal' quarter was rescued by a lucrative side hustle. That may not last.,Tesla's booming energy business faces a serious speed bump in the form of the escalating trade war between the US and China.,2025-04-23T10:31:44Z,https://www.businessinsider.com/teslas-dismal-quarter-rescued-energy-storage-side-hustle-elon-musk-2025-4
business,Honda orders US staff back to the office by October. Read the memo.,"An internal memo viewed by Business Insider says that Honda's 30,000 US-based employees must return to the office by October 6.",2025-04-24T23:30:13Z,https://www.businessinsider.com/honda-return-to-office-order-rto-us-staff-2025-4
business,Ex-DoD official warns trying to make the Pentagon run like a business could backfire,"A former Biden-era Pentagon official warned that running the Pentagon like a business is a bad idea that could ""backfire in terrifying ways.""",2025-04-24T22:28:01Z,https://www.businessinsider.com/ex-official-warns-pentagon-isnt-a-business
business,"The top companies you want on your résumé if you work in cybersecurity, according to recruiters",Business Insider spoke to six cybersecurity recruiting experts to hear which companies are considered the top names to have on your résumé.,2025-04-13T10:37:02Z,https://www.businessinsider.com/top-companies-cybersecurity-resume-experience-recruiters-2025-4
business,ServiceNow dodges the dreaded DOGE hit,"ServiceNow CEO Bill McDermott reveals how the company avoided the DOGE impact, with its US public sector business growing over 30% year-over-year.",2025-04-23T21:54:03Z,https://www.businessinsider.com/servicenow-doge-saas-software-government-spending-ai-customers-2025-4
business,What CEOs are saying about how tariffs will impact their businesses — and your wallet,CEOs have been grilled on tariffs and their impact on business and consumers' wallets in recent earnings calls and interviews. Here's their answers.,2025-04-30T16:33:23Z,https://www.businessinsider.com/what-ceos-are-saying-about-tariffs-consumer-price-increases-2025-4
business,Adidas says tariffs are going to make your sneakers more expensive,"Adidas warns that Trump's tariffs will lead to an increase in sneaker prices in the US as it relies on imports, affecting its business outlook.",2025-04-30T10:30:24Z,https://www.businessinsider.com/adidas-says-tariffs-are-going-to-make-sneakers-more-expensive-2025-4
business,"Millennium, Citadel, and Point72 alums are building the next wave of multistrategy funds","""When you sit in those circles, when you sit on those committees, you learn about how to run this kind of business,"" one hedge fund  recruiter said.",2025-04-11T09:00:02Z,https://www.businessinsider.com/millennium-citadel-point72-alumni-network-hedge-funds-leadership-2025-4
business,'It's literal hell': Coachella festivalgoers say they've been waiting in traffic for 12 hours to get into the campgrounds,"Coachella festivalgoers told Business Insider they'd been waiting hours to get into the campgrounds on Thursday, and they had no access to toilets.",2025-04-10T23:22:31Z,https://www.businessinsider.com/coachella-attendees-stuck-in-line-for-campgrounds-2025-4
business,A new internal memo from the CFPB says it will 'deprioritize' its student-loan oversight in Trump's latest move to overhaul the consumer watchdog,"Business Insider reviewed an internal memo from the CFPB calling on its employees to ""deprioritize"" student loans, medical debt, and more.",2025-04-17T03:02:08Z,https://www.businessinsider.com/new-internal-memo-cfpb-deprioritize-student-loans-medical-debt-trump-2025-4
business,"We shopped Target's new Kate Spade line, and it's the chain's best designer collaboration yet",Target and Kate Spade launched a limited-edition collaboration on Saturday. Three Business Insider reporters loved the line for different reasons.,2025-04-17T17:07:35Z,https://www.businessinsider.com/target-kate-spade-collection-review-2025-4
business,Uber's plan to grow its ride-hailing business includes suburbanites who already own a car,"Uber is trying to grow its business in the suburbs, where people tend to use Uber Reserve more and are increasingly grabbing rides to dinners out.",2025-05-08T08:45:02Z,https://www.businessinsider.com/uber-focusing-on-suburbs-grow-ride-hailing-business-2025-5
business,How airlines turned into 'credit card companies with wings',"Flying travelers from city to city is the cornerstone of the airline business, but credit card rewards have become a bigger part of the profits.",2025-05-08T08:04:01Z,https://www.businessinsider.com/airlines-credit-cards-loyalty-miles-rewards-profits-delta-united-american-2025-5
business,Flights from India to Europe and North America are taking 4 extra hours and requiring fuel stops as airlines avoid Pakistan,An Air India spokesperson confirmed to Business Insider that flights to North America have to stop for fuel in Vienna and Coperhagen.,2025-04-28T20:01:40Z,https://www.businessinsider.com/air-india-flights-extra-hours-to-avoid-closed-pakistan-airspace-2025-4
business,We shopped the new Gap x Dôen collab and only found one piece worth splurging on,Two Business Insider reporters checked out the new Gap x Dôen collection on Friday. They liked the line but found some of the basics overpriced.,2025-05-02T20:39:23Z,https://www.businessinsider.com/gap-x-doen-collaboration-review-2025-5
business,A 12-time delegate shares 7 tips to make the Milken Global Conference pay dividends,"To maximize your time and business opportunities at the Milken Institute Global Conference, plan which events to attend and network strategically.",2025-05-03T14:42:29Z,https://www.businessinsider.com/milken-institute-global-conference-networking-success-tips-2025-5
business,Jon Voight says he's sent Trump a 'comprehensive plan' to 'make Hollywood great again',"""The President loves the entertainment business and this country, and he will help us make Hollywood great again,"" Voight said in a statement.",2025-05-06T04:32:01Z,https://www.businessinsider.com/jon-voight-help-trump-make-hollywood-great-again-2025-5
business,Check out the exclusive pitch deck that landed no-code AI agent startup StackAI a $16 million funding round from Lobby VC,"No-code AI startup StackAI raises $16 million Series A from Lobby VC, offering enterprises tools to create AI agents for business operations.",2025-05-10T09:00:01Z,https://www.businessinsider.com/pitch-deck-ai-agent-startup-stackai-series-a-funding-round-2025-5
business,David's Bridal CEO says the company raced to avoid price hikes over tariffs by shifting dress production out of China,"Kelly Cook, the CEO of David's Bridal, told Business Insider the company started moving dress production out of China months ago.",2025-04-16T01:04:46Z,https://www.businessinsider.com/davids-bridal-ceo-wedding-dress-production-china-tariffs-raising-prices-2025-4
business,'Andor' season two is a 'Star Wars' masterpiece thanks to its surprising realism,"""Andor"" season two is a gripping masterpiece that elevates the ""Star Wars"" franchise. Its cast told Business Insider that it is ""timeless.""",2025-04-22T14:46:12Z,https://www.businessinsider.com/andor-season-two-review-star-wars-masterpiece-cast-timeless-2025-4
