title,description,publishedAt,url,category
"Today's NYT Connections: Sports Edition Hints and Answers for May 10, #229","Here's today's Connections: Sports Edition answer and hints for groups. These clues will help you solve The New York Times' popular puzzle game, Connections: Sports Edition, every day.",2025-05-09T21:19:00Z,https://www.cnet.com/tech/gaming/todays-nyt-connections-sports-edition-hints-and-answers-for-may-10-229/,sports
ESPN's Flagship Streaming App Reportedly Has a Super Simple Name,"The all-access streaming service should arrive this fall, and will include live sports and more -- with an interactive betting element.",2025-05-09T17:55:12Z,https://www.cnet.com/tech/services-and-software/espns-flagship-streaming-app-reportedly-has-a-super-simple-name/,sports
"Garmin Epix Gen 2 Is Now Closer to $0 Than Its Launch Price, Amazon Clears Out Inventory",It almost feels like a pricing mistake because the deal is that incredible.,2025-05-09T11:10:37Z,https://gizmodo.com/garmin-epix-gen-2-is-now-closer-to-0-than-its-launch-price-amazon-clears-out-inventory-2000600058,sports
'Not nice to hear' - were Trent jeers 'shocking' or 'understandable'?,"As Trent Alexander-Arnold is booed by a section of the Liverpool fans after appearing for the first time since announcing he is to leave in the summer, BBC Sport looks at the reaction.",2025-05-11T19:57:34Z,https://www.bbc.com/sport/football/articles/cp3n55ng3nro,sports
"Forget JBL, LG’s Best Sound Bar and Speaker Bundle at Nearly 60% Off Sounds Almost Free",A big drop on a home theater upgrade gets you this LG Soundbar for over half off.,2025-05-09T14:05:22Z,https://gizmodo.com/forget-jbl-lgs-best-sound-bar-and-speaker-bundle-at-nearly-60-off-sounds-almost-free-2000600036,sports
"Today's NYT Mini Crossword Answers for Thursday, May 8","Here's today's NYT Mini Crossword answer. These answers will help you solve New York Times' popular crossword game, Mini Crossword, every day!",2025-05-08T02:10:25Z,https://www.cnet.com/tech/gaming/todays-nyt-mini-crossword-answers-for-thursday-may-8/,sports
How to watch Giro d'Italia: Live stream the 2025 race free from anywhere,The first of the 2025 Grand Tour races has arrived. We'll show you how to watch Giro d'Italia.,2025-05-09T08:00:01Z,https://www.businessinsider.com/guides/streaming/how-to-watch-giro-ditalia-cycling-2025,sports
"Republicans seek more state laws on transgender people, putting Democrats on the spot","Since North Carolina passed a ""bathroom"" law in 2016, the number of bills has grown and Republicans have used the issue in campaigns. Democrats are still working out how to respond.",2025-05-10T10:00:00Z,https://www.npr.org/2025/05/10/nx-s1-5377402/republicans-democrats-transgender-sports-legislatures,sports
Forget the Razr 2025: you can score up to 75% OFF the Motorola Razr Plus (2023) at Best Buy right now,Best Buy is offering a massive deal on the 2023 foldable.,2025-05-08T16:57:44Z,https://www.androidcentral.com/phones/motorola/forget-the-razr-2025-you-can-score-up-to-75-percent-off-the-motorola-razr-plus-2023-at-best-buy-right-now,sports
Michael Jordan joins NBC as the network revives its NBA coverage,"It has been over 20 years since NBC had rights to broadcast NBA games. Its last run was during the 90s, which coincided with Michael Jordan's reign over basketball.",2025-05-13T01:00:31Z,https://www.npr.org/2025/05/12/nx-s1-5396005/michael-jordan-nba-nbc,sports
Watch the New Trailer for Apple's Big Summer Movie Starring Brad Pitt,"Apple today shared a second trailer for its upcoming ""F1"" racing film, which will have a theatrical release via Warner Bros. Pictures.





In the underdog comeback film, Brad Pitt stars as an F1 driver who was an up-and-coming talent in the 1990s, until an a…",2025-05-12T14:29:57Z,https://www.macrumors.com/2025/05/12/apple-f1-movie-second-trailer/,sports
Final designs revealed for Queen Elizabeth memorial,The memorial commemorating the monarch will be built at St James's Park in central London.,2025-05-07T11:00:32Z,https://www.bbc.com/news/articles/c9w8wlqxxl0o,sports
'I Broke Up with Google Search. It was Surprisingly Easy.',"Inspired by researchers who'd bribed people to use Microsoft's Bing for two weeks (and found some wanted to keep using it), a Washington Post tech columnist also tried it — and reported it ""felt like quitting coffee."" 

""The first few days, I was jittery. I k…",2025-05-10T18:34:00Z,https://tech.slashdot.org/story/25/05/10/0247242/i-broke-up-with-google-search-it-was-surprisingly-easy,sports
Need a last-minute Mother's Day gift? This popular Kindle has crashed back to its lowest price EVER at Amazon,The Amazon Kindle Colorsoft Signature Edition is our favorite color e-reader.,2025-05-07T17:36:36Z,https://www.androidcentral.com/tablets/kindle/need-a-last-minute-mothers-day-gift-this-popular-kindle-has-crashed-back-to-its-lowest-price-ever-at-amazon,sports
This AI-Powered Tennis Ball Machine Can Simulate Training Against Legends Like Roger Federer,"This AI-Powered Tennis Ball Machine Can Simulate Training Against Legends Like Roger FedererWhen you talk about AI in sports, it’s usually a virtual player. Like a human playing chess versus an AI , or playing a game...",2025-05-11T01:45:51Z,https://www.yankodesign.com/2025/05/10/this-ai-powered-tennis-ball-machine-can-simulate-training-against-legends-like-roger-federer/,sports
Nintendo fiscal year sales drop 30% ahead of Switch 2 launch,"Nintendo reported relatively weak sales of 1,164.9 billion yen for its fiscal year ended March 31, 2025, down 30.3% from 1,671.8 billion yen a year earlier.",2025-05-08T09:40:00Z,https://venturebeat.com/games/nintendo-fiscal-year-sales-drop-30-ahead-of-switch-2-launch/,sports
KRQE Weather Academy visits Adobe Acres Elementary School,"ALBUQUERQUE, N.M. (KRQE) – Meteorologists with KRQE News 13 continue to visit schools around the metro area as part of KRQE’s Weather Academy. KRQE...",2025-05-10T00:39:38Z,https://www.krqe.com/weather-academy/krqe-weather-academy-visits-adobe-acres-elementary-school-2/,sports
Make Android TV live events better with these 8 hacks,Want to stream live events on Android TV but don't know where to begin? We've got you covered with these 8 hacks!,2025-05-10T08:50:10Z,https://www.androidpolice.com/android-tv-hacks-for-watching-live-events/,sports
Downtown Kansas City business owners issuing a warning: ‘This isn’t a political issue—it’s a safety issue’,"After decades of serving the Kansas City community, downtown business owners say they’re at a breaking point.",2025-05-07T02:11:00Z,https://fox4kc.com/news/downtown-kansas-city-business-owners-issuing-a-warning-this-isnt-a-political-issue-its-a-safety-issue/,sports
Motorola's Moto Watch needs to start living up to the brand name,"A licensed partner made the old budget Moto Watches. Now Motorola is stepping in, but it's not clear yet how they'll do things differently.",2025-05-10T21:00:00Z,https://www.androidcentral.com/wearables/motorola-moto-watch-needs-to-start-living-up-to-brand,sports
"US, China to hold first major trade talks in Switzerland",The meeting is a potential first step in ending the trade war between the United States and China.,2025-05-07T10:06:58Z,https://www.newsnationnow.com/world/china-tariff-negotiations-trade-switzerland/,sports
Apple TV+ hopes its next Ted Lasso is here with new golf comedy,"Apple has had a strong spring of new TV shows, and heading into the summer there’s no slowing down. Coming next month, the golf comedy Stick looks like the next Apple TV+ attempt at striking Ted Lasso gold.



 more…",2025-05-08T15:09:12Z,https://9to5mac.com/2025/05/08/apple-tv-hopes-its-next-ted-lasso-is-here-with-new-golf-comedy/,sports
1.1-lbs (17.64-oz) Sports Research Creatine Monohydrate (Unflavored) $15.65 w/ Subscribe & Save,"Sports Research via Amazon [amazon.com] has *1.1-Lb Sports Research Creatine Monohydrate Powder *(100 Servings, Unflavored) for $22.36 - 20% when you 'clip' the coupon on product page - 10% when you...",2025-05-12T18:44:01Z,https://slickdeals.net/f/18309475-s-s-15-65-1-1-lb-sports-research-creatine-monohydrate-powder-100-servings-unflavored-at-amazon?utm_source=rss&utm_content=fp&utm_medium=RSS2,sports
Garb: Prep,Wax London Long Sleeve T-Shirt / $81. Velasca Zuccarello Shirt / $240. Stiksen 105 Ventile Cap / $89. Persol 3274S Folding Sunglasses / $408. Clae Deane Sneakers / $170. David Gandy Wellwear Tapered Pant / $237....,2025-05-12T21:15:00Z,https://uncrate.com/garb-prep/,sports
H. Moser & Cie. Streamliner Tourbillon Skeleton Rainbow Watch,"Skeletonized dials are often all-metal affairs meant to highlight the engineering of the movement. H. Moser & Cie.'s Streamliner Tourbillon Skeleton is no different, but gains a bright dose of color in this Rainbow edition. Surrounding the dial are 60...",2025-05-09T20:00:08Z,https://uncrate.com/h-moser-cie-streamliner-tourbillon-skeleton-rainbow-watch/,sports
Hublot MP-10 Tourbillon All Black & Sapphire Watches,"Announced in early 2024, the Hublot MP-10 Tourbillon was a bold reimagining of what a watch could be, using a series of cylinders and linear weights to power the watch, which indicated the time via similarly circular mechanisms. It's now...",2025-05-08T18:21:24Z,https://uncrate.com/hublot-mp-10-tourbillon-all-black-sapphire-watches/,sports
2010 Porsche Cayenne S Transsyberia,"One of 285 special-edition examples built to celebrate Porsche's victories in the Transsyberia Rally, this 2010 Porsche Cayenne S is a formidable off-road machine. Modifications include an aftermarket suspension, a Berg Peaks lift kit, underbody skid plates, …",2025-05-12T14:54:20Z,https://uncrate.com/2010-porsche-cayenne-s-transsyberia/,sports
Aspinal of London Golf Set,"Crafted for the fairway, the Aspinal Golf Set Collection is an essential for any golfer who values both form and function. Handcrafted from premium full-grain leather and lined with moiré silk, each piece — the Ball Holder, Scorecard Holder, and...",2025-05-07T16:56:06Z,https://uncrate.com/aspinal-of-london-golf-set/,sports
Soundcore Liberty 5 Wireless Earphones,"Providing a solid mix of features and value, Soundcore's Liberty 5 wireless earphones are a reasonable alternative to more ubiquitous options. Their Adaptive ANC 3.0 technology uses four of the six microphones to adjust every 0.3 seconds to keep ambient...",2025-05-09T17:06:08Z,https://uncrate.com/soundcore-liberty-5-wireless-earphones/,sports
SMMT Outdoor,"Born at elevation and built for what comes after, SMMT (pronounced ""summit') blends timeless design with rugged utility. Rooted in the founders coastal roots and named for the brand's Summit County (Park City) home, the brand designs outdoor accessories that.…",2025-05-12T20:08:17Z,https://uncrate.com/smmt-outdoor/,sports
"I'm a good mom, even when my kids aren't. Their behavior doesn't reflect my parenting skills.",I don't like people telling me I'm doing a good job as a mom when my kids are thriving. I'm doing a good job also when they are struggling.,2025-05-08T23:49:01Z,https://www.businessinsider.com/my-kids-behavior-doesnt-reflect-on-my-parenting-2025-5,sports
Disney is building its first-ever Middle East theme park,Disney announced that it is building a new theme park and resort in Abu Dhabi ahead of its second-quarter earnings call on Wednesday.,2025-05-07T13:07:10Z,https://www.businessinsider.com/disney-building-seventh-theme-park-and-resort-in-abu-dhabi-2025-5,sports
Netflix has a new cure for decision fatigue,"Netflix is updating its homepage to combat decision fatigue and boost time spent on the platform with vertical video, AI search, and more.",2025-05-07T17:27:32Z,https://www.businessinsider.com/netflix-updates-homepage-combat-decision-fatigue-ai-search-2025-5,sports
The surgeon who used F1 pitstop techniques to save lives of babies,Professor Martin Elliott reflects on how watching a Formula 1 race two decades ago led to an unlikely partnership with Ferrari that transformed practices at Great Ormond Street and other hospitals,2025-05-11T21:15:56Z,https://www.thetimes.com/sport/formula-one/article/professor-martin-elliott-interview-surgeon-f1-pitstops-babies-ferrari-j3sbkjssk,sports
"10 Best Wrestling TV Shows, Ranked","Thanks to the WWE, wrestling is huge on TV, but outside of the traditional sports coverage, these are the best wrestling TV shows ever.",2025-05-11T19:15:00Z,https://www.slashfilm.com/1848150/best-wrestling-tv-shows-ranked/,sports
Clint Eastwood's Historical Sports Movie Is An Underrated Gem With A Pair Of A-Listers,This true story-inspired Clint Eastwood film makes for a respectful biopic but also delivers where it counts as a sports movie.,2025-05-11T14:00:00Z,https://www.slashfilm.com/1849515/clint-eastwood-sports-movie-underrated-invictus/,sports
3 Mobile County men arrested in FBI-led ‘Operation Restore Justice’,"MOBILE COUNTY, Ala. (WKRG) — A five-day coordinated enforcement effort led by the FBI resulted in the arrests of 205 child sexual abuse offenders and the...",2025-05-07T20:56:14Z,https://www.wkrg.com/mobile-county/3-mobile-county-men-arrested-in-fbi-led-operation-restore-justice/,sports
"‘We’re not gonna force the issue’: Standoff in south Wichita ends, police walk away","Just after 6 p.m., an incident prompted officers to gather in the 2100 block of S. Seneca St.",2025-05-08T23:54:06Z,https://www.ksn.com/news/incident-prompts-large-police-presence-in-south-wichita/,sports
Pensacola police: Beware of ‘jugging’ — 2 people already robbed of thousands,"PENSACOLA, Fla. (WKRG) — Two Pensacola residents became victims this week after being followed and then robbed after withdrawing money from an ATM — a crime ...",2025-05-09T20:43:14Z,https://www.wkrg.com/northwest-florida/escambia-county/pensacola-police-beware-of-jugging-2-people-already-robbed-of-thousands/,sports
REI’s new CEO started her tenure by apologizing for the brand’s endorsement of Trump’s interior secretary: ‘Our public lands are under attack’,Athleta's former CEO Mary Beth Laughton started her CEO tenure at REI on March 31.,2025-05-12T12:57:38Z,https://finance.yahoo.com/news/rei-ceo-started-her-tenure-125738983.html,sports
One Of Kevin Costner's Best Sports Movies Was Rejected By Nearly Every Studio,"Kevin Costner has starred in a handful of sports movies, but one of his best almost didn't see the light of day ... or become a massive hit at the box office.",2025-05-10T13:20:00Z,https://www.slashfilm.com/1850074/kevin-costner-best-sports-movie-rejected-studios-bull-durham/,sports
Hits and misses: Man Utd deserve to be in relegation scrap,The Sky Sports football writers analyse Sunday's Premier League action.,2025-05-11T19:07:00Z,https://www.skysports.com/football/news/11661/13365690/man-utd-deserve-to-be-in-relegation-scrap-trent-alexander-arnold-circus-and-fragile-tottenham-in-hits-and-misses,sports
Motorola Razr Ultra 2025 vs. Razr Plus 2023: Everything is better,"Motorola's Razr Ultra 2025 has a flagship Snapdragon chip for the first time, but is it worth the upgrade over the Razr Plus 2023?",2025-05-12T17:29:07Z,https://www.androidcentral.com/phones/motorola/motorola-razr-ultra-2025-vs-razr-plus-2023,sports
Dave Portnoy Net Worth Exposed: How He Made (And Lost) A Fortune,"Dave Portnoy Net Worth Exposed: Explore how the sports media founder made millions with Barstool Sports, plus details on stock losses. Is his net worth near 150 million?",2025-05-12T10:46:28Z,https://www.boredpanda.com/dave-portnoy-net-worth/,sports
The Celeb-Loved ‘Everyone Watches Women’s Sports’ Tee Just Got a Nike Launch,Nike recently partnered with media company Togethxr to launch a line of limited-edition 'Everyone Watches Women's Sports' clothing. Shop the drop now,2025-05-08T20:49:23Z,http://www.rollingstone.com/product-recommendations/style/nike-everyone-watches-womens-sports-collab-buy-online-1235334024/,sports
"Today's NYT Mini Crossword Answers for Tuesday, May 13","Here's today's NYT Mini Crossword answer. These answers will help you solve New York Times' popular crossword game, Mini Crossword, every day!",2025-05-13T02:08:46Z,https://www.cnet.com/tech/gaming/todays-nyt-mini-crossword-answers-for-tuesday-may-13/,sports
"Today's NYT Mini Crossword Answers for Wednesday, May 7","Here's today's NYT Mini Crossword answer. These answers will help you solve New York Times' popular crossword game, Mini Crossword, every day!",2025-05-07T02:27:50Z,https://www.cnet.com/tech/gaming/todays-nyt-mini-crossword-answers-for-wednesday-may-7/,sports
Gregg Popovich’s Life Lessons,The San Antonio Spurs coach built a thoughtful team culture that spread far beyond his own players.,2025-05-08T13:30:00Z,https://www.theatlantic.com/culture/archive/2025/05/gregg-popovich-legacy/682722/,sports
Esports World Cup spells out the path to Riyadh for 200 game tournaments,The Esports World Cup Foundation (EWCF) has unveiled the full scope of the qualification system for the Esports World Cup 2025.,2025-05-09T17:28:00Z,https://venturebeat.com/games/esports-world-cup-spells-out-the-path-to-riyadh-for-200-game-tournaments/,sports
Moneyball: The True Story Behind The Brad Pitt Movie Explained,"Moneyball is one of the best sports movies ever made. The film is adapted from a non-fiction book and based on a true story, but just how accurate is it?",2025-05-10T17:00:00Z,https://www.slashfilm.com/1852164/brad-pitt-movie-moneyball-true-story-explained/,sports
Goodbye Goodison: Everton set for final bow at 'last of its kind' stadium,Watch Goodbye Goodison the documentary on Sky Sports News at 11am on Tuesday.,2025-05-12T10:10:00Z,https://www.skysports.com/football/news/11095/13366339/goodison-park-everton-play-for-final-time-at-last-of-its-kind-stadium-on-sunday-vs-southampton,sports
Google Search’s new Discussions feature feels like its Reddit moment,"Google is testing 'Discussions' within Search results, allowing users to comment and engage on certain queries. Read on to learn more!",2025-05-12T10:19:28Z,https://www.androidauthority.com/google-search-discussions-beta-3556519/,sports
"It looks like Samsung isn't holding anything back for One UI 8 Watch, and I'm pumped","A much-needed injection of excitement is coming to the stale Galaxy Watch 8 formula, according to leaked code for the upcoming One UI 8 Watch update.",2025-05-09T16:00:10Z,https://www.androidcentral.com/wearables/samsung-galaxy-watch/it-looks-like-samsung-isnt-holding-anything-back-for-one-ui-8-watch-and-im-pumped,sports
10-lb NOW Sports Whey Isolate Protein Powder (Creamy Chocolate) $90.95 w/ Subscribe & Save + Free Shipping,"$90.96 on Amazon when you select Subscribe and Save and clip the _$17.05 coupon_. 
 
*NOW Sports Whey Protein Isolate - Informed Sport Certified Creamy Chocolate* 
Protein Powder 
With BCAAs • 25 G...",2025-05-08T19:47:40Z,https://slickdeals.net/f/18302119-now-sports-10-lb-whey-protein-isolate-creamy-chocolate-138-servings-90-96-w-s-s?utm_source=rss&utm_content=fp&utm_medium=RSS2,sports
Samsung’s Now Bar could get a welcome upgrade in One UI 8,"Samsung launched the Now Bar as part of its Android 15 update, but a new leak shows us what to expect from the widget in One UI 8.",2025-05-07T07:42:11Z,https://www.androidauthority.com/samsung-one-ui-8-now-bar-upgrade-leak-3555116/,sports
"Patrick Whitesell Launches New Football Representation Firm, WIN Sports Group","Patrick Whitesell has launched WIN Sports Group, a new, independently owned football representation firm built to serve athletes, coaches, and leaders. Whitesell, who previously co-founded WME and Endeavor Holdings, where he was co-CEO and executive chairman,…",2025-05-12T12:02:58Z,http://deadline.com/2025/05/patrick-whitesell-launches-win-sports-group-football-representation-1236393484/,sports
American Dad Will Officially Return to Fox in the 2026 Midseason,"It’s back, once again. Seth MacFarlane’s American Dad is returning to Fox once more and is now officially slated to have its second debut on the network in 2026, alongside new episodes of MacFarlane’s other hit series Family Guy.",2025-05-12T16:32:44Z,https://www.ign.com/articles/american-dad-will-officially-return-to-fox-in-the-2026-midseason,sports
How your streaming subscriptions became the new cable package,Streaming bundles are slowly reshaping how we watch (and pay for) TV,2025-05-11T15:18:10Z,https://www.androidpolice.com/streaming-bundles-recreating-cable/,sports
"Today's NYT Mini Crossword Answers for Saturday, May 10","Here's today's NYT Mini Crossword answer. These answers will help you solve New York Times' popular crossword game, Mini Crossword, every day!",2025-05-10T02:16:10Z,https://www.cnet.com/tech/gaming/todays-nyt-mini-crossword-answers-for-saturday-may-10/,sports
"Google Search now lets you debate results like it’s a forum, but there's a catch",Google just added a Reddit-style twist to Google Search,2025-05-12T14:10:49Z,https://www.androidpolice.com/google-search-discussion-panel/,sports
"Truist Championship 2025: TV Schedule Today, How to Watch, Stream All the PGA Tour Golf From Anywhere",It's the final Tour event before next week's PGA Championship.,2025-05-08T19:45:00Z,https://www.cnet.com/tech/services-and-software/truist-championship-2025-tv-schedule-today-how-to-watch-stream-all-the-pga-tour-golf-from-anywhere/,sports
Where and why did Arsenal fall short vs PSG?,Sky Sports' Nick Wright analyses Arsenal's defeat over two legs to PSG in the Champions League and pinpoints the areas where they fell short of the French club.,2025-05-08T09:49:00Z,https://www.skysports.com/football/video/30998/13363756/champions-league-where-did-arsenal-all-short-vs-psg,sports
The C8 Corvette Finally Ditches Its Infamous Button Wall for 2026,"Chevrolet has updated the C8-generation Corvette's interior for model year 2026, marking the first major change since the car debuted for 2020.",2025-05-07T14:00:00Z,https://www.roadandtrack.com/news/a64691934/2026-chevrolet-corvette-c8-facelift-no-more-button-wall/,sports
Taliban suspends chess over gambling concerns,"Chess will be suspended until religious considerations are addressed, a spokesman said.",2025-05-11T16:54:52Z,https://www.bbc.com/news/articles/crk24dz8ne5o,sports
"At $13,000, Will This 1980 Porsche 924 Turbo Get Its Due?","Controversial at launch, is this under-appreciated Porsche now a secret classic?",2025-05-08T12:30:00Z,https://www.jalopnik.com/1853907/1980-porsche-924-turbo-for-sale-13000-dollars/,sports
"I swapped my gas truck for a Chinese hybrid. The BYD Shark is great to drive, but one thing worries me.","Wayne Dopson, who swapped his gas truck for a Chinese hybrid, loves his new BYD Shark but is concerned about it's resale value in a couple years.",2025-05-11T04:21:01Z,https://www.businessinsider.com/swapped-gas-truck-for-hybrid-byd-shark-2025-5,sports
Don't let the economy ruin your summer,Trading concerts for streaming subscriptions and airfare for cruises? It's not the worst summer plan if you're worried about the economy.,2025-05-10T07:48:01Z,https://www.businessinsider.com/all-inclusives-save-money-have-fun-recession-budgeting-trends-2025-5,sports
"My teenage sons started strength training, which terrified me. I implemented some rules to keep them safe.","When my sons started going to the gym, I worried they'd hurt themselves or become obsessed with their appearance. I require them to take rest days.",2025-05-09T14:50:31Z,https://www.businessinsider.com/teenage-sons-strength-training-terrified-mom-2025-5,sports
Owen Wilson is an Ex-Pro Golfer in 'Stick' Sports Comedy Series Trailer,"""This game takes and it takes... the game's finally giving me something back!"" Apple TV has unveiled an official trailer for a new sports comedy series called Stick, which they're hoping might be the next big hit following Ted Lasso. It has potential! The ser…",2025-05-08T14:48:35Z,https://www.firstshowing.net/2025/owen-wilson-is-an-ex-pro-golfer-in-stick-sports-comedy-series-trailer/,sports
"Telemundo Pumps Up Sports Volume With 2026 World Cup and NBA, Adds ‘El Señor’ Spinoff Drama","Spanish-language TV leader Telemundo will reflect the priorities of parent company NBCUniversal in the coming season by relying heavily on sports, including the 2026 World Cup, live events and specials to drive viewership. Telemundo is promising advertisers t…",2025-05-08T13:00:00Z,https://variety.com/2025/tv/news/telemundo-sports-2026-world-cup-nba-nbcuniversal-upfront-1236390588/,sports
One Of The Best Basketball TV Shows Is An Underrated Gem On Apple TV+,"Apple TV+ could stand to improve its marketing, as evidenced by the lack of attention the streamer brought to this acclaimed basketball series.",2025-05-12T15:00:00Z,https://www.slashfilm.com/1854029/best-basketball-tv-show-apple-tv-plus-swagger/,sports
Brentford set to listen to Mbeumo and Wissa offers,"Brentford will listen to offers for Bryan Mbeumo and Yoane Wissa but are not under any pressure to sell their players, Sky Sports News understands.",2025-05-08T16:00:00Z,https://www.skysports.com/football/news/11095/13363955/bryan-mbeumo-and-yoane-wissa-brentford-set-to-listen-to-transfer-offers-for-star-forwards-this-summer,sports
18-year-old dies after officer-involved shooting near Lynn Middle School,"EL PASO, Texas (KTSM) — An 18-year-old man is dead after an officer-involved shooting last Thursday, May 8, across from Lynn Middle School in Las Cruces...",2025-05-12T20:56:23Z,https://www.ktsm.com/local/las-cruces-news/18-year-old-dead-after-officer-involved-shooting-near-lynn-middle-school-in-las-cruces/,sports
Little Rock police investigating deadly Sunday night shooting,Officials with the Little Rock Police Department are investigating a deadly shooting that happened Sunday night.,2025-05-12T05:15:00Z,https://www.kark.com/crime/little-rock-police-investigating-deadly-sunday-night-shooting/,sports
