title,description,publishedAt,url,category
County cricket day two: Warwickshire’s batters go big against Surrey – as it happened,Ed Barnard and Zen Malik celebrated centuries as Warwickshire put up a first-innings total of 665 against Surrey,2025-05-10T19:16:43Z,https://www.theguardian.com/sport/live/2025/may/10/warwickshire-v-surrey-nottinghamshire-v-hampshire-and-more-county-cricket-live,sports
Cadan Murley hat-trick lifts Harlequins and shatters Gloucester’s playoff dream,Gloucester slipped out of the playoff places following a 38-19 defeat to a resurgent Harlequins at Twickenham,2025-05-10T19:14:03Z,https://www.theguardian.com/sport/2025/may/10/harlequins-gloucester-premiership-rugby-union-match-report,sports
Bristol enjoy Cardiff takeover and boost playoff hopes with win over Bath,"Bristol beat Bath 36-14 in front of more than 50,000 at Cardiff’s Principality Stadium to boost their playoff hopes",2025-05-10T16:14:34Z,https://www.theguardian.com/sport/2025/may/10/bristol-bath-premiership-rugby-union-match-report,sports
Hull KR tame Dragons and book Wembley date in push to end 40-year drought,"Hull KR beat Catalans Dragons 36-12 to reach the Challenge Cup final, increasing hope of their first silverware for 40 years",2025-05-10T15:46:36Z,https://www.theguardian.com/sport/2025/may/10/hull-kr-catalans-challenge-cup-rugby-league-match-report,sports
Horse racing: Hollie Doyle takes Turner’s British women’s record for winners,"Victory at Ascot on Brindavan was Doyle’s 1,023rd, while Aidan O’Brien’s Ballydoyle operation prospered at Lingfield",2025-05-10T15:39:59Z,https://www.theguardian.com/sport/live/2025/may/10/horse-racing-lingfield-classic-trials-ascot-updates-and-more-live,sports
India great Virat Kohli set to call time on Test cricket career before England tour,Virat Kohli is set to deliver another blow to India’s plans for their imminent tour of England by indicating he wants to retire from Test cricket,2025-05-10T09:30:11Z,https://www.theguardian.com/sport/2025/may/10/virat-kohli-test-cricket-india-england,sports
Brave Australia dealt reality check in defeat to ruthless New Zealand,Wallaroos lose 38-12 to Black Ferns in Pacific Four Series opener as reigning World Cup champions extend hoodoo over rivals to 28 matches,2025-05-10T07:20:36Z,https://www.theguardian.com/sport/2025/may/10/australia-wallaroos-new-zealand-black-ferns-rugby-union-test-match-report,sports
Believe the hype: make Pollock the Lions midweek captain and watch him flourish | Ugo Monye,Northampton flanker brings energy and excitement and can thrive if given the honour and responsibility by Andy Farrell,2025-05-10T07:00:50Z,https://www.theguardian.com/sport/2025/may/10/believe-the-hype-make-pollock-the-lions-midweek-captain-and-watch-him-flourish,sports
"Cricket paying the price for being ruled by the big stick, and the big cheque | Barney Ronay","The suspension of the IPL has ramifications for the game worldwide, but it has allowed itself to be too in thrall to the Indian money machine",2025-05-10T07:00:49Z,https://www.theguardian.com/sport/2025/may/10/cricket-paying-the-price-for-being-ruled-by-the-big-stick-and-the-big-cheque,sports
Draper shows top-five class to see off Darderi after Raducanu deals with late surprise,"Jack Draper won 6-1, 6-4 to reach the Italian Open third round after Emma Raducanu had beaten the late replacement Jil Teichmann 6-2, 6-2",2025-05-09T21:08:30Z,https://www.theguardian.com/sport/2025/may/09/emma-raducanu-moulds-clay-to-her-will-italian-open,sports
England Lion McCann fires up Notts but champions Surrey struggle,Join Tanya Aldred for updates from around the grounds on day one of the latest round of County Championship matches,2025-05-09T19:33:06Z,https://www.theguardian.com/sport/live/2025/may/09/nottinghamshire-v-hampshire-warwickshire-v-surrey-and-more-county-cricket-live,sports
Pollock a proud Lion after ‘nailing it’ for Northampton and England,A call-up from Andy Farrell for the young flanker crowns a remarkable breakthrough year with club and country,2025-05-09T19:08:50Z,https://www.theguardian.com/sport/2025/may/09/pollock-a-proud-lion-after-nailing-it-for-northampton-and-england,sports
England open to hosting IPL after border hostilities prompt suspension,The ECB is open to hosting the remainder of the IPL in September after escalating tension between India and Pakistan prompted the suspension of the lucrative T20 tournament,2025-05-09T16:38:39Z,https://www.theguardian.com/sport/2025/may/09/england-open-to-hosting-ipl-after-border-hostilities-prompt-suspension,sports
UNC says Bill Belichick’s girlfriend still welcome at school despite reports,"UNC on Friday denied reports that Jordon Hudson, the girlfriend of head football coach Bill Belichick, has been banned from its football facilities",2025-05-09T16:24:03Z,https://www.theguardian.com/sport/2025/may/09/bill-belichick-girlfriend-banned-jordon-hudson,sports
